index,published,keyword,domain,language,valid,title,description,url,image,archive,content,quote,de,en,la,added
ede7b1efd6f7d28a82a356c4fa595927,2026-05-02T05:14:28Z,'avalanche climate change',consent.yahoo.com,en,0.2,Game 1 Between Avalanche and Minnesota Wild Is Set For Sunday,The Avalanche host the Minnesota Wild for Game 1 of the second-round series on Sunday at 7 p.m. MT. It’ll […] The post Game 1 Between Avalanche and Minnesota Wild Is Set For Sunday appeared first on Colorado Hockey Now.,https://consent.yahoo.com/v2/collectConsent?sessionId=1_cc-session_737233b3-1df7-48e9-aa11-f63768a0d24a,,,"If you click 'Accept all', we and our partners, including 250 who are part of the IAB Transparency &amp; Consent Framework, will also store and / or access information on a device (in other words, us… [+1046 chars]",,Spiel 1 zwischen Avalanche und Minnesota Wild ist für Sonntag angesetzt. Die Avalanche sind am Sonntag um 19 Uhr Gastgeber der Minnesota Wild für Spiel 1 der Zweitrundenserie. MT. Es wird […] Der Beitrag „Spiel 1 zwischen Avalanche und Minnesota Wild ist für Sonntag angesetzt“ erschien zuerst auf Colorado Hockey Now.,Game 1 Between Avalanche and Minnesota Wild Is Set For Sunday. The Avalanche host the Minnesota Wild for Game 1 of the second-round series on Sunday at 7 p.m. MT. It’ll […] The post Game 1 Between Avalanche and Minnesota Wild Is Set For Sunday appeared first on Colorado Hockey Now.,Ludus 1 Inter NIVIS et Minnesota Ferum positum est Solis. Hospes Avalanche Minnesota Wild pro Ludus 1 seriei secundae rotundae in Dominica hora 7 a.m. MT. […] Post Ludus 1 Inter Avalanche et Minnesota Wild positum est Nam Solis apparuit primum in Colorado Hockey Now.,2026-05-03 06:33:48+00:00
2277c95439d873b5adebfcc39a68a76f,2026-05-03T15:00:00Z,'avalanche mountain',nypost.com,en,0.3,‘Everest season has gotten off to a terrible start’ worries ‘Into Thin Air’ scribe Jon Krakauer,It's been 30 years since Krakauer survived one of the mountain's worst disasters.,https://nypost.com/2026/05/03/lifestyle/everest-tragedy-into-thin-air-scribe-jon-krakauer-30-years-later/,https://nypost.com/wp-content/uploads/sites/2/2026/04/newspress-collage-byrualqvz-1777584955449.jpg?quality=75&strip=all&1777570681&w=1200,,"<ul><li>Jon Krakauer, 30 years after surviving Everests deadliest day, still worries about the climbing season.</li><li>Everests season is off to a terrible start due to a Khumbu Icefall closure, del… [+12751 chars]",,"„Die Everest-Saison hatte einen schrecklichen Start“, beunruhigt „Into Thin Air“-Autor Jon Krakauer. Es ist 30 Jahre her, dass Krakauer eine der schlimmsten Katastrophen des Berges überlebt hat.",‘Everest season has gotten off to a terrible start’ worries ‘Into Thin Air’ scribe Jon Krakauer. It's been 30 years since Krakauer survived one of the mountain's worst disasters.,'Tempus omne grave curarum initium evasit' in Thin Air' scribe Jon Krakauer. XXX annos ex quo Krakauer una clades pessimae montis superfuit.,2026-05-04 15:14:54+00:00
2c53b4dddbb0fe7f9e97a5b865895097,2026-05-01T05:49:08Z,'avalanche death',www.counterpunch.org,en,0.8,"Stroke Unto Death: Max’s Last Year, A Year Later","Now tumbling down the hill of time in an avalanche of emotion is the first anniversary of Max’s death. It’s been a year of immeasurable loss, bottomless grief, sleepless nights, vivid memories, strange and somewhat comforting rituals – ashes to ashes, stroke …",https://www.counterpunch.org/2026/05/01/stroke-unto-death-maxs-last-year-a-year-later/,https://www.counterpunch.org/wp-content/uploads/2026/04/suzymax-scaled.jpeg,,"Collage by Susan Block
Now tumbling down the hill of time in an avalanche of emotion is the first anniversary of Maxs death.
Its been a year of immeasurable loss, bottomless grief, sleepless nights… [+20047 chars]",,"Schlaganfall zu Tode: Max‘ letztes Jahr, ein Jahr später. Jetzt stürzt der erste Jahrestag von Max‘ Tod in einer Lawine der Gefühle den Berg der Zeit hinab. Es war ein Jahr unermesslichen Verlusts, grenzenloser Trauer, schlafloser Nächte, lebendiger Erinnerungen, seltsamer und irgendwie tröstlicher Rituale – Asche zu Asche, Schlaganfall …","Stroke Unto Death: Max’s Last Year, A Year Later. Now tumbling down the hill of time in an avalanche of emotion is the first anniversary of Max’s death. It’s been a year of immeasurable loss, bottomless grief, sleepless nights, vivid memories, strange and somewhat comforting rituals – ashes to ashes, stroke …","Ictus Ad Mortem: Max's Last Year, Annus Posterus. Nunc collis temporis in NIVIS animi motus devolutus est primus anniversarius Max's mortis. Annus immensus iacturae fuit, sine dolore, noctes vigiliis, memoriae vividae, peregrinae et aliquantum rituales consolatoriae – cineres in cinerem, plaga …",2026-05-04 15:14:54+00:00
ca0cdc00f8019f048fa0af1e2bc5bed8,2026-05-04T11:00:00Z,'avalanche mountain',www.theatlantic.com,en,0.3,How Everest Has Changed Since Into Thin Air,Scaling the world’s highest mountain is a very different experience than it was when I climbed it.,https://www.theatlantic.com/books/2026/05/whats-changed-since-jon-krakauer-climbed-everest/687019/,https://cdn.theatlantic.com/thumbor/QOqHz98uLI4SF-KNclj8J7Aq7yE=/0x40:2000x1082/1200x625/media/img/mt/2026/05/2026_04_01_Krakauer_Everest_Final_Sally_horizontal-1/original.jpg,,"When the first edition of Into Thin Air was published not long after the 1996 Mount Everest calamity, during which eight climbers died in a violent storm, I assumed that the disturbing events I descr… [+11656 chars]",,"Wie sich der Everest seitdem in Luft aufgelöst hat. Die Besteigung des höchsten Berges der Welt ist ein ganz anderes Erlebnis als damals, als ich ihn bestiegen habe.",How Everest Has Changed Since Into Thin Air. Scaling the world’s highest mountain is a very different experience than it was when I climbed it.,Quomodo Everestus mutavit cum in tenues auras. Altissimus mons mundi scandere longe alia experientia est quam cum eum ascendi.,2026-05-06 06:38:51+00:00
fb068e9cd9dfd51514f0a3750f2c804f,2026-05-04T23:04:14Z,'avalanche snow',thehockeynews.com,en,0.7,Blizzard In May? Storm Wipes Out Avalanche Watch Party Plans,"A late-season snowstorm sweeping through Denver has forced the cancellation of the Avalanche’s outdoor playoff watch party, putting a chill on the city’s Game 2 festivities.",https://thehockeynews.com/nhl/colorado-avalanche/latest-news/blizzard-in-may-storm-wipes-out-avalanche-watch-party-plans,https://s.yimg.com/ny/api/res/1.2/44jKCq8PlC8S8WvoARXIEg--/YXBwaWQ9aGlnaGxhbmRlcjt3PTEyMDA7aD04MDA7Y2Y9d2VicA--/https://media.zenfs.com/en/the_hockey_news_colorado_avalanche_articles_301/e910673c7c729f81225de3a2a74e0a89,,"Just when it felt like spring had settled in, Colorado delivered a sharp reminder of its unpredictabilityforcing the cancellation of a highly anticipated outdoor playoff gathering for the Colorado Av… [+1747 chars]",,"Schneesturm im Mai? Sturm macht Avalanche-Watch-Party-Pläne zunichte. Ein Schneesturm in der Spätsaison, der über Denver fegte, hat die Absage der Open-Air-Playoff-Watch-Party der Avalanche erzwungen und den Spiel-2-Feierlichkeiten der Stadt einen Schauer verpasst.","Blizzard In May? Storm Wipes Out Avalanche Watch Party Plans. A late-season snowstorm sweeping through Denver has forced the cancellation of the Avalanche’s outdoor playoff watch party, putting a chill on the city’s Game 2 festivities.","Blizzard Mense Maio? Tempestas delet NIVIS Watch Party dissipantur. Nives tempestas per Denver nuper-tempus indultum in factionis vigili lusoriae velitae Avalanche, frigus in ludo 2 festivitatum ponendo, coegit.",2026-05-07 15:30:57+00:00
