index,published,keyword,domain,language,valid,title,description,url,image,archive,content,quote,de,en,la,added
eadbb68394c7aa925a6996cb41f612a2,2025-11-04T16:15:01Z,'avalanche mountain',english.khabarhub.com,en,0.4,Today’s News in a Nutshell,"KATHMANDU: Khabarhub brings you a glimpse of major developments of the day in Nepal, including politics, business/economy, sports, entertainment, and more. Two separate proposals for Nepali Congress general convention; Mahendra Yadav challenges Gagan Thapa Tw…",https://english.khabarhub.com/2025/04/504393/,https://english.khabarhub.com/wp-content/uploads/2024/05/News-Nutshell.jpg,,"KATHMANDU: Khabarhub brings you a glimpse of major developments of the day in Nepal, including politics, business/economy, sports, entertainment, and more.
Two separate proposals for Nepali Congress… [+11897 chars]",,"Die heutigen Nachrichten in Kürze. KATHMANDU: Khabarhub gibt Ihnen einen Einblick in die wichtigsten aktuellen Entwicklungen in Nepal, darunter Politik, Wirtschaft, Sport, Unterhaltung und mehr. Zwei separate Vorschläge für die Generalversammlung des nepalesischen Kongresses; Mahendra Yadav fordert Gagan Thapa Tw heraus…","Today’s News in a Nutshell. KATHMANDU: Khabarhub brings you a glimpse of major developments of the day in Nepal, including politics, business/economy, sports, entertainment, and more. Two separate proposals for Nepali Congress general convention; Mahendra Yadav challenges Gagan Thapa Tw…","Hodie News in Nutshell. KATHMANDU: Khabarhub in Nepal, in re politica, negotia/economia, ludi, ludi, spectacula, et plura adducit. Propositiones duae disiunctae Conventui Nepali Conventui generali; Mahendra Yadav provocat Gagan Thapa Tw…",2025-10-21 13:36:59+00:00
f21196f5c882a2839876c88b9350261e,2025-11-10T00:47:00Z,'avalanche mountain',www.thehindubusinessline.com,en,0.4,A Himalayan effort at climate change mitigation,Explore urgent action plans to safeguard the Himalayas from climate change threats and enhance resilience in vulnerable communities.,https://www.thehindubusinessline.com/specials/clean-tech/a-himalayan-effort-at-climate-change-mitigation/article70260363.ece,https://bl-i.thgim.com/public/incoming/n7bqzb/article70260368.ece/alternates/LANDSCAPE_1200/009_NEWS-IN-FRAMES.JPG,,"Even as the 30th Conference of Parties (COP 30) gets underway in Belem, Brazil, negotiating ways to tackle the impact of climate change globally, in India a national treasure the Himalayas is on the … [+4096 chars]",,"Ein Himalaya-Einsatz zur Eindämmung des Klimawandels. Entdecken Sie dringende Aktionspläne, um den Himalaya vor den Bedrohungen des Klimawandels zu schützen und die Widerstandsfähigkeit gefährdeter Gemeinschaften zu stärken.",A Himalayan effort at climate change mitigation. Explore urgent action plans to safeguard the Himalayas from climate change threats and enhance resilience in vulnerable communities.,Conatum in Himalaicum mutationem climatis mitigandam esse. Explorare urgentem actionem consilia ad Himalayas tuendum a minis climatis mutatione et mollitia augendae in communitatibus vulnerabilibus.,2025-10-21 13:36:59+00:00
4efecf4fe1e640a7a3d16b04ab48898b,2025-11-04T11:02:20Z,'avalanche mountain',www.digitaljournal.com,en,0.7,Fierce mountain storms kill nine in Nepal,"Days of ferocious snowstorms and an avalanche in Nepal’s treacherous Himalayan peaks have killed nine people, including five Italian climbers, officials said Tuesday. The deaths occurred in two separate accidents since Friday. On Monday, an avalanche hit a gr…",https://www.digitaljournal.com/world/fierce-mountain-storms-kill-nine-in-nepal/article,https://www.digitaljournal.com/wp-content/uploads/2025/11/3b293a7aaefb2b29daf9d5cb14d7cff11a36fcc3.jpg,,"French climbers Didier Armand Berton (L) and Isabelle Thaon recounted from a Kathmandu hospital how they survived an avalanche that killed seven of their group - Copyright AFP Prakash MATHEMA
Days o… [+3051 chars]",,"Bei heftigen Gebirgsstürmen kommen in Nepal neun Menschen ums Leben. Tagelange heftige Schneestürme und eine Lawine in Nepals tückischen Himalaya-Gipfeln haben neun Menschen getötet, darunter fünf italienische Bergsteiger, sagten Beamte am Dienstag. Die Todesfälle ereigneten sich seit Freitag bei zwei getrennten Unfällen. Am Montag traf eine Lawine ein Gr…","Fierce mountain storms kill nine in Nepal. Days of ferocious snowstorms and an avalanche in Nepal’s treacherous Himalayan peaks have killed nine people, including five Italian climbers, officials said Tuesday. The deaths occurred in two separate accidents since Friday. On Monday, an avalanche hit a gr…","Novem procellae in Nepalia montanae feroces necant. Dies ferocium nivis et NIVIS in Nepali insidiosa cacumina Himalayan occiderunt novem homines, inclusos quinque viverrarum Italicorum, officiales Martis dixerunt. In duobus accidentibus separatis post Veneris funera facta sunt. Die Lunae, NIVIS CASUS a gr…",2025-10-21 13:36:59+00:00
b9fa710555c6b82d0b201562e3a599e3,2025-11-05T20:46:51Z,'avalanche rescue',www.bbc.com,en,0.7,Seven Italian climbers still missing in Nepal,Three other Italian climbers have been confirmed dead this week.,https://www.bbc.com/news/articles/c0mxkmzyx2eo,https://ichef.bbci.co.uk/news/1024/branded_news/48fc/live/afa67d40-ba71-11f0-8d4d-f92e4ea22994.jpg,,"Italy says seven of its citizens are missing in Nepal after trying to climb a Himalayan peak in the north-east of the country.
Officials said the Italian team was at the base camp of Dolma Khang pea… [+2670 chars]",,Sieben italienische Bergsteiger werden in Nepal immer noch vermisst. Drei weitere italienische Bergsteiger wurden diese Woche als tot bestätigt.,Seven Italian climbers still missing in Nepal. Three other Italian climbers have been confirmed dead this week.,Septem adhuc viverra Italiae in Nepalia desunt. Tres alii viverra Italiae hac septimana mortui confirmati sunt.,2025-10-21 13:36:59+00:00
0581e7063b6130e456abf2a38d4203a4,2025-11-02T10:45:22Z,'avalanche mountain',www.yahoo.com,en,0.8,5 German mountaineers die in northern Italy after being hit by avalanche,"Five German mountaineers died after being hit by an avalanche in South Tyrol, in northern Italy, rescuers said on Sunday.  “They had been dragged to the...",https://www.yahoo.com/news/articles/5-german-mountaineers-die-northern-104522675.html,https://s.yimg.com/cv/apiv2/social/images/yahoo_default_logo-1200x1200.png,,"ROME (AP) Five German mountaineers died after being hit by an avalanche in South Tyrol, in northern Italy, rescuers said on Sunday.
Three victims two men and a woman had already been recovered dead … [+1442 chars]",,"Fünf deutsche Bergsteiger sterben in Norditalien, nachdem sie von einer Lawine getroffen wurden. Fünf deutsche Bergsteiger starben, nachdem sie in Südtirol in Norditalien von einer Lawine getroffen worden waren, wie Retter am Sonntag mitteilten.  „Sie waren in die ... geschleppt worden.","5 German mountaineers die in northern Italy after being hit by avalanche. Five German mountaineers died after being hit by an avalanche in South Tyrol, in northern Italy, rescuers said on Sunday.  “They had been dragged to the...","5. Germani montani in Italia septentrionali post montem cadentem moriuntur. Quinque montani Germani mortui sunt postquam avalanche in Tyrol Australi, in Italia septentrionali, salvatores die Dominico dicti.  ""Detracti ad ...",2025-10-21 13:36:59+00:00
d6e757100f839c7c6d43f5edb91ee69d,2025-11-02T12:05:29Z,'avalanche mountain',abcnews.go.com,en,0.8,5 German mountaineers die in northern Italy after being hit by avalanche,"Rescuers have confirmed that five German mountaineers died after an avalanche in South Tyrol, northern Italy",https://abcnews.go.com/International/wireStory/5-german-mountaineers-die-northern-italy-after-hit-127104378,https://s.abcnews.com/images/US/abc_news_default_2000x2000_update_16x9_992.jpg,,"ROME -- Five German mountaineers died after being hit by an avalanche in South Tyrol, in northern Italy, rescuers said on Sunday.
Three victims two men and a woman had already been recovered dead on… [+1440 chars]",,"Fünf deutsche Bergsteiger sterben in Norditalien, nachdem sie von einer Lawine getroffen wurden. Retter haben bestätigt, dass fünf deutsche Bergsteiger nach einem Lawinenunglück in Südtirol, Norditalien, ums Leben kamen","5 German mountaineers die in northern Italy after being hit by avalanche. Rescuers have confirmed that five German mountaineers died after an avalanche in South Tyrol, northern Italy","5. Germani montani in Italia septentrionali post montem cadentem moriuntur. Rescuers confirmaverunt quinque montani Germanos mortuos esse post montem cadentem in Tyrolis Australi, in Italia septentrionali",2025-10-21 13:36:59+00:00
61d65ccc7d490b7cfae770e2ca4053e5,2025-11-02T14:13:00Z,'avalanche rescue',www.newser.com,en,0.8,Avalanche in the Alps Claims 5 Mountaineers,"Five German mountaineers died after being hit by an avalanche in South Tyrol, in northern Italy, rescuers said on Sunday. Three victims—two men and a woman—had already been recovered dead on Saturday, while the bodies of two other missing people, a man and hi…",https://www.newser.com/story/377941/avalanche-in-the-alps-claims-5-mountaineers.html,https://img1-azrcdn.newser.com/image/1643940-12-20251102081302.jpeg,,"Five German mountaineers died after being hit by an avalanche in South Tyrol, in northern Italy, rescuers said on Sunday. Three victims—two men and a woman—had already been recovered dead on Saturday… [+1253 chars]",,"Lawine in den Alpen fordert 5 Bergsteiger. Fünf deutsche Bergsteiger starben, nachdem sie in Südtirol in Norditalien von einer Lawine getroffen worden waren, wie Retter am Sonntag mitteilten. Drei Opfer – zwei Männer und eine Frau – waren bereits am Samstag tot geborgen worden, während die Leichen von zwei weiteren Vermissten, einem Mann und ihm, tot geborgen wurden.","Avalanche in the Alps Claims 5 Mountaineers. Five German mountaineers died after being hit by an avalanche in South Tyrol, in northern Italy, rescuers said on Sunday. Three victims—two men and a woman—had already been recovered dead on Saturday, while the bodies of two other missing people, a man and hi…","Avalanche in alpibus dicta 5 montani. Quinque montani Germani mortui sunt postquam avalanche in Tyrol Australi, in Italia septentrionali, salvatores die Dominico dicti. Tres victimae, duo viri et femina, die Sabbati mortui iam sunt recepti, cum corpora duorum hominum absentium, vir et hi…",2025-10-21 13:36:59+00:00
73ecc6d10d911bc8fb1f0ce5252d0b92,2025-11-02T17:37:55Z,'avalanche rescue',www.breitbart.com,en,0.8,Five German Mountaineers Die in Northern Italy After Being Hit by Avalanche,"Five German mountaineers died after being hit by an avalanche in South Tyrol, in northern Italy, rescuers said on Sunday.
The post Five German Mountaineers Die in Northern Italy After Being Hit by Avalanche appeared first on Breitbart.",https://www.breitbart.com/europe/2025/11/02/five-german-mountaineers-die-in-northern-italy-after-being-hit-by-avalanche/,https://media.breitbart.com/media/2025/11/AP25306444539506-2-640x335.jpg,,"ROME (AP) – Five German mountaineers died after being hit by an avalanche in South Tyrol, in northern Italy, rescuers said on Sunday.
Three victims – two men and a woman – had already been recovered… [+1508 chars]",,"Fünf deutsche Bergsteiger sterben in Norditalien, nachdem sie von einer Lawine getroffen wurden. Fünf deutsche Bergsteiger starben, nachdem sie in Südtirol in Norditalien von einer Lawine getroffen worden waren, wie Retter am Sonntag mitteilten.
Der Beitrag „Fünf deutsche Bergsteiger sterben in Norditalien nach Lawinenunfall“ erschien zuerst auf Breitbart.","Five German Mountaineers Die in Northern Italy After Being Hit by Avalanche. Five German mountaineers died after being hit by an avalanche in South Tyrol, in northern Italy, rescuers said on Sunday.
The post Five German Mountaineers Die in Northern Italy After Being Hit by Avalanche appeared first on Breitbart.","Quinque Germani montani in Italia septentrionali Post ictus ab Avalanche moriuntur. Quinque montani Germani mortui sunt postquam avalanche in Tyrol Australi, in Italia septentrionali, salvatores die Dominico dicti.
Post Quinque Montes Germanorum in Italia Septentrionali mortuus est Postquam ictus ab Avalanche primus in Breitbart apparuit.",2025-10-21 13:36:59+00:00
0cf27d3378a4df299ce4fec99e486b1f,2025-11-03T00:18:53Z,'avalanche protection',www.abc.net.au,en,0.8,Father and daughter among five killed in Italian Alps avalanche,"The avalanche struck the German climbers as they headed for the summit of Cima Vertana around 4pm on Saturday at an altitude of more than 3,500 metres.",https://www.abc.net.au/news/2025-11-03/five-germans-killed-in-italian-alps-avalanche/105964286,https://live-production.wcms.abc-cdn.net.au/6f58296aefd855c5d72996c3dd5c2f9b?impolicy=wcms_watermark_news&cropH=844&cropW=1500&xPos=0&yPos=467&width=862&height=485&imformat=generic,,"Five German climbers have died after being caught in an avalanche in the Italian Alps.
The avalanche struck as they headed for the summit of Cima Vertana in the Ortler mountain range in northern Ita… [+1514 chars]",,Vater und Tochter unter fünf Toten bei Lawinenunglück in den italienischen Alpen. Die Lawine traf die deutschen Bergsteiger am Samstag gegen 16 Uhr auf dem Weg zum Gipfel der Cima Vertana in einer Höhe von mehr als 3.500 Metern.,"Father and daughter among five killed in Italian Alps avalanche. The avalanche struck the German climbers as they headed for the summit of Cima Vertana around 4pm on Saturday at an altitude of more than 3,500 metres.","Patrem et filiam inter quinque Alpes Italiae NIVIS occidimus. Avalanche Germanorum tellus invadit in verticem Cima Vertana circa 4pm Sabbati in altitudinem plus quam 3,500 metrorum petierunt.",2025-10-21 13:36:59+00:00
c266c9b5af680fa6879fd922be32a064,2025-11-03T11:39:03Z,'avalanche protection',www.cbsnews.com,en,0.8,"5 climbers, including dad and teen daughter, killed by avalanche","Two men and a woman were recovered dead on Saturday, while the bodies of a man and his 17-year-old daughter were found on Sunday.",https://www.cbsnews.com/news/avalanche-kills-5-climbers-dad-daughter-italy/,https://assets3.cbsnewsstatic.com/hub/i/r/2025/11/03/b8592728-8f41-4f07-9411-a237f26621b0/thumbnail/1200x630/b6ff99e72047a5c1c93c4120fdb56898/avalanche-574122785-1252660693572568-1427913387491068998-n.jpg,,"Five German mountaineers died after being hit by an avalanche in South Tyrol, in northern Italy, rescuers said on Sunday.
Three victims — two men and a woman — had already been recovered dead on Sat… [+2742 chars]",,"5 Bergsteiger, darunter Vater und Tochter im Teenageralter, durch Lawine getötet. Zwei Männer und eine Frau wurden am Samstag tot geborgen, während am Sonntag die Leichen eines Mannes und seiner 17-jährigen Tochter gefunden wurden.","5 climbers, including dad and teen daughter, killed by avalanche. Two men and a woman were recovered dead on Saturday, while the bodies of a man and his 17-year-old daughter were found on Sunday.","5 viverra tellus, inclusa tata et teen filia, ab NIVIS CASUS INTERFECTUS. Duo viri et femina die Sabbati mortui restituti sunt, cum corpora viri et filiae eius XVII annorum die Dominico reperta sunt.",2025-10-21 13:36:59+00:00
74568f56e073f7584682c2d8e1ea6799,2025-11-03T14:23:58Z,'avalanche mountain',abcnews.go.com,en,0.8,Avalanche on Nepal mountain Yalung Ri kills 7 including foreign climbers,Officials in Nepal say an avalanche swept through a camp on Mount Yalung Ri on Monday and killed five foreign climbers and two Nepali guides,https://abcnews.go.com/International/wireStory/avalanche-nepal-mountain-yalung-ri-kills-7-including-127131820,https://s.abcnews.com/images/US/abc_news_default_2000x2000_update_16x9_992.jpg,,"KATHMANDU, Nepal -- Officials in Nepal say an avalanche swept through a camp on Mount Yalung Ri on Monday and killed five foreign climbers and two Nepali guides.
Armed Police Force spokesperson Shai… [+296 chars]",,"Lawine am nepalesischen Berg Yalung Ri tötet sieben Menschen, darunter ausländische Bergsteiger. Nach Angaben nepalesischer Behörden ist am Montag eine Lawine durch ein Lager am Berg Yalung Ri gefegt und fünf ausländische Bergsteiger und zwei nepalesische Bergführer getötet worden",Avalanche on Nepal mountain Yalung Ri kills 7 including foreign climbers. Officials in Nepal say an avalanche swept through a camp on Mount Yalung Ri on Monday and killed five foreign climbers and two Nepali guides,Avalanche in monte Nepal Yalung Ri 7 viverra tellus externos possidet. Magistratus in Nepalia dicunt NIVIS CASTRA in Monte Yalung Ri die Lunae trahi et quinque viverra peregrinos occidi et duos duces Nepalicas.,2025-10-21 13:36:59+00:00
504c26a1fc729e418d6cd48061168899,2025-11-03T16:40:30Z,'avalanche search',www.bbc.com,en,0.8,French climber among at least three killed in Nepal avalanche,A search is continuing in the Dolakha district for four other foreigners who are feared dead.,https://www.bbc.com/news/articles/c2kp42y5y81o?xtor=AL-72-%5Bpartner%5D-%5Byahoo.north.america%5D-%5Bheadline%5D-%5Bnews%5D-%5Bbizdev%5D-%5Bisapi%5D,https://s.yimg.com/ny/api/res/1.2/mlq4i8YSKFJQBkHEvTgI0w--/YXBwaWQ9aGlnaGxhbmRlcjt3PTEyMDA7aD02NjI7Y2Y9d2VicA--/https://media.zenfs.com/en/bbc_us_articles_995/0319ae76974d169f3fb99599f7e14d5e,,"At least three climbers, including a French national and two Nepalese people, have died after being hit by an avalanche on a Himalayan peak in north-eastern Nepal, police say.
The incident happened … [+2139 chars]",,"Französischer Bergsteiger unter mindestens drei Toten bei Lawinenunglück in Nepal. Im Distrikt Dolakha wird weiterhin nach vier weiteren Ausländern gesucht, deren Tod befürchtet wird.",French climber among at least three killed in Nepal avalanche. A search is continuing in the Dolakha district for four other foreigners who are feared dead.,Apud Gallos exhibuit saltem tres in Nepalia NIVIS CASUS. Perscrutatio continuatur in Dolakha regione quattuor aliis peregrinis mortuis timentibus.,2025-10-21 13:36:59+00:00
bf79e51ec09ab39e6434f87402283bf1,2025-11-03T17:13:15Z,'avalanche mountain',slashdot.org,en,0.8,Avalanche on Nepal mountain Yalung Ri kills 7 including foreign climbers - CNN,Avalanche on Nepal mountain Yalung Ri kills 7 including foreign climbersCNN View Full Coverage on Google News ...,https://slashdot.org/firehose.pl?op=view&amp;id=179952646,,http://web.archive.org/web/20160119174443/http://slashdot.org/firehose.pl?op=view,"Stupidity, like virtue, is its own reward.",,"Lawine am nepalesischen Berg Yalung Ri tötet sieben Menschen, darunter ausländische Bergsteiger – CNN. Lawine am nepalesischen Berg Yalung Ri tötet sieben Menschen, darunter ausländische BergsteigerCNN Vollständige Berichterstattung auf Google News anzeigen ...",Avalanche on Nepal mountain Yalung Ri kills 7 including foreign climbers - CNN. Avalanche on Nepal mountain Yalung Ri kills 7 including foreign climbersCNN View Full Coverage on Google News ...,Avalanche in monte Nepal Yalung Ri 7 viverra tellus externos possidet - Rhoncus. Avalanche in monte Nepal Yalung Ri 7 necat 7 comprehendo peregrinas ascensores CN View Full Coverage on Google News ...,2025-10-21 13:36:59+00:00
5dac44e07f99833ec809f0f47dda2dfa,2025-11-03T18:58:45Z,'avalanche warning system',www.foxweather.com,en,0.8,"Italian avalanche kills at least 5 climbers, including father and daughter","A German father and his daughter are among five people who were killed in an avalanche in Italy over the weekend, according to officials.",https://www.foxweather.com/extreme-weather/deadly-italy-avalanche-german-father-daughter-november-2025,https://nypost.com/wp-content/uploads/sites/2/2025/11/114723421.jpg?quality=75&strip=all&w=1200,,"A German father and his daughter are among five people who were killed in an avalanche in Italy over the weekend, according to officials.
Italian officials said that during the early afternoon hours… [+2804 chars]",,"Bei einer italienischen Lawine kommen mindestens fünf Bergsteiger ums Leben, darunter Vater und Tochter. Ein deutscher Vater und seine Tochter gehören nach offiziellen Angaben zu den fünf Menschen, die am Wochenende in Italien bei einer Lawine ums Leben kamen.","Italian avalanche kills at least 5 climbers, including father and daughter. A German father and his daughter are among five people who were killed in an avalanche in Italy over the weekend, according to officials.","Italica NIVIS CASUS V saltem viverra tellus, inter patrem et filiam, occidit. Pater Germanus et filia eius sunt inter quinque homines qui in Italia super weekend in NIVIS interfecti sunt, secundum magistratus.",2025-10-21 13:36:59+00:00
69cab86de34450e572c1ae03a6d3d522,2025-11-03T20:26:43Z,'avalanche mountain',www.abc.net.au,en,0.8,"Avalanche on Nepal mountain kills at least seven, officials say","An avalanche on Mount Yalung Ri has killed at least seven people, including five foreign climbers and two Nepali guides, according to local officials.",https://www.abc.net.au/news/2025-11-04/avalanche-on-nepal-mount-yalung-ri-kills-at-least-seven/105968456,https://live-production.wcms.abc-cdn.net.au/c736e01a14b33b7c3d7e66ce72da00f9?impolicy=wcms_watermark_news&cropH=338&cropW=601&xPos=0&yPos=1&width=862&height=485&imformat=generic,,"An avalanche that swept through a camp on Mount Yalung Ri in Nepal killed five foreign climbers and two Nepali guides, according to local officials.
Armed Police Force spokesperson Shailendra Thapa … [+1403 chars]",,"Nach Angaben von Beamten sind bei einer Lawine auf einem Berg in Nepal mindestens sieben Menschen ums Leben gekommen. Eine Lawine am Berg Yalung Ri hat nach Angaben örtlicher Beamter mindestens sieben Menschen getötet, darunter fünf ausländische Bergsteiger und zwei nepalesische Führer.","Avalanche on Nepal mountain kills at least seven, officials say. An avalanche on Mount Yalung Ri has killed at least seven people, including five foreign climbers and two Nepali guides, according to local officials.","Avalanche in monte Nepal occidit saltem septem magistratus dicunt. Avalanche in monte Yalung Ri occidit saltem septem homines, inclusos quinque viverrarum exterarum et duos duces Nepali, secundum loci officiales.",2025-10-21 13:36:59+00:00
4869df1e43c6d744f81fc153daeb9a7a,2025-11-04T01:50:00Z,'avalanche mountain',mypeoplesreview.com,en,0.8,Five foreigners and two Nepali climbers die,"Kathmandu, November 4: An avalanche at the base camp of Yalung Ri Mountain in the Rolwaling mountain range, located in […]
The post Five foreigners and two Nepali climbers die appeared first on Peoples' Review.",https://mypeoplesreview.com/2025/11/04/five-foreigners-and-two-nepali-climbers-die/,https://mypeoplesreview.com/wp-content/uploads/2025/11/Mt-Gauri-Sankar.jpeg,,"Kathmandu, November 4: An avalanche at the base camp of Yalung Ri Mountain in the Rolwaling mountain range, located in Gaurishankar Rural Municipality9 of Dolakha district, has claimed the lives of s… [+1567 chars]",,"Fünf Ausländer und zwei nepalesische Bergsteiger sterben. Kathmandu, 4. November: Eine Lawine im Basislager des Yalung Ri Mountain im Rolwaling-Gebirge, gelegen in […]
Der Beitrag „Fünf Ausländer und zwei nepalesische Bergsteiger sterben“ erschien zuerst auf Peoples‘ Review.","Five foreigners and two Nepali climbers die. Kathmandu, November 4: An avalanche at the base camp of Yalung Ri Mountain in the Rolwaling mountain range, located in […]
The post Five foreigners and two Nepali climbers die appeared first on Peoples' Review.","Quinque peregrini et duo Nepalica viverra tellus moriuntur. Kathmandu, Novembre 4: NIVIS CASTRA NIVIS YALANG RI Mons in basi ad montem Rolwaling, sita in […]
Post Quinque extranei et duo Nepalica viverra tellus apparuit primus in Recensione Populi.",2025-10-21 13:36:59+00:00
9ef3cf1844c5fdb2bc407a1c6a472a18,2025-11-04T07:48:37Z,'avalanche mountain',www.rte.ie,en,0.8,Avalanche kills seven in eastern Nepal,"An avalanche at a mountain base camp in eastern Nepal has killed seven people, including three Italians, an expedition organiser said, as efforts are underway to retrieve their remains.",https://www.rte.ie/news/world/2025/1104/1542030-avalanche-nepal/,https://www.rte.ie/images/00236bdc-1600.jpg,,"An avalanche at a mountain base camp in eastern Nepal has killed seven people, including three Italians, an expedition organiser said, as efforts are underway to retrieve their remains.
The avalanch… [+1389 chars]",,"Bei einer Lawine im Osten Nepals sind sieben Menschen ums Leben gekommen. Eine Lawine in einem Bergbasislager im Osten Nepals hat sieben Menschen getötet, darunter drei Italiener, sagte ein Expeditionsorganisator, während derzeit versucht wird, ihre sterblichen Überreste zu bergen.","Avalanche kills seven in eastern Nepal. An avalanche at a mountain base camp in eastern Nepal has killed seven people, including three Italians, an expedition organiser said, as efforts are underway to retrieve their remains.","NIVIS CASUS septem in Nepalia orientali occidit. Avalanche apud montem basis castra in Nepal orientali occidit septem homines, inter tres Italos, institutor expeditionis dixit, quod comparatis nisus suas reliquias recuperare potest.",2025-10-21 13:36:59+00:00
