index,published,keyword,domain,language,valid,title,description,url,image,archive,content,quote,de,en,la,added
3486a991296913aa47ad5b7d2b2a77eb,2026-01-01T16:52:15Z,'avalanche missing',thehockeynews.com,en,0.2,Driven to Dominate: The Story Behind Nathan MacKinnon’s Historic Run,Nathan MacKinnon is rewriting the record books while chasing one goal above all else: another championship for the Avalanche.,https://thehockeynews.com/colorado-avalanche/latest-news/driven-to-dominate-the-story-behind-nathan-mackinnon-s-historic-run,https://s.yimg.com/ny/api/res/1.2/zR.2J9q10yP7olJBbb07rQ--/YXBwaWQ9aGlnaGxhbmRlcjt3PTEyMDA7aD03OTU7Y2Y9d2VicA--/https://media.zenfs.com/en/the_hockey_news_colorado_avalanche_articles_301/803ecfb7b8a6569e82d1888658d008ef,,"DENVER  It does not seem to matter which milestone he reaches or which summit he climbsNathan MacKinnon carries himself with a quiet, almost disarming humility.
He is a player who never assumed he w… [+5448 chars]",,Zur Dominanz getrieben: Die Geschichte hinter Nathan MacKinnons historischem Lauf. Nathan MacKinnon schreibt die Rekordbücher neu und verfolgt dabei vor allem ein Ziel: eine weitere Meisterschaft für die Avalanche.,Driven to Dominate: The Story Behind Nathan MacKinnon’s Historic Run. Nathan MacKinnon is rewriting the record books while chasing one goal above all else: another championship for the Avalanche.,Dominare pulsi: The Story Behind Nathan MacKinnon's Historic Run. Nathan MacKinnon recordum librorum recitat dum unum prae omnibus propositum persequimur: alterum patrocinium in Avalanche.,2026-01-04 13:36:07+00:00
9a1111058e0021fa47f848152258e6e6,2026-01-02T11:05:50Z,'avalanche climate change',www.hurriyetdailynews.com,en,0.3,Türkiye braces for avalanche risk as deep freeze hits,"Türkiye is facing a prolonged spell of extreme winter weather, with freezing temperatures, strong winds and a heightened avalanche risk persisting into the first days of the new year, according to the country’s weather bureau.",https://www.hurriyetdailynews.com/turkiye-braces-for-avalanche-risk-as-deep-freeze-hits-217433,https://image.hurimg.com/i/hurriyet/75/200x200/6957a68ba576256bb59208ab.jpg,,"ISTANBUL
Türkiye is facing a prolonged spell of extreme winter weather, with freezing temperatures, strong winds and a heightened avalanche risk persisting into the first days of the new year, accor… [+1883 chars]",,"Türkiye bereitet sich auf Lawinengefahr vor, da es zu tiefem Frost kommt. Nach Angaben des Wetteramtes des Landes sieht sich Türkiye einer anhaltenden Phase extremen Winterwetters mit eisigen Temperaturen, starken Winden und einem erhöhten Lawinenrisiko gegenüber, das bis in die ersten Tage des neuen Jahres anhält.","Türkiye braces for avalanche risk as deep freeze hits. Türkiye is facing a prolonged spell of extreme winter weather, with freezing temperatures, strong winds and a heightened avalanche risk persisting into the first days of the new year, according to the country’s weather bureau.","Türkiye adstringit NIVIS periculum ut alta duratus hits. Türkiye respicit longum carmen extremae tempestatis hiemalis, cum frigore temperaturis, ventis validis et periculo cadentis avalanche in primis diebus anni novi, secundum tempestatem patriae hendrerit.",2026-01-04 22:28:57+00:00
52baa3efc09718fcffb945856843758a,2026-01-02T02:06:58Z,'avalanche snow',www.foxweather.com,en,0.8,Heavy snow and extreme weather cause sunken vessels and avalanche risk in Alaska,Significant weather conditions in Alaska have led to large vessels sinking across the state.,https://www.foxweather.com/weather-news/heavy-snow-extreme-weather-cause-sunken-boats-avalanche-risk-alaska,https://nypost.com/wp-content/uploads/sites/2/2026/01/118125524.jpg?quality=75&strip=all&w=1200,,"Extreme winter weather has caused large vessels to sink in the Juneau, Alaska, harbor and communities are making preparations for a possible avalanche.
The City and Borough of Juneau Docks and Harbo… [+2155 chars]",,Starker Schneefall und extremes Wetter führen in Alaska zu gesunkenen Schiffen und Lawinengefahr. Bedeutende Wetterbedingungen in Alaska haben im ganzen Bundesstaat zum Untergang großer Schiffe geführt.,Heavy snow and extreme weather cause sunken vessels and avalanche risk in Alaska. Significant weather conditions in Alaska have led to large vessels sinking across the state.,Gravis nivis et tempestatis extrema causa sunt naves depressae et periculum NIVIS in Alaska. Conditiones tempestatum significantes in Alaska perduxerunt ad magnas naves per rempublicam deprimentes.,2026-01-04 22:28:57+00:00
0094a922ec247d3326cada5f8ddc5f0c,2026-01-02T13:24:06Z,'avalanche mountain',www.mediafax.ro,en,0.8,"Large avalanche in the Făgăraș Mountains, accidentally triggered by two skiers",Two skiers accidentally triggered a large avalanche in the Făgăraș Mountains on Friday.,https://www.mediafax.ro/english/large-avalanche-in-the-fagaras-mountains-accidentally-triggered-by-two-skiers-23665920,https://www.mediafax.ro//wp-content/uploads/2026/01/avalansa-fagaras.jpeg,,"According to Salvamont Sibiu, a large avalanche occurred on Friday in the Bâlea Lac area, accidentally triggered by two skiers in the area known as Balcoane.
The avalanche traveled over 300 meters, … [+560 chars]",,"Große Lawine im Făgăraș-Gebirge, versehentlich von zwei Skifahrern ausgelöst. Zwei Skifahrer haben am Freitag versehentlich eine große Lawine im Făgăraș-Gebirge ausgelöst.","Large avalanche in the Făgăraș Mountains, accidentally triggered by two skiers. Two skiers accidentally triggered a large avalanche in the Făgăraș Mountains on Friday.","Magnae NIVIS in Montes Făgara, casu urguetur a duobus nartatoribus. Duo nautae casu magnam montem cadentem in Fagara die Veneris urguebant.",2026-01-04 22:28:57+00:00
