index,published,keyword,domain,language,valid,title,description,url,image,archive,content,quote,de,en,la,added
6378ba21b0890b3dfb636049ea07984e,2026-04-14T23:43:28Z,'avalanche search',consent.yahoo.com,en,0.2,How Do The Los Angeles Kings Match Up Against The Colorado Avalanche?,"The Los Angeles Kings clinched a playoff berth, but are currently in line to face the NHL's best team, the Colorado Avalanche. How can the Kings match up against the Presidents' Trophy winners?",https://consent.yahoo.com/v2/collectConsent?sessionId=1_cc-session_1a12bb7b-301e-401c-a387-d536d9577dbb,,,"If you click 'Accept all', we and our partners, including 251 who are part of the IAB Transparency &amp; Consent Framework, will also store and / or access information on a device (in other words, us… [+1046 chars]",,"Wie schlagen sich die Los Angeles Kings gegen die Colorado Avalanche? Die Los Angeles Kings haben sich einen Platz in den Playoffs gesichert, müssen derzeit aber gegen das beste Team der NHL, die Colorado Avalanche, antreten. Wie können die Kings mit den Gewinnern der Presidents' Trophy mithalten?","How Do The Los Angeles Kings Match Up Against The Colorado Avalanche?. The Los Angeles Kings clinched a playoff berth, but are currently in line to face the NHL's best team, the Colorado Avalanche. How can the Kings match up against the Presidents' Trophy winners?","How Do The Los Angeles Kings Match Up Against The Colorado Avalanche?. Los Angeles Reges berth playoff conpresserunt, sed nunc in acie sunt ut contra optimam turmam NHL, Colorado Avalanche. Quomodo Reges contra Trophaeum Praesidis victores opponunt?",2026-04-16 15:03:40+00:00
8ac71417a0bc4d64228638965895f9dd,2026-04-15T04:12:23Z,'avalanche search',consent.yahoo.com,en,0.2,Landeskog scores go-ahead goal to help the Avalanche to a 3-1 win over the Flames,Gabriel Landeskog scored the go-ahead goal at 15:07 of the third period to lead the Colorado Avalanche to a 3-1 victory over the Calgary Flames on Tuesday night. The score was tied at 1 in the final five minutes of the game when Cale Makar sent a pass across …,https://consent.yahoo.com/v2/collectConsent?sessionId=1_cc-session_5baf2b43-c91e-47da-8f87-b653075c7506,,,"If you click 'Accept all', we and our partners, including 251 who are part of the IAB Transparency &amp; Consent Framework, will also store and / or access information on a device (in other words, us… [+1046 chars]",,"Landeskog schießt den Startschuss und verhilft den Avalanche zu einem 3:1-Sieg über die Flames. Gabriel Landeskog erzielte bei 15:07 des dritten Drittels den Startschuss und führte die Colorado Avalanche am Dienstagabend zu einem 3:1-Sieg über die Calgary Flames. In den letzten fünf Minuten des Spiels stand es 1:1, als Cale Makar einen Pass über … schickte.",Landeskog scores go-ahead goal to help the Avalanche to a 3-1 win over the Flames. Gabriel Landeskog scored the go-ahead goal at 15:07 of the third period to lead the Colorado Avalanche to a 3-1 victory over the Calgary Flames on Tuesday night. The score was tied at 1 in the final five minutes of the game when Cale Makar sent a pass across …,Landeskog pereuntis praecedunt metam adiuvare NIVIS ad 3-1 flammam conciliandam. Gabriel Landeskog laceravit metam ante 15:07 tertiae periodi ducere Colorado Avalanche ad victoriam 3-1 de Calgary die Martis nocte. Score ligatum erat in 1 in quinque minuta finali ludo cum Cale Makar transfretavit ...,2026-04-16 15:03:40+00:00
54a569443a0b3caf6d02ac2f21508cab,2026-04-14T04:59:00Z,'avalanche ski',consent.yahoo.com,en,0.7,Recap: Avalanche steal extra point over Oilers in 2-1 shootout win,Was this the last skills competition of the season?,https://consent.yahoo.com/v2/collectConsent?sessionId=1_cc-session_efd1940d-06be-458c-9738-51f266429e9b,,,"If you click 'Accept all', we and our partners, including 251 who are part of the IAB Transparency &amp; Consent Framework, will also store and / or access information on a device (in other words, us… [+1046 chars]",,Rückblick: Avalanche holen beim 2:1-Shootout-Sieg einen Extrapunkt gegen die Oilers. War dies der letzte Geschicklichkeitswettbewerb der Saison?,Recap: Avalanche steal extra point over Oilers in 2-1 shootout win. Was this the last skills competition of the season?,Recap: NIVIS furantur extra punctum super Oilers in 2-1 mitterent win. An haec ultimae artes certatio temporis?,2026-04-16 15:03:40+00:00
0bbc5dec98cbc74fa393de7b10ab7958,2026-04-15T00:12:38Z,'avalanche snow',thehockeynews.com,en,0.2,"Rory Kerins Recalled, Joins Flames Lineup Against Colorado",Rory Kerins is set to return to the lineup for the Calgary Flames on Tuesday as they take on the Colorado Avalanche.,https://thehockeynews.com/nhl/calgary-flames/latest-news/rory-kerins-recalled-joins-flames-lineup-against-colorado,https://s.yimg.com/ny/api/res/1.2/t3fIrxyxKo2Hmd2kTg6MFw--/YXBwaWQ9aGlnaGxhbmRlcjt3PTEyMDA7aD04MDA7Y2Y9d2VicA--/https://media.zenfs.com/en/the_hockey_news_calgary_flames_articles_103/a1c32ee6d4a8359bfbe3543c37996c8d,,"Rory Kerins is set to return to the lineup for the Calgary Flames on Tuesday as they take on the Colorado Avalanche.
Now back with the Flames, Kerins is eager for the opportunity.
© Sergei Belski-I… [+689 chars]",,"„Rory Kerins zurückgerufen, schließt sich der Flames-Aufstellung gegen Colorado an“ . Rory Kerins wird voraussichtlich am Dienstag in die Aufstellung der Calgary Flames zurückkehren, wenn sie gegen die Colorado Avalanche antreten.","Rory Kerins Recalled, Joins Flames Lineup Against Colorado. Rory Kerins is set to return to the lineup for the Calgary Flames on Tuesday as they take on the Colorado Avalanche.","Rory Kerins Revocatus, Flammae Lineup iungit Colorado. Rory Kerins statuit redire ad lineup pro Servio Calgary die Martis in Colorado Avalanche.",2026-04-16 22:54:10+00:00
81b30b248ea249a45d9a5b83ce6d2573,2026-04-14T14:10:15Z,'avalanche protection',dailyhodl.com,en,0.3,Printr Launches V2 Platform Update With Five Fee Models and On-Chain Proof of Belief Staking,"Singapore, Singapore, 14th April 2026, Chainwire
The post Printr Launches V2 Platform Update With Five Fee Models and On-Chain Proof of Belief Staking appeared first on The Daily Hodl.",https://dailyhodl.com/2026/04/14/printr-launches-v2-platform-update-with-five-fee-models-and-on-chain-proof-of-belief-staking/,"https://dailyhodl.com/wp-content/uploads/2026/04/PR_imageee_1775223999DcUKtgH0JH.jpg?resize=1200,720",,"April 14th, 2026 Singapore, Singapore
Printr V2 introduces five creator-selectable fee distribution models, configurable liquidity, anti-vamp protection, and a new on-chain mechanism called Proof of… [+4125 chars]",,"Printr führt ein V2-Plattform-Update mit fünf Gebührenmodellen und On-Chain-Proof-of-Belief-Einsatz ein. Singapur, Singapur, 14. April 2026, Chainwire
Der Beitrag Printr startet V2-Plattform-Update mit fünf Gebührenmodellen und On-Chain-Proof-of-Belief-Staking erschien zuerst auf The Daily Hodl.","Printr Launches V2 Platform Update With Five Fee Models and On-Chain Proof of Belief Staking. Singapore, Singapore, 14th April 2026, Chainwire
The post Printr Launches V2 Platform Update With Five Fee Models and On-Chain Proof of Belief Staking appeared first on The Daily Hodl.","Printr Launches V2 Platform Update Cum Quinque Fee exemplum et Pro-Chain Fidei Staking. Singapore, Singapore, die 14 Aprilis 2026, Chainwire
Post Printr Launches V2 Platform Update Cum Quinque Fee exemplaribus et Pro-Chain Probatur Fidei Staking primus apparuit in Cotidiano Hodl.",2026-04-17 06:10:17+00:00
62d31ea1cf5e53a14ee1fda133e25251,2026-04-15T04:10:00Z,'avalanche warning system',www.milehighhockey.com,en,0.2,Recap: Martin Necas hits 100 points on the season as Avs beat Flames,We inch ever-closer to the playoffs after tonights game.,https://www.milehighhockey.com/colorado-avalanche-game-coverage/63366/recap-martin-necas-hits-100-points-on-the-season-as-avs-beat-flames,https://s.yimg.com/ny/api/res/1.2/yMWP5qxIkhECMv2_Fx.cQw--/YXBwaWQ9aGlnaGxhbmRlcjt3PTEyMDA7aD04MDA7Y2Y9d2VicA--/https://media.zenfs.com/en/sb_nation_articles_115/6f7514b0284597528d0357a3bfdc6305,,"The Colorado Avalanche wrapped up their last back-to-back of the regular season today as they took on the Calgary Flames. Ultimately, the Avs would win this one by a final score of 3-1, and close out… [+2278 chars]",,"Zusammenfassung: Martin Necas erreicht 100 Punkte in dieser Saison, als die Avs die Flames schlagen. Nach dem heutigen Spiel rücken wir den Playoffs immer näher.",Recap: Martin Necas hits 100 points on the season as Avs beat Flames. We inch ever-closer to the playoffs after tonights game.,Recap: Martin Necas 100 puncta in tempore ferit ut Avs flammam verberat. Inch semper propius ad playoffs post noctes ludo.,2026-04-17 14:24:44+00:00
2882bf4c5f5cfd6693381c04f971b523,2026-04-15T05:46:06Z,'avalanche warning system',coloradohockeynow.com,en,0.2,10 Takeaways: Avalanche Tie Franchise Record With One Game Remaining,The Avalanche’s final road trip of the season went about as well as you’d want it to. They were able […] The post 10 Takeaways: Avalanche Tie Franchise Record With One Game Remaining appeared first on Colorado Hockey Now.,https://coloradohockeynow.com/10-takeaways-avalanche-tie-franchise-record-with-one-game-remaining/,https://s.yimg.com/ny/api/res/1.2/UB3udDfF25NHxHg9dGSaHA--/YXBwaWQ9aGlnaGxhbmRlcjt3PTEyMDA7aD04MDA7Y2Y9d2VicA--/https://media.zenfs.com/en/colorado_hockey_now_articles_612/ddff26eb33963d640e2da76f9e72b354,,"The Avalanches final road trip of the season went about as well as youd want it to.
They were able to rest several guys, with Artturi Lehkonen, Devon Toews, and Brock Nelson each sitting out a game.… [+4556 chars]",,"10 Erkenntnisse: Avalanche Tie Franchise-Rekord mit einem verbleibenden Spiel. Der letzte Roadtrip der Avalanche in dieser Saison verlief so gut, wie man es sich wünschen würde. Sie waren in der Lage, […] Der Beitrag 10 Takeaways: Avalanche Tie Franchise-Rekord mit einem verbleibenden Spiel erschien zuerst auf Colorado Hockey Now.",10 Takeaways: Avalanche Tie Franchise Record With One Game Remaining. The Avalanche’s final road trip of the season went about as well as you’d want it to. They were able […] The post 10 Takeaways: Avalanche Tie Franchise Record With One Game Remaining appeared first on Colorado Hockey Now.,10 Takeaways: Avalanche Ligo Libertatis Record Cum Unus Ludus Reliquis. Via finalis itineris Avalanche temporis circuibat tum quod illud velles. Potuerunt […] Post 10 Takeaways: Avalanche Ligo Libertatis Record Cum Unus Ludus Reliquis visus primus in Colorado Hockey Nunc.,2026-04-17 14:24:44+00:00
