index,published,keyword,domain,language,valid,title,description,url,image,archive,content,quote,de,en,la,added
6693042b3f4346ea34e011be15ee5ad4,2026-03-08T07:33:27Z,'avalanche rescue',japantoday.com,en,0.3,Japan struggles to curb foreigner backcountry ski rescue operations,"Local authorities and resorts in Japan's winter destinations are struggling to prevent a surge of stranded foreign backcountry skiers and snowboarders, some of whom require rescue operations. Japan's powder snow offers a smooth riding experience that draws ov…",https://japantoday.com/category/national/japan-struggles-to-curb-foreigner-backcountry-ski-rescue-operations,,http://web.archive.org/web/20260309003731/https://japantoday.com/category/national/japan-struggles-to-curb-foreigner-backcountry-ski-rescue-operations,"Local authorities and resorts in Japan's winter destinations are struggling to prevent a surge of stranded foreign backcountry skiers and snowboarders, some of whom require rescue operations.
Japan'… [+2232 chars]",,"Japan kämpft darum, Rettungsaktionen für Ausländer im Hinterland einzudämmen. Lokale Behörden und Resorts in Japans Winterdestinationen kämpfen darum, einen Ansturm gestrandeter ausländischer Backcountry-Skifahrer und Snowboarder zu verhindern, von denen einige Rettungseinsätze benötigen. Japans Pulverschnee bietet ein sanftes Fahrerlebnis, das überwältigt…","Japan struggles to curb foreigner backcountry ski rescue operations. Local authorities and resorts in Japan's winter destinations are struggling to prevent a surge of stranded foreign backcountry skiers and snowboarders, some of whom require rescue operations. Japan's powder snow offers a smooth riding experience that draws ov…","Iaponia certamina peregrinationis curriculi ski liberandi operationes cohibere debent. Auctoritates locales et frequentationes in destinationes hiemales Iaponiae laborant, ne impetus nautarum et snowboarders exterarum regionum circumveniatur, quorum nonnulli operationes liberandae requirunt. Iaponia pulveris nix praebet experientiam lenis equitandi quae ov trahit ...",2026-03-19 14:12:00+00:00
72570ca0cd1e868cabf54c63ed909376,2026-03-06T19:04:42Z,'avalanche search',www.thebiglead.com,en,0.2,Connor McDavid calls Oilers NHL’s ‘best’ like Avalanche & Stars,"Edmonton Oilers captain Connor McDavid believes his team belongs in the same conversation as the NHL’s top contenders. As Edmonton prepares for a demanding stretch of games, McDavid said the upcoming matchups will show where the team truly stands. The Oilers …",https://www.thebiglead.com/connor-mcdavid-calls-oilers-nhls-best-like-avalanche-stars/,https://www.thebiglead.com/wp-content/uploads/2026/03/default-435-scaled.jpg,,"Edmonton Oilers captain Connor McDavid believes his team belongs in the same conversation as the NHLs top contenders. As Edmonton prepares for a demanding stretch of games, McDavid said the upcoming … [+2504 chars]",,"Connor McDavid bezeichnet die Oilers als „Beste“ der NHL wie Avalanche & Stars. Der Kapitän der Edmonton Oilers, Connor McDavid, glaubt, dass sein Team in die gleiche Diskussion gehört wie die Top-Anwärter der NHL. Während sich Edmonton auf eine anspruchsvolle Spielphase vorbereitet, sagte McDavid, dass die bevorstehenden Begegnungen zeigen werden, wo das Team wirklich steht. Die Oilers …","Connor McDavid calls Oilers NHL’s ‘best’ like Avalanche & Stars. Edmonton Oilers captain Connor McDavid believes his team belongs in the same conversation as the NHL’s top contenders. As Edmonton prepares for a demanding stretch of games, McDavid said the upcoming matchups will show where the team truly stands. The Oilers …","Connor McDavid vocat Oilers NHL 'optimum' sicut Avalanche & Stars. Edmonton Oilers dux Connor McDavid credit turmas suas in eodem colloquio cum NHL contendentes esse. Cum Edmonton parat ad exigendum ludorum spatium, McDavid dixit venturos matchups ostendet ubi vere stat manipulus. Oilers ...",2026-03-20 22:38:46+00:00
ede286eb07f380bcd3ac3500e692f4e0,2026-03-17T00:41:43Z,'avalanche rescue',thehockeynews.com,en,0.2,Avalanche Look To Rebound As Penguins Visit Denver,The Colorado Avalanche host the Pittsburgh Penguins at Ball Arena tonight in a nationally televised matchup that will prove to be a pivotal test for both teams as the playoff race intensifies.,https://thehockeynews.com/nhl/colorado-avalanche/latest-news/avalanche-look-to-rebound-as-penguins-visit-denver,https://s.yimg.com/ny/api/res/1.2/A.UT6F4Rs43tDqxZ9SL1Yw--/YXBwaWQ9aGlnaGxhbmRlcjt3PTEyMDA7aD04MDA7Y2Y9d2VicA--/https://media.zenfs.com/en/the_hockey_news_colorado_avalanche_articles_301/fb6de3b09cbc491b8149e90d58eb4a68,,"DENVER  The Colorado Avalanche will host the Pittsburgh Penguins tonight at Ball Arena in a nationally televised matchup, with the game airing on ESPN and streaming simultaneously on Amazon Prime.
W… [+3168 chars]",,"Die Lawine dürfte sich erholen, während die Pinguine Denver besuchen. Die Colorado Avalanche empfangen heute Abend die Pittsburgh Penguins in der Ball Arena in einem landesweit im Fernsehen übertragenen Duell, das sich für beide Teams als entscheidender Test erweisen wird, da sich das Playoff-Rennen intensiviert.",Avalanche Look To Rebound As Penguins Visit Denver. The Colorado Avalanche host the Pittsburgh Penguins at Ball Arena tonight in a nationally televised matchup that will prove to be a pivotal test for both teams as the playoff race intensifies.,"NIVIS respice ad resilire sicut Penguins Visita Denver. Colorado Avalanche hospes Pittsburgh Penguins in Ball Arena hac nocte in matchup televisificarum nationalem, quod experimentum cardo ambarum iunctorum esse demonstrabit sicut genus ludi exaggerat.",2026-03-21 13:48:50+00:00
096a88d839746c7c25c45fa359379d24,2026-03-19T11:00:47Z,'avalanche rescue',www.thecut.com,en,0.3,How I Went From Stay-at-Home Mom to Search & Rescue Missions,I trained to track down missing people in the wilderness as a search-and-rescue volunteer. I ended up finding myself — and changing the way I think about parenting.,http://www.thecut.com/article/search-rescue-volunteer-missing-person-motherhood.html,https://pyxis.nymag.com/v1/imgs/7dc/677/5ce47041de4ac311c465055c93bca9b3e1-search-and-rescue-mom.1x.rsocial.w1200.jpg,http://web.archive.org/web/20260319151529/https://www.thecut.com/article/search-rescue-volunteer-missing-person-motherhood.html,"A teenager is missing. She dropped acid, and hallucinations made her flee the house where she was staying. Shes a high-school student dressed in pajamas with no shoes on. She took a selfie in the mir… [+10205 chars]",,"Wie ich von der Hausfrau zu Such- und Rettungseinsätzen kam. Ich habe eine Ausbildung als freiwilliger Such- und Rettungshelfer absolviert, um vermisste Menschen in der Wildnis aufzuspüren. Am Ende habe ich mich selbst gefunden – und meine Einstellung zum Thema Elternschaft verändert.",How I Went From Stay-at-Home Mom to Search & Rescue Missions. I trained to track down missing people in the wilderness as a search-and-rescue volunteer. I ended up finding myself — and changing the way I think about parenting.,Quomodo profectus sum ex Mane-ad-Home Mom ad quaerendas & liberandas Missiones. Exercebam indagare absentes homines in eremo tamquam voluntarios quaerendi et liberandi. Finivi me invenio — et mutando viam quam cogito de parente.,2026-03-21 13:48:50+00:00
959843a49385f27b905d60a21bea042a,2026-03-17T17:01:42Z,'avalanche missing',consent.yahoo.com,en,0.7,"Avalanche's lead down to 3 points ahead of matchup against Stars, Nathan MacKinnon says 'flow's off'","Nathan MacKinnon can deliver a little bit of everything, including the honest truth. “One of those nights that just sucked,” the Colorado Avalanche forward said Monday after a 7-2 loss to a Pittsburgh Penguins squad that was missing Sidney Crosby. Colorado, t…",https://consent.yahoo.com/v2/collectConsent?sessionId=1_cc-session_b3cb9306-60d9-4b48-a7ed-4e808144f8da,,,"If you click 'Accept all', we and our partners, including 247 who are part of the IAB Transparency &amp; Consent Framework, will also store and / or access information on a device (in other words, us… [+1046 chars]",,"Der Vorsprung von Avalanche ist vor dem Match gegen die Stars auf 3 Punkte gesunken, Nathan MacKinnon sagt, dass der Flow ausgefallen sei. Nathan MacKinnon kann von allem ein bisschen liefern, einschließlich der ehrlichen Wahrheit. „Eine dieser Nächte, die einfach nur scheiße waren“, sagte der Stürmer der Colorado Avalanche am Montag nach einer 2:7-Niederlage gegen die Pittsburgh Penguins, denen Sidney Crosby fehlte. Colorado, d…","Avalanche's lead down to 3 points ahead of matchup against Stars, Nathan MacKinnon says 'flow's off'. Nathan MacKinnon can deliver a little bit of everything, including the honest truth. “One of those nights that just sucked,” the Colorado Avalanche forward said Monday after a 7-2 loss to a Pittsburgh Penguins squad that was missing Sidney Crosby. Colorado, t…","Avalanche scriptor plumbum usque ad 3 puncta ante matchup contra Stellas, Nathan MacKinnon dicit 'abscidere'. Nathan MacKinnon pauxillum rerum omnium tradere potest, verum etiam honestum. ""Una ex illis noctibus quae modo suxisti"" Colorado Avalanche deinceps dixit Lunae post 7-2 damnum ad Pittsburgh Penguins MANIPLUS quod defuit Sidney Crosby. Colorado, t…",2026-03-21 13:48:50+00:00
68229df2184913e8a4b1ebdf11586457,2026-03-05T19:00:00Z,'avalanche mountain',allthatsinteresting.com,en,0.3,How Aron Ralston’s Harrowing Survival Story Inspired ‘127 Hours’,"In April 2003, mountaineer Aron Ralston spent 127 hours pinned by a boulder in Utah's Bluejohn Canyon — until he amputated his own arm and escaped.
The post How Aron Ralston’s Harrowing Survival Story Inspired ‘127 Hours’ appeared first on All That's Interest…",https://allthatsinteresting.com/aron-ralston,https://allthatsinteresting.com/wordpress/wp-content/uploads/2019/06/trapped-og-1.jpg,,"In April 2003, mountaineer Aron Ralston spent 127 hours pinned by a boulder in Utah's Bluejohn Canyon until he amputated his own arm and escaped.
In April 2003, Aron Ralston was on a solo climbing t… [+10757 chars]",,"Wie Aron Ralstons erschütternde Überlebensgeschichte „127 Hours“ inspirierte. Im April 2003 wurde der Bergsteiger Aron Ralston 127 Stunden lang von einem Felsbrocken im Bluejohn Canyon in Utah eingeklemmt – bis er sich den Arm amputierte und entkam.
Der Beitrag Wie Aron Ralstons erschütternde Überlebensgeschichte „127 Hours“ inspirierte, erschien zuerst auf All That's Interest…","How Aron Ralston’s Harrowing Survival Story Inspired ‘127 Hours’. In April 2003, mountaineer Aron Ralston spent 127 hours pinned by a boulder in Utah's Bluejohn Canyon — until he amputated his own arm and escaped.
The post How Aron Ralston’s Harrowing Survival Story Inspired ‘127 Hours’ appeared first on All That's Interest…","Quomodo Aron Ralston's Harrowing Survival Story Inspiratus est'127 Horae'. Mense Aprili MMIII, montanus Aron Ralston CXXVII horis fixus saxum in Utah Bluejohn Canyon egit — donec brachium suum amputavit et evasit.
Posta Quomodo Aron Ralston's Harrowing Story Survival '127 Horae' inspiratus apparuit primum in omnibus rem.",2026-03-21 22:35:14+00:00
1bc899906093feea4672040b2625c8ce,2026-03-17T10:00:00Z,'avalanche warning system',www.theatlantic.com,en,0.3,The Border Wall Is Back,"With $46.5 billion to blow, Trump has resumed construction, even in remote areas with few illegal crossings.",https://www.theatlantic.com/politics/2026/03/trump-border-wall-construction/686403/,https://cdn.theatlantic.com/thumbor/Xt7dXSEX236nG0ByTnGdOHKsx7s=/0x94:4495x2435/1200x625/media/img/mt/2026/03/20260224SRV1135_1New/original.jpg,,"Photographs by Philip CheungAt Coronado National Memorial in Arizona, the demolition crews blowing up national-park land tend to announce explosions at least a day in advance, as a warning for hikers… [+22810 chars]",,"Die Grenzmauer ist zurück. Mit einem Verlust von 46,5 Milliarden US-Dollar hat Trump den Bau wieder aufgenommen, selbst in abgelegenen Gebieten mit wenigen illegalen Grenzübergängen.","The Border Wall Is Back. With $46.5 billion to blow, Trump has resumed construction, even in remote areas with few illegal crossings.","Murus Terminus Back est. Cum $46.5 miliarda flare, Trump constructionem resumpsit, etiam in locis remotis cum paucis transitus illegalibus.",2026-03-22 05:22:37+00:00
0607b4e987c798a4390f85e30cdf5631,2026-03-17T17:03:27Z,'avalanche protection',nationalpost.com,en,0.3,Author Tracy Sierra’s childhood avalanche encounter comes back to haunt her in new novel,"Twelve-year-old Tracy Sierra’s moment of terror lasted for only 20 seconds, but it still haunts her.",https://nationalpost.com/entertainment/tracy-sierra,https://smartcdn.gprod.postmedia.digital/nationalpost/wp-content/uploads/2026/03/Author-Photo_Tracy-Sierra_-c-Alyssa-Fortin-Phtography-scaled-e1773766802930.jpg,,"Twelve-year-old Tracy Sierras moment of terror lasted for only 20 seconds, but it still haunts her.
THIS CONTENT IS RESERVED FOR SUBSCRIBERS
Enjoy the latest local, national and international news.… [+4698 chars]",,"Die Lawinenbegegnung der Autorin Tracy Sierra in ihrer Kindheit verfolgt sie in ihrem neuen Roman erneut. Der Schreckensmoment der zwölfjährigen Tracy Sierra dauerte nur 20 Sekunden, aber er verfolgt sie immer noch.","Author Tracy Sierra’s childhood avalanche encounter comes back to haunt her in new novel. Twelve-year-old Tracy Sierra’s moment of terror lasted for only 20 seconds, but it still haunts her.","Auctor Tracy Sierra avalanche congressio puerilis redit ut eam in novis novis devertat. Tracy Sierra momentum terroris duodecies annos tantum pro XX secundis duravit, sed adhuc eam colit.",2026-03-23 05:44:31+00:00
1e395b6512732a567973cbedf8b6a9ad,2026-03-21T18:14:23Z,'avalanche ski',abcnews.com,en,0.8,"A deadly South Tyrol avalanche kills 2 skiers, trapping 25 near the Austria border","An avalanche in Italy’s South Tyrol has killed two skiers and injured several others, after sweeping through a busy high alpine slope",https://abcnews.com/International/wireStory/deadly-south-tyrol-avalanche-kills-2-skiers-trapping-131288476,https://i.abcnewsfe.com/a/f027b8a8-fa73-4e1e-8e3e-0b69a4e656f5/wirestory_f793b17f97e5a39a2b1fe427cefeaf4b_16x9.jpg?w=1600,,"An avalanche in high alpine terrain in Italy 's South Tyrol on Saturday killed two skiers, according to the country's mountain rescue service.
The avalanche happened at an altitude of around 2,400 m… [+1317 chars]",,"Bei einer tödlichen Lawine in Südtirol kommen zwei Skifahrer ums Leben, 25 bleiben nahe der österreichischen Grenze hängen. Eine Lawine im italienischen Südtirol hat zwei Skifahrer getötet und mehrere weitere verletzt, nachdem sie über einen stark befahrenen Hochalpenhang gefegt war","A deadly South Tyrol avalanche kills 2 skiers, trapping 25 near the Austria border. An avalanche in Italy’s South Tyrol has killed two skiers and injured several others, after sweeping through a busy high alpine slope","Funestus Meridionalis Tyrolis NIVIS CASUS 2 nautas occidit, 25 captanda circa limitem Austriae. Avalanche in Italia in Tyrol Meridiana duos nautas occidit et plures alios vulneravit, postquam per altissimum clivum alpinum occupatissimum verrens.",2026-03-23 05:44:31+00:00
ca6488a0fc11372af0ebf077259c92ca,2026-03-21T18:16:09Z,'avalanche ski',www.cbsnews.com,en,0.8,"2 skiers killed, 5 hurt in northern Italy avalanche","A total of 25 skiers were on the mountainside where the avalanche occurred, but most had escaped.",https://www.cbsnews.com/news/skiers-killed-hurt-northern-italy-avalanche/,https://assets1.cbsnewsstatic.com/hub/i/r/2026/03/21/de0b0ea7-7843-453d-8e92-78e157bdcdaa/thumbnail/1200x630/ad8794ef890f53ae0a0b44002f8dea8c/ap26080571660335.jpg,,"Two skiers died and five others were injured on Saturday when an avalanche rumbled down on them in the Italian Alps, in the Trentino-Alto Adige region, the mountain rescue service said.
The service'… [+1433 chars]",,"2 Skifahrer getötet, 5 verletzt bei Lawine in Norditalien. Insgesamt waren 25 Skifahrer am Berghang der Lawine unterwegs, die meisten konnten jedoch entkommen.","2 skiers killed, 5 hurt in northern Italy avalanche. A total of 25 skiers were on the mountainside where the avalanche occurred, but most had escaped.","2 caesi caesi, 5 laesi in Italia septentrionali NIVIS. Summa XXV nartatores erant in monte ubi NIVIS occurrit, sed maxime evaserat.",2026-03-23 05:44:31+00:00
ab48188dfb6a5c3f8d1cc9b5fd3ed46e,2026-03-21T21:16:18Z,'avalanche rescue',japantoday.com,en,0.8,"South Tyrol avalanche kills 2 skiers, trapping 25 near the Austria border","An avalanche in high alpine terrain in Italy 's South Tyrol on Saturday killed two skiers, according to the country's mountain rescue service. The avalanche happened at an altitude of around 2,400 meters on the slopes of the 2,669-meter Hohe Ferse (also known…",https://japantoday.com/category/world/a-deadly-south-tyrol-avalanche-kills-2-skiers-trapping-25-near-the-austria-border,,,"An avalanche in high alpine terrain in Italy 's South Tyrol on Saturday killed two skiers, according to the country's mountain rescue service.
The avalanche happened at an altitude of around 2,400 m… [+1435 chars]",,"Lawine in Südtirol tötet zwei Skifahrer, 25 bleiben nahe der österreichischen Grenze hängen. Bei einem Lawinenunglück im hochalpinen Gelände im italienischen Südtirol sind nach Angaben der Bergrettung des Landes am Samstag zwei Skifahrer ums Leben gekommen. Die Lawine ereignete sich in einer Höhe von rund 2.400 Metern an den Hängen der 2.669 Meter hohen Hohe Ferse (auch…","South Tyrol avalanche kills 2 skiers, trapping 25 near the Austria border. An avalanche in high alpine terrain in Italy 's South Tyrol on Saturday killed two skiers, according to the country's mountain rescue service. The avalanche happened at an altitude of around 2,400 meters on the slopes of the 2,669-meter Hohe Ferse (also known…","Meridionalis Tyrolis avalanche occidit 2 nautas, 25 captanda iuxta terminum Austriae. Avalanche in altissimis alpinis locis in Italia Meridionali Tyrolis die Saturni duos nautas occidit, secundum patriae ministerium montem liberandum. Avalanche factum est ad altitudinem circiter 2,400 metrorum in clivis 2,669 metri Hohe Ferse (etiam nota…",2026-03-23 05:44:31+00:00
b2c49d864ac80744a896d3e3e45c23f4,2026-03-21T21:18:47Z,'avalanche mountain',nypost.com,en,0.8,"2 dead, dozens trapped by avalanche in Northern Italy","An avalanche in high alpine terrain in Italy’s South Tyrol on Saturday killed two skiers, according to the country’s mountain rescue service.",https://nypost.com/2026/03/21/world-news/2-dead-dozens-trapped-from-avalanche-in-northern-italy/,https://nypost.com/wp-content/uploads/sites/2/2026/03/124151044.jpg?quality=75&strip=all&w=1200,,"An avalanche in high alpine terrain in Italys South Tyrol on Saturday killed two skiers, according to the countrys mountain rescue service.
The avalanche happened at an altitude of around 2,400 mete… [+1684 chars]",,"2 Tote, Dutzende von Lawine in Norditalien eingeschlossen. Eine Lawine im hochalpinen Gelände im italienischen Südtirol hat nach Angaben der Bergrettung des Landes am Samstag zwei Skifahrer getötet.","2 dead, dozens trapped by avalanche in Northern Italy. An avalanche in high alpine terrain in Italy’s South Tyrol on Saturday killed two skiers, according to the country’s mountain rescue service.","2 mortuo, justo avalanche in Italia septentrionali capti. Avalanche in locis altis alpinis in Italia Meridiana Tyrol die Sabbati duos nautas occidit, secundum ministerium montani patriae liberandum.",2026-03-23 05:44:31+00:00
052575f2c785be4e20698145e2dc041b,2026-03-13T14:31:00Z,'avalanche protection',www.milehighhockey.com,en,0.2,MHH Roundtable: Is the Avalanche defense improved enough?,"After a wild and monumental trade deadline which saw the return of Nazem Kadri, the Colorado Avalanche have their roster for the remainder of the 2025-26 season in hopes that it will end with a Stanley Cup. Here we unpack where this team stands heading into t…",https://www.milehighhockey.com/mhh-roundtables/62376/mhh-roundtable-is-the-avalanche-defense-improved,https://s.yimg.com/ny/api/res/1.2/6mxOihXzbCwNIfdc81iYjg--/YXBwaWQ9aGlnaGxhbmRlcjt3PTEyMDA7aD04MDA7Y2Y9d2VicA--/https://media.zenfs.com/en/sb_nation_articles_115/54b5f0a3b1652cf9f9b14c919456b179,http://web.archive.org/web/20260314082205/https://www.milehighhockey.com/mhh-roundtables/62376/mhh-roundtable-is-the-avalanche-defense-improved,"After a wild and monumental trade deadline which saw the return of Nazem Kadri, the Colorado Avalanche have their roster for the remainder of the 2025-26 season in hopes that it will end with a Stanl… [+10363 chars]",,"MHH Roundtable: Ist die Lawinenabwehr ausreichend verbessert? Nach einer wilden und monumentalen Handelsfrist, die die Rückkehr von Nazem Kadri mit sich brachte, haben die Colorado Avalanche ihren Kader für den Rest der Saison 2025/26 in der Hoffnung, dass sie mit einem Stanley Cup endet. Hier enthüllen wir, wo dieses Team auf dem Weg in die Zukunft steht …","MHH Roundtable: Is the Avalanche defense improved enough?. After a wild and monumental trade deadline which saw the return of Nazem Kadri, the Colorado Avalanche have their roster for the remainder of the 2025-26 season in hopes that it will end with a Stanley Cup. Here we unpack where this team stands heading into t…","MHH Roundtable: Estne NIVIS defensio satis emendata?. Post trux ac monumentalis commercium notificatum quod Nazem Kadri vidit, Colorado Avalanche suum numerum reliquo tempore 2025-26 habere sperat quod cum Stanley Calicem futurum est. Hic nos unpack ubi haec manipulus stat versus in t…",2026-03-23 22:42:33+00:00
30c0d9dacf5a8207fc168cd4dd5d7172,2026-03-21T22:32:40Z,'avalanche ski',slashdot.org,en,0.8,"A deadly South Tyrol avalanche kills 2 skiers, trapping 25 near the Austria border - NBC News","A deadly South Tyrol avalanche kills 2 skiers, trapping 25 near the Austria borderNBC News 2 Dead, 5 Injured from Avalanche While Skiing, Prompting Large Search-and-Rescue EffortPeople.com 2 skiers killed, 5 hurt in northern Italy avalancheCBS News Deadly ava…",https://slashdot.org/firehose.pl?op=view&amp;id=181071592,,,"Murphy's Law, that brash proletarian restatement of Godel's Theorem.
-- Thomas Pynchon, ""Gravity's Rainbow""",,"Eine tödliche Lawine in Südtirol tötet zwei Skifahrer und sperrt 25 nahe der österreichischen Grenze ein – NBC News. Eine tödliche Lawine in Südtirol tötet zwei Skifahrer und sperrt 25 in der Nähe der österreichischen Grenze einNBC News 2 Tote und 5 Verletzte durch Lawine beim Skifahren, was große Such- und Rettungsaktionen nach sich ziehtPeople.com 2 Skifahrer getötet, 5 verletzt bei Lawine in NorditalienCBS News Tödliche Lawine in Südtirol","A deadly South Tyrol avalanche kills 2 skiers, trapping 25 near the Austria border - NBC News. A deadly South Tyrol avalanche kills 2 skiers, trapping 25 near the Austria borderNBC News 2 Dead, 5 Injured from Avalanche While Skiing, Prompting Large Search-and-Rescue EffortPeople.com 2 skiers killed, 5 hurt in northern Italy avalancheCBS News Deadly ava…","Funestus Tyrolis Australis NIVIS CASUS 2 nautas occidit, 25 captanda circa terminum Austriae - NBC News. Mortiferum Raetici avalanche Australis occidit 2 nautas, captando 25 prope in confinio Austriae NBC News 2 Mortuus, 5 Laesus ab Avalanche Dum Skiing, Instigans Magnae Inquisitionis-et-Rue EffortPeople.com 2 skiers occidit, 5 laesa in Italia septentrionali avalancheCBS News Funestus ava…",2026-03-23 22:42:33+00:00
c883d407b9c9604096052c9b5037e815,2026-03-22T11:13:00Z,'avalanche rescue',news.sky.com,en,0.8,Two skiers killed after avalanche sweeps through busy slope,"Two people have been killed after being caught in a large avalanche in northern Italy, the country's mountain rescue service has said.",https://news.sky.com/story/two-skiers-killed-after-avalanche-sweeps-through-busy-slope-in-northern-italy-13523005,https://e3.365dm.com/26/03/1600x900/skynews-avalanche-italy_7199907.jpg?20260322102450,,"Two people have been killed after being caught in a large avalanche in northern Italy, the country's mountain rescue service has said.
Three others were seriously injured and two people suffered min… [+1908 chars]",,"Zwei Skifahrer kamen ums Leben, nachdem eine Lawine einen stark befahrenen Hang zerstört hatte. Nach Angaben der Bergrettung des Landes sind in Norditalien zwei Menschen ums Leben gekommen, nachdem sie von einer großen Lawine erfasst worden waren.","Two skiers killed after avalanche sweeps through busy slope. Two people have been killed after being caught in a large avalanche in northern Italy, the country's mountain rescue service has said.","Duo nartatores caesi postquam NIVIS rapit per occupatus clivo. Duo homines postquam in magna avalanche in Italia septentrionali deprehensi sunt, in monte servitutis patriae liberandum esse dixit.",2026-03-23 22:42:33+00:00
