index,published,keyword,domain,language,valid,title,description,url,image,archive,content,quote,de,en,la,added
bfdbb5ea4b1ce208b063b0ee2482c9af,2025-11-03T20:42:24Z,'avalanche rescue',www.nbcnews.com,en,0.9,American climbers among 7 killed in avalanche on Nepal mountain,"Three American citizens were among seven people who were killed when an avalanche swept through a camp on Nepal’s Mount Yalung Ri, police said.",https://www.nbcnews.com/world/asia/nepal-avalanche-climbers-missing-mount-yalung-ri-police-army-rcna241644,"https://media-cldnry.s-nbcnews.com/image/upload/t_nbcnews-fp-1200-630,f_auto,q_auto:best/rockcms/2025-11/251103-nepal-skiing-avalanche-gk-23e5a4.jpg",,"KATHMANDU, Nepal Three American citizens were among seven people who were killed when an avalanche swept through a camp on Nepals Mount Yalung Ri, police in the south Asian country said Monday. 
Two… [+1469 chars]",,"Amerikanischer Bergsteiger unter sieben Toten bei Lawine am nepalesischen Berg. Drei amerikanische Staatsbürger gehörten zu den sieben Menschen, die getötet wurden, als eine Lawine durch ein Lager auf dem Berg Yalung Ri in Nepal fegte, teilte die Polizei mit.","American climbers among 7 killed in avalanche on Nepal mountain. Three American citizens were among seven people who were killed when an avalanche swept through a camp on Nepal’s Mount Yalung Ri, police said.","American viverra tellus inter 7 occisos in monte Nepal in avalanche. Tres cives Americani fuerunt in septem hominibus qui interfecti sunt cum NIVIS per castra in Monte Yalung Ri Nepal', vigilum dixit.",2025-10-21 13:36:59+00:00
0e5d06b07e29acaca799589b2aaff6dc,2025-11-03T22:44:48Z,'avalanche rescue',www.foxnews.com,en,0.9,Avalanche in Nepal kills 7 climbers on Mount Yalung Ri,Five foreign climbers and two Nepali guides were killed when an avalanche struck Mount Yalung Ri as rescue teams are facing rough terrain and poor weather.,https://www.foxnews.com/world/avalanche-nepal-kills-7-climbers-mount-yalung-ri,https://static.foxnews.com/foxnews.com/content/uploads/2025/10/everest-hikers-stranded-storm2.jpg,,"An avalanche on Monday swept through a camp in Nepal, killing five foreign climbers and two Nepali guides, officials said.
Five foreigners were injured at the base camp on Mount Yalung Ri, located a… [+1349 chars]",,"Lawine in Nepal tötet 7 Bergsteiger am Mount Yalung Ri. Fünf ausländische Bergsteiger und zwei nepalesische Bergführer kamen ums Leben, als eine Lawine den Berg Yalung Ri traf, während die Rettungsteams mit unwegsamem Gelände und schlechtem Wetter zu kämpfen hatten.",Avalanche in Nepal kills 7 climbers on Mount Yalung Ri. Five foreign climbers and two Nepali guides were killed when an avalanche struck Mount Yalung Ri as rescue teams are facing rough terrain and poor weather.,Avalanche in Nepal 7 viverra tellus in monte Yalung Ri. Quinque peregrini viverra tellus et duo duces Nepali caesi sunt cum montem Yalung Ri- dentem cadentem ut iunctos liberare loca aspera et tempestatem egentem opponunt.,2025-10-21 13:36:59+00:00
537d5646ba9b3a3071fc7576b16eb8aa,2025-11-04T02:55:07Z,'avalanche missing',www.aljazeera.com,en,0.9,"Avalanche hits Nepal’s Mount Yalung Ri, killing seven climbers","Victims include five foreigners and two Nepalis, while four others remain missing, media reports say.",https://www.aljazeera.com/news/2025/11/4/avalanche-hits-nepals-mount-yalung-ri-killing-seven-climbers,https://www.aljazeera.com/wp-content/uploads/2025/11/AFP__20251021__pariyar-notitle251021_npYMn__v1__MidRes__WithTheSkiesClearingOverTheK-1762220864.jpg?resize=1200%2C675,,"At least seven people, including five foreigners, have been killed in eastern Nepal after an avalanche swept through a camp on Mount Yalung Ri, according to media reports.
The Kathmandu Post, citing… [+2253 chars]",,"Lawine trifft Nepals Berg Yalung Ri und tötet sieben Bergsteiger. Zu den Opfern zählen laut Medienberichten fünf Ausländer und zwei Nepalesen, während vier weitere weiterhin vermisst werden.","Avalanche hits Nepal’s Mount Yalung Ri, killing seven climbers. Victims include five foreigners and two Nepalis, while four others remain missing, media reports say.","Avalanche in monte Yalung Ri Nepali pervenit, septem tellus occidens. Victimae quinque peregrini et duo Nepalis includuntur, cum quattuor alii absentes manent, instrumentorum relationes dicunt.",2025-10-21 13:36:59+00:00
d3b4c5793e8f9dcf7e7b616905e9d5f0,2025-11-04T06:40:33Z,'avalanche search',abcnews.go.com,en,0.9,Rescuers in Nepal search for climbers' bodies after deadly avalanche,Rescuers are digging through ice and snow on a mountain in Nepal to recover the bodies of seven climbers who were killed by an avalanche,https://abcnews.go.com/International/wireStory/rescuers-nepal-search-climbers-bodies-after-deadly-avalanche-127160326,https://s.abcnews.com/images/US/abc_news_default_2000x2000_update_16x9_992.jpg,,"KATHMANDU, Nepal -- Rescuers were digging through ice and snow on a mountain in Nepal on Tuesday to recover the bodies of seven climbers who were killed by an avalanche a day earlier, officials said.… [+852 chars]",,"Retter in Nepal suchen nach tödlicher Lawine nach Leichen von Bergsteigern. Retter graben sich auf einem Berg in Nepal durch Eis und Schnee, um die Leichen von sieben Bergsteigern zu bergen, die durch eine Lawine getötet wurden",Rescuers in Nepal search for climbers' bodies after deadly avalanche. Rescuers are digging through ice and snow on a mountain in Nepal to recover the bodies of seven climbers who were killed by an avalanche,"Rescuers in Nepalia inquisitionis corporum viverra tellus post mortiferum montem cadentem. Liberatores per glaciem et nivem in monte Nepal fodiunt ad corpora recuperanda septem tellus, qui ab avalanche interfecti sunt.",2025-10-21 13:36:59+00:00
0ae720daf1efd042e0f17a80e602a237,2025-11-04T09:17:00Z,'avalanche search',news.sky.com,en,0.9,Avalanche survivor 'was lucky' as rescuers search for bodies of dead climbers,"A French climber has said she was ""lucky"" to survive an avalanche in which her husband died, as rescue teams work to recover the bodies of seven people killed in the Himalayas on Monday morning.",https://news.sky.com/story/rescuers-in-nepal-searching-for-bodies-of-seven-climbers-killed-in-mount-yalung-ri-avalanche-13463648,https://e3.365dm.com/25/11/1600x900/skynews-kathmandu-nepal-avalanche_7071390.jpg?20251104091551,,"A French climber has said she was ""lucky"" to survive an avalanche in which her husband died, as rescue teams work to recover the bodies of seven people killed in the Himalayas on Monday morning.
Isa… [+1972 chars]",,"Lawinenüberlebender hatte „Glück“, als Retter nach Leichen toter Bergsteiger suchen. Eine französische Bergsteigerin sagte, sie habe „Glück“ gehabt, eine Lawine zu überleben, bei der ihr Mann ums Leben kam, während Rettungsteams am Montagmorgen daran arbeiteten, die Leichen von sieben im Himalaya getöteten Menschen zu bergen.","Avalanche survivor 'was lucky' as rescuers search for bodies of dead climbers. A French climber has said she was ""lucky"" to survive an avalanche in which her husband died, as rescue teams work to recover the bodies of seven people killed in the Himalayas on Monday morning.","NIVIS superstes 'faelix fuit' quasi servatores quaerentes corpora mortuorum viverra tellus. Exhibuit Gallicus dixit eam ""felix"" superesse NIVIS, in qua vir mortuus est, ut iugis liberandae laborant, ut corpora septem hominum in Himalayas die Lunae mane occisorum recuperarent.",2025-10-21 13:36:59+00:00
4d9de18f43f5ce5a4b99dedf083c4eba,2025-11-04T09:36:04Z,'avalanche rescue',english.khabarhub.com,en,0.9,"Five rescued, seven still missing after avalanche in Rolwaling Valley","BEDING: Five people, two foreigners and three Nepalis, injured in an avalanche in the Rolwaling Valley have been rescued by helicopter on Tuesday, while seven others remain missing. Chief District Officer Narayan Prasad Risal said the rescued climbers were ai…",https://english.khabarhub.com/2025/04/504329/,https://english.khabarhub.com/wp-content/uploads/2025/11/avalanche.jpg,,"BEDING: Five people, two foreigners and three Nepalis, injured in an avalanche in the Rolwaling Valley have been rescued by helicopter on Tuesday, while seven others remain missing.
Chief District O… [+809 chars]",,"Fünf gerettet, sieben werden nach Lawine im Rolwaling-Tal noch vermisst. BEDING: Fünf Menschen, zwei Ausländer und drei Nepalesen, die bei einer Lawine im Rolwaling-Tal verletzt wurden, wurden am Dienstag mit einem Hubschrauber gerettet, sieben weitere werden weiterhin vermisst. Der Chief District Officer Narayan Prasad Risal sagte, die geretteten Bergsteiger seien geflogen…","Five rescued, seven still missing after avalanche in Rolwaling Valley. BEDING: Five people, two foreigners and three Nepalis, injured in an avalanche in the Rolwaling Valley have been rescued by helicopter on Tuesday, while seven others remain missing. Chief District Officer Narayan Prasad Risal said the rescued climbers were ai…","Quinque servati, septem adhuc desunt post montem cadentem in valle Rolwaling. BEDING: Quinque homines, duo peregrini et tres Nepalis, in avalanche in valle Rolwaling laesi, helicopter die Martis erepti sunt, cum septem alii manent. Dux Districtus Narayan Prasad Risal dixit servati tellus erant ai ...",2025-10-21 13:36:59+00:00
1191bb46417c1968da0d9f24ecad2c23,2025-11-04T17:42:30Z,'avalanche search',biztoc.com,en,0.9,Rescuers in Nepal search for climbers killed in an avalanche,"The Dolkha district administration office said that eight other climbers who were injured in the avalanche were flown to the capital, Kathmandu, for treatment.",https://biztoc.com/x/a8f3db1dcaa68f6f,https://biztoc.com/cdn/a8f3db1dcaa68f6f_s.webp,,"The Dolkha district administration office said that eight other climbers who were injured in the avalanche were flown to the capital, Kathmandu, for treatment.
This story appeared on pbs.org, 2025-1… [+13 chars]",,"Retter in Nepal suchen nach bei einer Lawine getöteten Bergsteigern. Acht weitere bei der Lawine verletzte Bergsteiger seien zur Behandlung in die Hauptstadt Kathmandu geflogen worden, teilte das Verwaltungsbüro des Distrikts Dolkha mit.","Rescuers in Nepal search for climbers killed in an avalanche. The Dolkha district administration office said that eight other climbers who were injured in the avalanche were flown to the capital, Kathmandu, for treatment.","Rescuers in Nepal search for viverra tellus in NIVIS interfecti. In administratione districtus Dolkha officium dixit octo alios viverra tellus, qui in NIVIS CASUS erant vulnerati, ad caput Kathmandu volaverunt.",2025-10-21 13:36:59+00:00
1a4ccfee31c2a7a4d1f6cae1688ec5f7,2025-11-06T10:53:27Z,'avalanche rescue',www.digitaljournal.com,en,0.9,Nepal searches for avalanche victims,"Nepali rescuers on Thursday searched for the bodies of multiple climbers killed in an avalanche this week, while Italy said five citizens reported missing in a separate incident were safe.  Seven people were killed on Monday when an avalanche hit multiple exp…",https://www.digitaljournal.com/world/nepal-searches-for-avalanche-victims/article,https://www.digitaljournal.com/wp-content/uploads/2025/11/3b293a7aaefb2b29daf9d5cb14d7cff11a36fcc3-1.jpg,,"Avalanche survivors Didier Armand Berton (L) and Isabelle Thaon in a Kathmandu hospital - Copyright AFP Prakash MATHEMA
Nepali rescuers on Thursday searched for the bodies of multiple climbers kille… [+1611 chars]",,"Nepal sucht nach Lawinenopfern. Nepalesische Retter suchten am Donnerstag nach den Leichen mehrerer Bergsteiger, die diese Woche bei einem Lawinenunglück ums Leben kamen, während Italien sagte, fünf Bürger, die bei einem anderen Vorfall als vermisst gemeldet wurden, seien in Sicherheit.  Sieben Menschen kamen am Montag ums Leben, als eine Lawine mehrere Exp…","Nepal searches for avalanche victims. Nepali rescuers on Thursday searched for the bodies of multiple climbers killed in an avalanche this week, while Italy said five citizens reported missing in a separate incident were safe.  Seven people were killed on Monday when an avalanche hit multiple exp…","Nepalia victimas NIVIS perquirit. Nepalica servatores die Iovis quaesiverunt corpora multiplex tellus in NIVIS CASUS hac septimana occisa, cum Italia quinque cives nuntiaverunt absentes in res separatas esse securas.  Septem homines die Lunae caesi sunt, cum NIVIS CASUS multiplex exp…",2025-10-21 13:36:59+00:00
8f2af3c453f8e3c59b4a37946bf4828f,2025-11-18T23:02:28Z,'avalanche snow',www.bbc.com,en,0.8,Date set for Scotland's new avalanche forecasting season,"Last season, the Scottish Avalanche Information Service recorded its fewest snow slides in 37 years.",https://www.bbc.com/news/articles/crexgxlr41wo,https://ichef.bbci.co.uk/news/1024/branded_news/1996/live/45d07a60-c494-11f0-9025-c36e7e423373.jpg,,"Scotland's new avalanche forecasting season will start on 11 December in six mountain areas.

Lochaber, Glen Coe, Creag Meagaidh, Torridon and Northern and Southern Cairngorms are monitored for avala… [+842 chars]",,Datum für Schottlands neue Lawinenvorhersagesaison festgelegt. In der vergangenen Saison verzeichnete der Scottish Avalanche Information Service die wenigsten Schneerutsche seit 37 Jahren.,"Date set for Scotland's new avalanche forecasting season. Last season, the Scottish Avalanche Information Service recorded its fewest snow slides in 37 years.","Dies datus est in Scotia NIVIS CASUS novum tempus praevidens. Novissimo tempore, Scotorum Avalanche Information Service memoriae minimas nix labitur in 37 annis.",2025-11-20 13:36:59+00:00
0585756e770345c424503c7115eb3976,2025-11-10T06:19:23Z,'avalanche missing',thehockeynews.com,en,0.2,Canucks Tie Game Late But Fall 5-4 In Overtime To The Avalanche,The Vancouver Canucks fell 5-4 in overtime to the Colorado Avalanche.,https://thehockeynews.com/nhl/vancouver-canucks/game-day/canucks-tie-game-late-but-fall-5-4-in-overtime-to-the-avalanche,https://deweb-519a7.b-cdn.net/post-images/3c2f9253-f92f-489c-9f87-cd65c9f8e647.jpeg,,"The Vancouver Canucks fought hard but came up just short as they fell 5-4 in overtime to the Colorado Avalanche. Linus Karlsson, Kiefer Sherwood, and Drew O'Connor scored while Jake DeBrusk tied the … [+4564 chars]",,"Die Canucks haben ein spätes Unentschieden, unterliegen aber in der Verlängerung der Avalanche mit 5:4. Die Vancouver Canucks unterlagen in der Verlängerung mit 5:4 den Colorado Avalanche.",Canucks Tie Game Late But Fall 5-4 In Overtime To The Avalanche. The Vancouver Canucks fell 5-4 in overtime to the Colorado Avalanche.,Canucks iungite Ludus late sed cadite 5-4 in overtime NIVIS. Vancuverium Canucks 5-4 in subsicivum ad Colorado Avalanche cecidit.,2025-12-17 22:29:32+00:00
d41c4ed5b1310d37536044cc2e68d644,2025-11-19T17:42:54Z,'avalanche missing',thehockeynews.com,en,0.2,"Islanders' Matthew Schaefer, Avalanche's Cale Makar Already Near-Locks in NHL Award Races","An 18-year-old phenom and a Norris contender are dominating early NHL award races, setting impressive records and dazzling fans.",https://thehockeynews.com/betting/futures/islanders-matthew-schaefer-avalanche-s-cale-makar-already-near-locks-in-nhl-award-races,https://s.yimg.com/ny/api/res/1.2/rzddiF8qA.Y0NfVzR9YP_w--/YXBwaWQ9aGlnaGxhbmRlcjt3PTEyMDA7aD04MDA7Y2Y9d2VicA--/https://media.zenfs.com/en/the_hockey_news_articles_331/a0b7dc72067057220989ec1d77f388b5,,"The 2025-26 NHL season is barely a month old, but two players are already emerging as near-locks for the leagues top individual honors. On the Calder Trophy front, New York Islanders defenseman Matth… [+3094 chars]",,"Matthew Schaefer von den Islanders und Cale Makar von Avalanche sind bei den NHL Award Races bereits knapp dran. Ein 18-jähriges Phänomen und ein Norris-Anwärter dominieren die frühen NHL-Preisrennen, stellen beeindruckende Rekorde auf und begeistern die Fans.","Islanders' Matthew Schaefer, Avalanche's Cale Makar Already Near-Locks in NHL Award Races. An 18-year-old phenom and a Norris contender are dominating early NHL award races, setting impressive records and dazzling fans.","Insulani Matthaeus Schaefer, Cale Makar Avalanche Iam Prope-Locks in NHL Award Races. An duodequadraginta annorum phaenom et Norrisius contendens nationes primae NHL iudicandi dominantur, monumenta infigenda et lucida fans disponentia.",2025-12-17 22:29:32+00:00
97c7dad48d6eed9d560836c89f0b0634,2025-11-20T19:15:44Z,'avalanche missing',thehockeynews.com,en,0.2,NHL Power Rankings: The Parity Is Insane,"As the Colorado Avalanche continue to lead the NHL power rankings, the other 31 teams continue to move all over the place.",https://thehockeynews.com/news/latest-news/nhl-power-rankings-the-parity-is-insane,https://s.yimg.com/ny/api/res/1.2/zQmS1cREdILOkS9iW_FxNg--/YXBwaWQ9aGlnaGxhbmRlcjt3PTEyMDA7aD03OTk7Y2Y9d2VicA--/https://media.zenfs.com/en/the_hockey_news_articles_331/8d12123de53bc37f3d0d62c55ae1f246,http://web.archive.org/web/20251217223221/https://thehockeynews.com/news/latest-news/nhl-power-rankings-the-parity-is-insane,"Aside from the Colorado Avalanche leading the NHL power rankings and a few bottom dwellers, are we really sure where each team stands a month-and-a-half into the season?
There are more than 20 teams… [+12764 chars]",,"NHL Power Rankings: Die Parität ist verrückt. Während die Colorado Avalanche weiterhin die NHL-Power-Rangliste anführen, bewegen sich die anderen 31 Teams weiterhin überall.","NHL Power Rankings: The Parity Is Insane. As the Colorado Avalanche continue to lead the NHL power rankings, the other 31 teams continue to move all over the place.","NHL Power Rankings: Paritas Insana est. Cum Colorado Avalanche pergunt ducere vim NHL nullarum, ceterae 31 iunctiones toto loco moveri pergunt.",2025-12-17 22:29:32+00:00
f9d8d950e04c6588d9d8216225f5b1c1,2025-11-15T12:00:00Z,'avalanche missing',longreads.com,en,0.3,"Boomers Are Passing Down Fortunes — And Way, Way Too Much Stuff","""As the $90 trillion Great Wealth Transfer begins, millennials and Gen X aren’t just inheriting money. They’re being buried under an avalanche of baseball cards, fine china and collections of all sorts.""",http://longreads.com/2025/11/15/bloomberg-great-wealth-transfer/,,,"My mother’s been cleaning out the rambling study in the house she shared with my late fatherwhich means that last week, I started researching how to ship a crate of records across the country. Next u… [+1773 chars]",,"Boomer geben Vermögen weiter – und viel, viel zu viel Zeug. „Während der 90 Billionen Dollar schwere Great Wealth Transfer beginnt, erben Millennials und die Generation X nicht nur Geld. Sie werden unter einer Lawine von Baseballkarten, feinem Porzellan und Sammlungen aller Art begraben.“","Boomers Are Passing Down Fortunes — And Way, Way Too Much Stuff. ""As the $90 trillion Great Wealth Transfer begins, millennials and Gen X aren’t just inheriting money. They’re being buried under an avalanche of baseball cards, fine china and collections of all sorts.""","Boomers fortunas transgrediuntur — Et via, via nimium effercio. ""Sicut $90 trillion Magnae divitiae Translatio incipit, millenniales et Gen X pecuniam non possident. Sub avalanche chartarum baseballe, denique chinae et collectionum omnium generum conditi sunt.""",2025-12-17 22:29:32+00:00
e562adfee41fa1bcf5194c089442bda6,2025-11-17T15:30:14Z,'avalanche missing',www.cbsnews.com,en,0.3,Remains of man missing for 31 years found by climbers on glacier,Officers reached the site by helicopter to collect the remains and personal effects from the Ober Gabelhorn glacier.,https://www.cbsnews.com/news/remains-climber-missing-1994-found-glacier-switzerland/,https://assets2.cbsnewsstatic.com/hub/i/r/2025/11/17/1a399acf-9a4b-41c8-99c1-1d65da9d366b/thumbnail/1200x630/111ae3a39e51bae024d539240bdd6610/glacier-2025-10-18-obergabelhorn-polcantvs-1200x675.jpg,,"The remains of a climber who went missing in 1994 have been found on a Swiss glacier, police said.
Climbers ascending the Ober Gabelhorn mountain discovered human remains on Oct. 15, the southern Wa… [+2576 chars]",,"Überreste eines seit 31 Jahren vermissten Mannes von Bergsteigern auf Gletscher gefunden. Die Beamten erreichten den Ort mit einem Hubschrauber, um die Überreste und persönlichen Gegenstände vom Ober-Gabelhorn-Gletscher einzusammeln.",Remains of man missing for 31 years found by climbers on glacier. Officers reached the site by helicopter to collect the remains and personal effects from the Ober Gabelhorn glacier.,Reliquiae hominis absentis per 31 annos inventae sunt ab viverra tellus in glaciem. Praefecti locum pervenerunt ab helicopter ad colligendas reliquias et effectus personales ex glacie Ober Gabelhorn.,2025-12-17 22:29:32+00:00
ad9531cbef00e86c3ad2159b9d0f8b31,2025-11-28T13:45:00Z,'avalanche protection',nypost.com,en,0.3,"Chill out, the hottest YETI Black Friday deals just hit Amazon — 30% off tumblers and gear",We dug through this avalanche of deals to find the the best Black Friday YETI markdowns.,https://nypost.com/shopping/best-yeti-black-friday-deals-sales-2025/,https://nypost.com/wp-content/uploads/sites/2/2025/11/yetideals.jpg?quality=75&strip=all&w=1200,,"New York Post may be compensated and/or receive an affiliate commission if you click or buy through our links. Featured pricing is subject to change.
Brace yourself, shoppers!
Nov. 28 has finally l… [+5825 chars]",,"Entspannen Sie sich, die heißesten YETI Black Friday-Angebote sind gerade bei Amazon erhältlich – 30 % Rabatt auf Trinkgläser und Ausrüstung. Wir haben diese Lawine an Angeboten durchforstet, um die besten YETI-Abschläge für den Black Friday zu finden.","Chill out, the hottest YETI Black Friday deals just hit Amazon — 30% off tumblers and gear. We dug through this avalanche of deals to find the the best Black Friday YETI markdowns.","Gelidus foras, calidissimus YETI Niger Veneris agit iustus ledo Amazon - 30% off heminas et calces. Fodimus per hanc NIVIS CAULIS ut optimus Niger Veneris YETI markdownum inveniatur.",2025-12-18 13:42:27+00:00
cc62991009560bf98f33fa90c495726b,2025-11-03T12:27:00Z,'avalanche ski',newatlas.com,en,0.3,Giant rotating hamster wheels aim to 'revolutionize' indoor skiing,"An Australian company is preparing to roll out a series of giant, rotating ski barrels designed to make the experience of carving endless fresh snow available to city folk without a long drive. We talk to Snowtunnel co-founder and CEO Scott Kessler.Continue R…",https://newatlas.com/ski-snowboard/snowtunnel-indoor-ski-rotating/,https://assets.newatlas.com/dims4/default/6228d3f/2147483647/strip/true/crop/1920x1008+0+36/resize/1200x630!/quality/90/?url=https%3A%2F%2Fnewatlas-brightspot.s3.amazonaws.com%2Fd9%2F9f%2F71d8166a489c9e7fd185a52354fd%2Fstill-1-tunnel.jpg&na.image_optimisation=0,,"An Australian company is preparing to roll out a series of giant, rotating ski barrels designed to make the experience of carving endless fresh snow available to city folk without a long drive. We ta… [+6694 chars]",,"Riesige rotierende Hamsterräder sollen das Indoor-Skifahren „revolutionieren“. Ein australisches Unternehmen bereitet die Einführung einer Reihe riesiger, rotierender Skifässer vor, die Stadtbewohnern das Erlebnis des grenzenlosen Neuschnees ohne lange Autofahrt ermöglichen sollen. Wir sprechen mit Scott Kessler, Mitbegründer und CEO von Snowtunnel.Weiter R…","Giant rotating hamster wheels aim to 'revolutionize' indoor skiing. An Australian company is preparing to roll out a series of giant, rotating ski barrels designed to make the experience of carving endless fresh snow available to city folk without a long drive. We talk to Snowtunnel co-founder and CEO Scott Kessler.Continue R…","Ingentes cricetae rotae intendunt, ut 'revolutionibus' indoor skiing. Comitatu Australiae parat seriem gigantis evolvere, ski dolia rotata destinata, ut experientiam insculpendi infinitas novas nives praesto esse urbanas sine longa coegi. Loquimur Snowtunnel co-conditor et CEO Scott Kessler.Continue R…",2025-12-18 22:28:47+00:00
f07336cb69a0de41382601847c27ca7c,2025-11-13T06:00:11Z,'avalanche ski',www.bbc.com,en,0.3,How Ukraine is fighting to hold on through another freezing winter amid Russia's growing attacks,Almost four years of conflict have taken their toll and the war of attrition is continuing on the homefront - but many Ukrainians are fighting to keep morale high.,https://www.bbc.com/news/articles/cly98qp99l8o,https://ichef.bbci.co.uk/news/1024/branded_news/b364/live/26eb4680-bfe3-11f0-8456-eff94716b162.jpg,,"In her Soviet-era apartment block on the outskirts of eastern Kyiv, Oksana Zinkovska-Boyarska lives with daily power cuts. The lift to her eighth-floor apartment often stops, the lights go out and so… [+12622 chars]",,"Wie die Ukraine angesichts zunehmender Angriffe Russlands darum kämpft, einen weiteren eiskalten Winter zu überstehen. Fast vier Jahre Konflikt haben ihren Tribut gefordert und der Zermürbungskrieg an der Heimatfront geht weiter – doch viele Ukrainer kämpfen darum, die Moral hochzuhalten.",How Ukraine is fighting to hold on through another freezing winter amid Russia's growing attacks. Almost four years of conflict have taken their toll and the war of attrition is continuing on the homefront - but many Ukrainians are fighting to keep morale high.,Quomodo Ucraina pugnat tenere per aliam hiemem congelatam inter impetus Russiae crescentis. Prope quattuor annos conflictus vectigal ceperunt et bellum attritionis in domo domestica continuatum est - sed multi Ucraini pugnant ut altam moralem custodiam.,2025-12-18 22:28:47+00:00
