index,published,keyword,domain,language,valid,title,description,url,image,archive,content,quote,de,en,la,added
62e4fcf4466b4622b8918b939af1b7ca,2025-11-04T08:13:58Z,'avalanche search',www.independent.ie,en,0.8,Nepalese search teams look for bodies after avalanche,Search teams are digging through ice and snow on a mountain in Nepal in a bid to recover the bodies of seven climbers who were killed by an avalanche.,https://www.independent.ie/world-news/asia-pacific/nepalese-search-teams-look-for-bodies-after-avalanche/a229904675.html,https://focus.independent.ie/thumbor/ljwzis2A_6CSoSHX4hH_dx5_vgw=/0x0:2894x1929/629x0/prod-mh-ireland/cf52d1a9-2baa-48d4-bfef-0a0c650d57c5/df125f60-42ec-4423-8532-0c8d9ffc3a66/cf52d1a9-2baa-48d4-bfef-0a0c650d57c5.jpg,,Search teams are digging through ice and snow on a mountain in Nepal in a bid to recover the bodies of seven climbers who were killed by an avalanche.The avalanche hit the base camp at Mount Yalung R… [+782 chars],,"Nepalesische Suchtrupps suchen nach Lawine nach Leichen. Suchtrupps graben sich durch Eis und Schnee auf einem Berg in Nepal, um die Leichen von sieben Bergsteigern zu bergen, die durch eine Lawine getötet wurden.",Nepalese search teams look for bodies after avalanche. Search teams are digging through ice and snow on a mountain in Nepal in a bid to recover the bodies of seven climbers who were killed by an avalanche.,"Nepalese iugis quaerendi corpora post montem cadentem. Quaerere iunctos per glaciem et nives in monte Nepal fodientes iubent corpora septem viverra tellus, qui ab NIVIS interfecti sunt.",2025-10-21 13:36:59+00:00
701d5f66c53ce101c9d895f042da891d,2025-11-04T09:26:43Z,'avalanche mountain',www.channelnewsasia.com,en,0.8,Fierce mountain storms kill 9 in Nepal,"KATHMANDU: Days of ferocious snowstorms and an avalanche in Nepal's treacherous Himalayan peaks have killed nine people, including five Italian climbers, officials said on Tuesday (Nov 4).The deaths occurr",https://www.channelnewsasia.com/asia/nepal-snowstorms-avalanche-killed-himalayas-yalung-ri-peak-5444361,"https://dam.mediacorp.sg/image/upload/s--Bq6cVFNL--/c_crop,h_449,w_799,x_1,y_6/c_fill,g_auto,h_676,w_1200/fl_relative,g_south_east,l_mediacorp:cna:watermark:2024-04:reuters_1,w_0.1/f_auto,q_auto/v1/one-cms/core/2025-10-05T052807Z_1_LYNXNPEL9401A_RTROPTP_3_ASIA-WEATHER-NEPAL.JPG?itok=6NX3KmoC",,"KATHMANDU: Days of ferocious snowstorms and an avalanche in Nepal's treacherous Himalayan peaks have killed nine people, including five Italian climbers, officials said on Tuesday (Nov 4).
The death… [+1771 chars]",,"Heftige Gebirgsstürme töten in Nepal neun Menschen. KATHMANDU: Tagelang heftige Schneestürme und eine Lawine in Nepals tückischen Himalaya-Gipfeln haben neun Menschen getötet, darunter fünf italienische Bergsteiger, sagten Beamte am Dienstag (4. November). Die Todesfälle ereigneten sich","Fierce mountain storms kill 9 in Nepal. KATHMANDU: Days of ferocious snowstorms and an avalanche in Nepal's treacherous Himalayan peaks have killed nine people, including five Italian climbers, officials said on Tuesday (Nov 4).The deaths occurr","In Nepalia monte feroces tempestates occidunt IX. KATHMANDU: Dies ferocium nivis et NIVIS in Nepaliae iugis perfidi Himalayan occiderunt novem homines, in quibus quinque viverra Italiae, ministri die Martis (IV Nov. 4). Mortes occurrunt.",2025-10-21 13:36:59+00:00
6a61a43c8ebaa96b89a3ca000c2279c8,2025-11-04T09:49:41Z,'avalanche snow',indianexpress.com,en,0.8,36 people ‘buried’ alive to test device that can be crucial for survival during an avalanche in snowy regions,Science news: A new study of an avalanche safety device has found out that it can help buried victims survive longer by maintaining oxygen levels and reducing carbon dioxide buildup.,https://indianexpress.com/article/technology/science/avalanche-safety-device-test-oxygen-supply-rescue-safeback-10345065/,https://images.indianexpress.com/2025/11/Avalanche-1.png,,A group of 36 volunteers were ‘buried’ alive during a study for science. The new clinical trial has found that a user-carried avalanche safety device can prevent hypoxemia and hypercapnia for a signi… [+2314 chars],,"36 Menschen wurden lebendig „begraben“, um ein Gerät zu testen, das bei einem Lawinenabgang in verschneiten Regionen überlebenswichtig sein kann. Wissenschaftsnachrichten: Eine neue Studie zu einem Lawinensicherheitsgerät hat herausgefunden, dass es verschütteten Opfern helfen kann, länger zu überleben, indem es den Sauerstoffgehalt aufrechterhält und die Kohlendioxidbildung reduziert.",36 people ‘buried’ alive to test device that can be crucial for survival during an avalanche in snowy regions. Science news: A new study of an avalanche safety device has found out that it can help buried victims survive longer by maintaining oxygen levels and reducing carbon dioxide buildup.,36 homines 'sepulti vivam ad probandam machinam quae crucior potest esse in NIVIS nivis in regionibus'. Scientia nuntiorum: Novum studium NIVIS CAUALIS technae salutis invenit eum posse iuvare victimas sepultas diutius superesse conservando gradus oxygenii et reducendo dioxydum carbonii aedificatum.,2025-10-21 13:36:59+00:00
a9ef279717405fbc2919744577f4ffd9,2025-11-04T17:34:05Z,'avalanche search',www.pbs.org,en,0.8,Rescuers in Nepal search for climbers killed in an avalanche,"The Dolkha district administration office said that eight other climbers who were injured in the avalanche were flown to the capital, Kathmandu, for treatment.",https://www.pbs.org/newshour/world/rescuers-in-nepal-search-for-climbers-killed-in-an-avalanche,https://d3i6fh83elv35t.cloudfront.net/static/2025/11/2025-11-04T131350Z_745441631_RC2CPHA9ESNY_RTRMADP_3_NEPAL-AVALANCHE-1024x768.jpg,,"KATHMANDU, Nepal (AP) Rescuers dug through ice and snow on a mountain in Nepal on Tuesday to look for the bodies of seven climbers who were killed by an avalanche, officials said.
The avalanche poun… [+1837 chars]",,"Retter in Nepal suchen nach bei einer Lawine getöteten Bergsteigern. Acht weitere bei der Lawine verletzte Bergsteiger seien zur Behandlung in die Hauptstadt Kathmandu geflogen worden, teilte das Verwaltungsbüro des Distrikts Dolkha mit.","Rescuers in Nepal search for climbers killed in an avalanche. The Dolkha district administration office said that eight other climbers who were injured in the avalanche were flown to the capital, Kathmandu, for treatment.","Rescuers in Nepal search for viverra tellus in NIVIS interfecti. In administratione districtus Dolkha officium dixit octo alios viverra tellus, qui in NIVIS CASUS erant vulnerati, ad caput Kathmandu volaverunt.",2025-10-21 13:36:59+00:00
2c8b27a8a4b26ce0939f4498acf06350,2025-11-04T21:27:29Z,'avalanche snow',www.cbc.ca,en,0.8,7 climbers presumed dead after avalanche in Nepal,"Rescuers dug through ice and snow on a mountain in Nepal on Tuesday to look for the bodies of seven climbers who were killed by an avalanche, officials said.",https://www.cbc.ca/news/world/nepal-avalanche-canadian-9.6966678,"https://i.cbc.ca/ais/87024bf6-37df-4235-8bb8-c1c2b0172f71,1762291331279/full/max/0/default.jpg?im=Crop%2Crect%3D%280%2C579%2C3024%2C1701%29%3BResize%3D620",,"Rescuers dug through ice and snow on a mountain in Nepal on Tuesday to look for the bodies of seven climbers who were killed by an avalanche, officials said.
The avalanche pounded the base camp at M… [+1769 chars]",,"Sieben Bergsteiger nach Lawine in Nepal vermutlich ums Leben gekommen. Retter gruben sich am Dienstag auf einem Berg in Nepal durch Eis und Schnee, um nach den Leichen von sieben Bergsteigern zu suchen, die bei einer Lawine ums Leben gekommen waren, sagten Beamte.","7 climbers presumed dead after avalanche in Nepal. Rescuers dug through ice and snow on a mountain in Nepal on Tuesday to look for the bodies of seven climbers who were killed by an avalanche, officials said.","7 viverra tellus praesumpserunt post montem cadentem in Nepalia. Reservatores per glaciem et nivem in monte Nepal effoderunt die Martis corpora septem viverra tellus quaerere, qui magistratus ab avalanche interfecti sunt.",2025-10-21 13:36:59+00:00
ac4c2540c51cff9a0357f72ac5722cfd,2025-11-06T03:45:30Z,'avalanche rescue',www.aljazeera.com,en,0.8,"Seven Italian climbers missing in Nepal as storms, avalanches leave 9 dead","Italy says communication between rescue teams, local officials, foreign diplomatic missions 'extremely challenging'.",https://www.aljazeera.com/news/2025/11/6/seven-italian-climbers-missing-in-nepal-as-storms-avalanches-leave-9-dead,https://www.aljazeera.com/wp-content/uploads/2025/11/AFP__20180417__14301M__v1__HighRes__NepalEnvironmentHimalayasEverest-1762396636.jpg?resize=1920%2C1440,,"Seven Italian climbers are missing in Nepals Himalayan mountains after heavy snowstorms and avalanches have killed at least nine people in recent days.
Three Italian climbers were among five foreign… [+2840 chars]",,"Sieben italienische Bergsteiger werden in Nepal vermisst, weil Stürme und Lawinen neun Tote fordern. Italien bezeichnet die Kommunikation zwischen Rettungsteams, örtlichen Beamten und ausländischen diplomatischen Vertretungen als „äußerst herausfordernd“.","Seven Italian climbers missing in Nepal as storms, avalanches leave 9 dead. Italy says communication between rescue teams, local officials, foreign diplomatic missions 'extremely challenging'.","Septem tellus Italiae in Nepalia absentis pro procellis avalanches 9 mortua est relinquere. Italia dicit communicationem inter iunctos liberandos, officiales locales, missiones diplomaticas exteras 'maxime provocantes'.",2025-10-21 13:36:59+00:00
58a9af5b3a8346edbbdc7cc608b14387,2025-11-06T11:10:42Z,'avalanche search',www.channelnewsasia.com,en,0.8,Nepal searches for avalanche victims,"KATHMANDU: Nepali rescuers on Thursday (Nov 6) searched for the bodies of multiple climbers killed in an avalanche this week, while Italy said five citizens reported missing in a separate incident were safe.Seven people were killed on Monday when",https://www.channelnewsasia.com/asia/nepal-searches-avalanche-victims-climbers-yalung-ri-5450556,"https://dam.mediacorp.sg/image/upload/s--C6L43H1X--/c_crop,h_576,w_1024,x_0,y_46/c_fill,g_auto,h_676,w_1200/fl_relative,g_south_east,l_mediacorp:cna:watermark:2023-11:afp_watermark_14112023,w_0.1/f_auto,q_auto/v1/mediacorp/cna/image/2025/11/06/000_82xa4az.jpg?itok=34kskdl2",,"KATHMANDU: Nepali rescuers on Thursday (Nov 6) searched for the bodies of multiple climbers killed in an avalanche this week, while Italy said five citizens reported missing in a separate incident we… [+1047 chars]",,"Nepal sucht nach Lawinenopfern. KATHMANDU: Nepalesische Retter suchten am Donnerstag (6. November) nach den Leichen mehrerer Bergsteiger, die diese Woche bei einer Lawine ums Leben kamen, während Italien sagte, fünf Bürger, die bei einem anderen Vorfall als vermisst gemeldet wurden, seien in Sicherheit. Sieben Menschen wurden am Montag getötet, als","Nepal searches for avalanche victims. KATHMANDU: Nepali rescuers on Thursday (Nov 6) searched for the bodies of multiple climbers killed in an avalanche this week, while Italy said five citizens reported missing in a separate incident were safe.Seven people were killed on Monday when","Nepalia victimas NIVIS perquirit. KATHMANDU: Servatores Nepali die Iovis (Nov. 6) quaesiverunt corpora plurium viverrarum in NIVIS hac septimana occisorum, cum Italia quinque cives nuntiaverunt absentes in res singulas esse incolumes. Septem homines die Lunae in quo caesi sunt.",2025-10-21 13:36:59+00:00
6e7445376228f8ad0c60d66344a2ddf4,2025-11-06T16:24:49Z,'avalanche ski',www.cbsnews.com,en,0.8,2nd body found 8 months after avalanche buried 3 friends in Alaska,"Three friends in their late 30s were heliskiing together in Girdwood, Alaska in March when they were swept away by an avalanche.",https://www.cbsnews.com/news/remains-recovered-alaska-avalanche-search-rescue-skiers/,https://assets2.cbsnewsstatic.com/hub/i/r/2025/03/05/9a75d824-7cf7-4d98-b05b-7af0f0586332/thumbnail/1200x630/45d8508c12c8442edf9da5e9172abd36/ap25064738076524.jpg,,"The body of a skier who went missing in an Alaskan avalanche eight months ago has been found, authorities said Tuesday. 
David Linder, 39, Charles Eppard, 39, and Jeremy Leif, 38, were heliskiing to… [+1705 chars]",,"Die zweite Leiche wurde 8 Monate nach der Lawine gefunden, die drei Freunde in Alaska verschüttete. Drei Freunde Ende 30 waren im März beim Heliskiing in Girdwood, Alaska, als sie von einer Lawine mitgerissen wurden.","2nd body found 8 months after avalanche buried 3 friends in Alaska. Three friends in their late 30s were heliskiing together in Girdwood, Alaska in March when they were swept away by an avalanche.","Corpus 2 post menses 8 inventum NIVIS CASUS III amicis in Alaska sepultum est. Tres amici in proximis suis XXX erant heliskiing in Girdwood, Alaska in Martio cum avalanche rapti sunt.",2025-10-21 13:36:59+00:00
767e9e9bc1dfed47f435c40db365d27c,2025-11-02T11:27:53Z,'avalanche snow',www.irishtimes.com,en,0.9,Five German climbers killed in Italian Alps avalanche,Members of two rope teams swept away by snow and ice,https://www.irishtimes.com/world/europe/2025/11/02/five-german-climbers-killed-in-italian-alps-avalanche/,https://www.irishtimes.com/resizer/v2/G3WVACTC3B5CATRSWGAIS5QDJA.jpg?smart=true&auth=dd9d8ba7dc9ec9b55604c0399f7444fa34f3520f0fbf14558dfb8e47f424efe3&width=1200&height=630,,"Five German climbers have died after being caught in an avalanche in the Italian Alps, local authorities said on Sunday.
The climbers had set out on Saturday to scale Cima Vertana in the Ortler moun… [+495 chars]",,Fünf deutsche Bergsteiger bei Lawine in den italienischen Alpen getötet. Mitglieder zweier Seilschaften wurden von Schnee und Eis mitgerissen,Five German climbers killed in Italian Alps avalanche. Members of two rope teams swept away by snow and ice,Quinque viverra tellus Germanorum in Alpibus Italicis NIVIS INTERFECTO. Socii duorum funerum iugis nivis et glaciei trahuntur,2025-10-21 13:36:59+00:00
179e98bb53b366bb08c126fc6ba219d7,2025-11-02T12:19:26Z,'avalanche rescue',www.thelocal.de,en,0.9,Five German mountaineers killed in Italian Alps avalanche,"Five German climbers, including a 17-year-old girl, were killed in an avalanche in the Dolomite mountains in Italy on Saturday afternoon, according to mountain rescue services.",https://www.thelocal.de/20251102/five-german-mountaineers-killed-in-italian-alps-avalanche,https://assets.thelocal.com/cdn-cgi/rs:fit:1200/quality:75/plain/https://apiwp.thelocal.com/wp-content/uploads/2025/11/watermarks-logo-aron-marinelli-ZuSzm9vn-fc-unsplash-1.jpg@webp,,"Five German climbers, including a 17-year-old girl, were killed in an avalanche in the Dolomite mountains in Italy on Saturday afternoon, according to mountain rescue services.
 Two groups of climbe… [+703 chars]",,"Fünf deutsche Bergsteiger sind bei einem Lawinenunglück in den italienischen Alpen ums Leben gekommen. Nach Angaben der Bergrettung sind am Samstagnachmittag in den italienischen Dolomiten fünf deutsche Bergsteiger, darunter ein 17-jähriges Mädchen, bei einem Lawinenabgang ums Leben gekommen.","Five German mountaineers killed in Italian Alps avalanche. Five German climbers, including a 17-year-old girl, were killed in an avalanche in the Dolomite mountains in Italy on Saturday afternoon, according to mountain rescue services.","Quinque Germani montani in Alpibus Italiae NIVIS occiderunt. Quinque viverra tellus Germanica, cum puella XVII annos nata, in monte Dolomite in Italia cadente in Italia die Sabbati post meridiem, iuxta montem officia liberanda, caesa sunt.",2025-10-21 13:36:59+00:00
957eaba0a550c53db744b3ad9c09258e,2025-11-02T15:00:00Z,'avalanche rescue',news.sky.com,en,0.9,Five German mountaineers die and two rescued after avalanche in Italy,The victims were travelling in three groups but rescuers said they didn't know why they were still ascending at a relatively late hour.,https://news.sky.com/story/five-german-mountaineers-die-and-two-rescued-after-avalanche-in-italy-13462642,https://e3.365dm.com/25/11/1600x900/skynews-avalanche-italy_7069785.jpg?20251102150646,,"Five German mountaineers have died in an avalanche in northern Italy.
It hit around 4pm on Saturday near Cima Vertana, in the Ortles mountains, at an altitude of more than 3,500m (11,500ft).
Two me… [+1043 chars]",,"Fünf deutsche Bergsteiger sterben und zwei werden nach Lawine in Italien gerettet. Die Opfer reisten in drei Gruppen, aber die Retter sagten, sie wüssten nicht, warum sie zu relativ später Stunde noch aufstiegen.",Five German mountaineers die and two rescued after avalanche in Italy. The victims were travelling in three groups but rescuers said they didn't know why they were still ascending at a relatively late hour.,Quinque montani Germani moriuntur et duo NIVIS in Italia servati sunt. Hostiae in tribus coetibus ibant sed salvatores dicebant se nescire cur adhuc sero hora relative ascendissent.,2025-10-21 13:36:59+00:00
1f905fbfd8c03ae86fa36c885bf1b6c1,2025-11-02T15:39:38Z,'avalanche mountain',www.npr.org,en,0.9,5 German mountaineers die in northern Italy after being hit by avalanche,"Five German mountaineers died after being hit by an avalanche in South Tyrol, in northern Italy, rescuers said on Sunday.",https://www.npr.org/2025/11/02/nx-s1-5594838/german-mountaineers-die-in-northern-italy-after-avalanche,https://npr.brightspotcdn.com/dims3/default/strip/false/crop/2000x1125+0+242/resize/1400/quality/100/format/jpeg/?url=http%3A%2F%2Fnpr-brightspot.s3.amazonaws.com%2F38%2Fad%2F79321dcd469c9b32202b48c0d324%2Fap25306444518837.jpg,,"ROME Five German mountaineers died after being hit by an avalanche in South Tyrol, in northern Italy, rescuers said on Sunday.
Three victims two men and a woman had already been recovered dead on Sa… [+1442 chars]",,"Fünf deutsche Bergsteiger sterben in Norditalien, nachdem sie von einer Lawine getroffen wurden. Fünf deutsche Bergsteiger starben, nachdem sie in Südtirol in Norditalien von einer Lawine getroffen worden waren, wie Retter am Sonntag mitteilten.","5 German mountaineers die in northern Italy after being hit by avalanche. Five German mountaineers died after being hit by an avalanche in South Tyrol, in northern Italy, rescuers said on Sunday.","5. Germani montani in Italia septentrionali post montem cadentem moriuntur. Quinque montani Germani mortui sunt postquam avalanche in Tyrol Australi, in Italia septentrionali, salvatores die Dominico dicti.",2025-10-21 13:36:59+00:00
f221986a5bd234178c355929a7de2a4f,2025-11-02T15:57:02Z,'avalanche mountain',www.independent.ie,en,0.9,Five mountaineers die after being hit by avalanche in Italy,"Five German mountaineers died after being hit by an avalanche in South Tyrol, in northern Italy, rescuers said on Sunday.",https://www.independent.ie/world-news/five-mountaineers-die-after-being-hit-by-avalanche-in-italy/a1566023273.html,https://focus.independent.ie/thumbor/MRP_PlDNwkqSxyEsSs0cmtY5HdM=/0x166:2000x1499/629x0/prod-mh-ireland/81fe8f04-cf54-4251-91b4-88919241a02e/7aa11f35-9f1d-4436-829f-a6908df02c5e/81fe8f04-cf54-4251-91b4-88919241a02e.jpg,,"Five German mountaineers died after being hit by an avalanche in South Tyrol, in northern Italy, rescuers said on Sunday.Three victims two men and a woman had already been recovered on Saturday, whil… [+1411 chars]",,"In Italien sind fünf Bergsteiger bei einem Lawinenunglück ums Leben gekommen. Fünf deutsche Bergsteiger starben, nachdem sie in Südtirol in Norditalien von einer Lawine getroffen worden waren, wie Retter am Sonntag mitteilten.","Five mountaineers die after being hit by avalanche in Italy. Five German mountaineers died after being hit by an avalanche in South Tyrol, in northern Italy, rescuers said on Sunday.","Quinque montani post montem cadentem in Italia occidunt. Quinque montani Germani mortui sunt postquam avalanche in Tyrol Australi, in Italia septentrionali, salvatores die Dominico dicti.",2025-10-21 13:36:59+00:00
695af7c697099a8f11ce0bf4acabc9f1,2025-11-02T16:34:37Z,'avalanche missing',www.channelnewsasia.com,en,0.9,5 German mountaineers die in northern Italy after being hit by avalanche,"ROME: Five German mountaineers died after being hit by an avalanche in South Tyrol, in northern Italy, rescuers said on Sunday (Nov 2).Three victims - two men and a woman - had already been recovered dead on Saturday, while the bodies of two other missing peo…",https://www.channelnewsasia.com/world/5-german-mountaineers-die-in-northern-italy-after-being-hit-avalanche-5440656,"https://dam.mediacorp.sg/image/upload/s--OE-e5bHt--/c_fill,g_auto,h_676,w_1200/fl_relative,g_south_east,l_one-cms:core:watermark:ap_data-1,w_0.1/f_auto,q_auto/v1/one-cms/core/climate_alps_glaciers_photo_gallery_62961.jpg?itok=MY2Acipu",,"ROME: Five German mountaineers died after being hit by an avalanche in South Tyrol, in northern Italy, rescuers said on Sunday (Nov 2).
Three victims - two men and a woman - had already been recover… [+1434 chars]",,"Fünf deutsche Bergsteiger sterben in Norditalien, nachdem sie von einer Lawine getroffen wurden. ROM: Fünf deutsche Bergsteiger starben, nachdem sie in Südtirol in Norditalien von einer Lawine getroffen worden waren, teilten Retter am Sonntag (2. November) mit. Drei Opfer – zwei Männer und eine Frau – waren bereits am Samstag tot geborgen worden, während die Leichen von zwei weiteren vermissten Personen…","5 German mountaineers die in northern Italy after being hit by avalanche. ROME: Five German mountaineers died after being hit by an avalanche in South Tyrol, in northern Italy, rescuers said on Sunday (Nov 2).Three victims - two men and a woman - had already been recovered dead on Saturday, while the bodies of two other missing peo…","5. Germani montani in Italia septentrionali post montem cadentem moriuntur. ROMA: Quinque montani Germani mortui sunt postquam avalanche in Tyrolis Australi, in Italia septentrionali, salvatores die Dominico dixerunt (Nov. 2). Tres victimae - duo viri et femina - iam die Sabbati mortui sunt recepta, cum corpora duorum aliorum absentium peo…",2025-10-21 13:36:59+00:00
41f069891a658f1f065018045a35ce23,2025-11-02T17:29:28Z,'avalanche mountain',www.bbc.com,en,0.9,Avalanche in Italy kills five including father and daughter,Authorities say the five mountaineers who died while scaling Cima Vertana are German.,https://www.bbc.com/news/articles/cp3x4w1g5v3o,https://ichef.bbci.co.uk/news/1024/branded_news/fe65/live/2213c080-b811-11f0-a690-1bcdd48276a7.jpg,http://web.archive.org/web/20251102221553/https://www.bbc.com/news/articles/cp3x4w1g5v3o,"An avalanche in Italy's Dolomite mountains has killed five German climbers, including a 17-year-old girl and her father, according to rescuers. 
The mountaineers, travelling in separate groups, were… [+1465 chars]",,"Bei einer Lawine in Italien kommen fünf Menschen ums Leben, darunter Vater und Tochter. Nach Angaben der Behörden handelt es sich bei den fünf Bergsteigern, die bei der Besteigung des Cima Vertana ums Leben kamen, um Deutsche.",Avalanche in Italy kills five including father and daughter. Authorities say the five mountaineers who died while scaling Cima Vertana are German.,"NIVIS in Italia quinque patrem et filiam interficit. Auctores dicunt montani quinque, qui dum scalas Cima Vertana mortui sunt, Germanos esse.",2025-10-21 13:36:59+00:00
7337272c87a9acc9e7ee2c1266b047f5,2025-11-03T16:33:10Z,'avalanche missing',slashdot.org,en,0.9,Nepal: French climber among at least three killed in Himalayan avalanche - BBC,"Nepal: French climber among at least three killed in Himalayan avalancheBBC Avalanche in Nepal kills 5 foreign climbers, 2 guidesCBS News Three killed, eight missing in Himalaya peak avalanche in NepalCNN Avalanche Kills US CitizensNewsweek Red Hot Chili Pepp…",https://slashdot.org/firehose.pl?op=view&amp;id=179952220,,http://web.archive.org/web/20160119174443/http://slashdot.org/firehose.pl?op=view,"""Pay no attention to the man behind the curtain.""
-- Karl, as he stepped behind the computer to reboot it, during a FAT",,"Nepal: Französischer Bergsteiger unter mindestens drei Toten bei Lawine im Himalaya – BBC. Nepal: Französischer Bergsteiger unter mindestens drei Toten bei Lawine im HimalayaBBC Lawine in Nepal tötet 5 ausländische Bergsteiger und 2 FührerCBS News Drei Tote, acht Vermisste bei Lawine am Himalaya-Gipfel in NepalCNN Lawine tötet US-BürgerNewsweek Red Hot Chili Pepp…","Nepal: French climber among at least three killed in Himalayan avalanche - BBC. Nepal: French climber among at least three killed in Himalayan avalancheBBC Avalanche in Nepal kills 5 foreign climbers, 2 guidesCBS News Three killed, eight missing in Himalaya peak avalanche in NepalCNN Avalanche Kills US CitizensNewsweek Red Hot Chili Pepp…","Nepal: Gallica exhibuit inter tres saltem in Himalayan NIVIS CASUS - BBC. Nepal: French exhibuit inter tres saltem occisos in Himalayan avalancheBBC Avalanche in Nepal 5 viverra tellus peregrina necat, 2 guidesCBS News Tres occidit, octo absentes in Hi- aya cacumen NIVIS in NepalCNN Avalanche necat US CitizensNewsweek Rubrum Hot Chili Pepp…",2025-10-21 13:36:59+00:00
