index,published,keyword,domain,language,valid,title,description,url,image,archive,content,quote,de,en,la,added
aed95e3202e42976189cf96e181e75d4,2025-11-02T18:46:23Z,'avalanche mountain',www.thejournal.ie,en,0.0,Five German mountaineers die in northern Italy after being hit by avalanche,"It is unknown why the climbers were still on their way up at this relatively late hour, rescuers said.",https://www.thejournal.ie/german-mountaineers-die-italy-avalanche-6862812-Nov2025/,https://img2.thejournal.ie/article/6862812/river/?height=400&version=6862817,,"FIVE GERMAN MOUNTAINEERS died after being hit by an avalanche in South Tyrol, in northern Italy, rescuers said today.
Three victims two men and a woman had already been recovered yesterday, while th… [+1394 chars]",,"Fünf deutsche Bergsteiger sind in Norditalien bei einem Lawinenunglück ums Leben gekommen. Es ist nicht bekannt, warum die Bergsteiger zu dieser relativ späten Stunde noch auf dem Weg nach oben waren, sagten Retter.","Five German mountaineers die in northern Italy after being hit by avalanche. It is unknown why the climbers were still on their way up at this relatively late hour, rescuers said.","Quinque montani Germani in Italia septentrionali post montem cadentem NIVIS moriuntur. Incognitum est cur viverra tellus adhuc in sero hac hora relativum in via dixerunt, salvatores.",2025-10-21 13:36:59+00:00
6e58ba9bc21332af221c15650abbfd70,2025-11-02T15:07:40Z,'avalanche search',www.cbssports.com,en,0.1,College basketball 2025-26 season preview: Sorting out national championship contenders by tiers,Here are the teams that can actually conquer March Madness and cut the nets down on the first Monday in April,https://www.cbssports.com/college-basketball/news/college-basketball-2025-26-season-preview-sorting-out-national-championship-contenders-by-tiers/,https://sportshub.cbsistatic.com/i/r/2025/11/02/323a7cb2-b884-4ffb-8752-9c5e7fcb7abb/thumbnail/1200x675/7715f9a6bef0d979d84aa6f4c8ead7a1/uzan-houston-1.jpg,,"I am positive that you are going to be scrolling TikTok next March and stumble upon a content creator who believes they have the perfect formula to predict the National Championship winner.
I am pos… [+24487 chars]",,"Vorschau auf die College-Basketball-Saison 2025–26: Sortierung der nationalen Meisterschaftskandidaten nach Rängen. Hier sind die Teams, die March Madness tatsächlich bezwingen und am ersten Montag im April die Netze einholen können",College basketball 2025-26 season preview: Sorting out national championship contenders by tiers. Here are the teams that can actually conquer March Madness and cut the nets down on the first Monday in April,Collegium basketball 2025-26 temporum praevius: Sorting e nationalibus patrocinium contendentibus gradibus. Hic iunctae sunt quae mense Martio insaniam vincere possunt et retia incidere prima Lunae in Aprili,2025-10-21 13:36:59+00:00
2efee8359481ea3a1480bab72ca7b10d,2025-11-03T16:15:29Z,'avalanche search',www.lubbockonline.com,en,0.1,Big 12 football power rankings heading into Texas Tech vs BYU showdown,Texas Tech football and BYU will be the first Big 12 matchup of top-10 opponents since 2021. They'll also decide No. 1 in Big 12 power rankings.,https://www.lubbockonline.com/story/sports/college/red-raiders/2025/11/03/big-12-football-power-rankings-texas-tech-byu-utah-iowa-state/86869868007/,https://s.yimg.com/ny/api/res/1.2/JDmBDh3.qBOXHHNBVqw8Cw--/YXBwaWQ9aGlnaGxhbmRlcjt3PTEyMDA7aD04MDA7Y2Y9d2VicA--/https://media.zenfs.com/en/lubbock-avalanche-journal/88810db3bbc40b9125fde711ded3218c,,"The Texas Tech football team has held the top spot in the Big 12 power rankings for the past eight weeks. Brigham Young has been right behind Tech in second position for three weeks.
They finally ge… [+5272 chars]",,Die Top-12-Football-Power-Rangliste steht vor dem Showdown zwischen Texas Tech und BYU. Texas Tech Football und BYU werden das erste Big-12-Match zwischen Top-10-Gegnern seit 2021 sein. Sie werden auch über die Nr. 1 in der Big-12-Power-Rangliste entscheiden.,Big 12 football power rankings heading into Texas Tech vs BYU showdown. Texas Tech football and BYU will be the first Big 12 matchup of top-10 opponents since 2021. They'll also decide No. 1 in Big 12 power rankings.,Magna 12 eu potentia rankings in Texas Tech vs BYU sollicitudin. Texas Tech eu et BYU erit primus Big XII matchup top-X adversarii cum 2021. Etiam decernent No. 1 in Big XII potentia nulla.,2025-10-21 13:36:59+00:00
11d4c69de4e87d5bacd67f4d488209de,2025-11-03T20:19:16Z,'avalanche mountain',www.brit.co,en,0.1,"5 Unsettling ""Past Life"" Confessions Kids Shared With Their Parents","It's no secret that people are fascinated by the concept of past lives — especially when it comes to kids. Well, a few years back, Reddit user TapiocaTuesday posted to the popular Ask Reddit page with the question, ""Parents, what spooky 'past life' memory did…",https://www.brit.co/kids-past-life-stories/,https://www.brit.co/media-library/kids-past-life-stories.jpg?id=62038097&width=1200&height=600&coordinates=0%2C27%2C0%2C140,,"Scroll on for 85 of the most hysterically ridiculous Halloween costume ideas guaranteed to help you bring the funny and keep the party laughing all night long.
 Brit + Co
Leggo her Eggo.(via Brit +… [+13160 chars]",,"5 beunruhigende Geständnisse aus „früheren Leben“, die Kinder ihren Eltern mitteilten. Es ist kein Geheimnis, dass Menschen von der Vorstellung vergangener Leben fasziniert sind – insbesondere wenn es um Kinder geht. Nun, vor ein paar Jahren postete der Reddit-Benutzer TapiocaTuesday auf der beliebten Ask Reddit-Seite die Frage: „Eltern, was für eine gruselige Erinnerung an ein früheres Leben hat …“","5 Unsettling ""Past Life"" Confessions Kids Shared With Their Parents. It's no secret that people are fascinated by the concept of past lives — especially when it comes to kids. Well, a few years back, Reddit user TapiocaTuesday posted to the popular Ask Reddit page with the question, ""Parents, what spooky 'past life' memory did…","V METUENS ""Vita praeterita"" Confessiones Kids cum parentibus communicata. Haud occultum est homines notionem vitae praeteritae teneri - praesertim cum ad haedos advenit. Bene, paucis annis retro, Reddit user TapiocaTuesday missae ad popularem Ask Reddit paginam cum interrogatione, ""Parentes, quid spooky ""praeteritae vitae"" memoriam fecit…",2025-10-21 13:36:59+00:00
d2fa1087f80a288b102837805e27577e,2025-11-05T00:00:00Z,'avalanche mountain',www.blessthisstuff.com,en,0.1,ARCADE X RECCO STRETCH BELT,"The new Arcade x Recco Stretch Belt
 takes your everyday essential and gives it a life-saving twist. 
Designed for comfort, durability, and safety, this performance-driven 
belt integrates RECCO emergency location technology?the same 
radar-reflective system …",https://www.blessthisstuff.com/stuff/wear/acessories/arcade-x-recco-stretch-belt/,https://www.blessthisstuff.com/imagens/stuff/arcade-recco-stretch-belt.jpg,,"The new Arcade x Recco Stretch Belt takes your everyday essential and gives it a life-saving twist. Designed for comfort, durability, and safety, this performance-driven belt integrates RECCO emergen… [+1148 chars]",,"ARCADE X RECCO STRETCH-GÜRTEL. Der neue Arcade x Recco Stretchgürtel
 nimmt Ihr alltägliches Wesentliches und verleiht ihm eine lebensrettende Wendung. 
Dieses leistungsorientierte Modell ist auf Komfort, Langlebigkeit und Sicherheit ausgelegt 
Gürtel integriert RECCO-Notfallortungstechnologie?das Gleiche 
Radarreflexionssystem …","ARCADE X RECCO STRETCH BELT. The new Arcade x Recco Stretch Belt
 takes your everyday essential and gives it a life-saving twist. 
Designed for comfort, durability, and safety, this performance-driven 
belt integrates RECCO emergency location technology?the same 
radar-reflective system …","PORTICUS X RECCO SPATIUM LORUM. Novus Arcade x Recco Extendam Belt
 cotidianam necessariam tuam sumit et ei vitam salutaris torquentem dat. 
Ad consolationem, diuturnitatem et salutem destinata, haec perficiendi agitata 
balteus integrat RECCO subitis locus technologia? eodem 
radar-reflective system ...",2025-10-21 13:36:59+00:00
9bb7a1376fe12416a20539a00bf8f33b,2025-11-05T06:30:15Z,'avalanche mountain',sectionhiker.com,en,0.1,Best Winter Hiking and Snowshoeing Pants of 2025-2026,"The best winter hiking and snowshoeing pants are highly breathable softshell pants that prevent perspiration from accumulating when hiking, snowshoeing, climbing/mountaineering, or even ski touring in winter. They’re made with woven nylon or polyester, which …",https://sectionhiker.com/best-winter-hiking-and-snowshoeing-pants-of-2025-2026/,https://sectionhiker.com/wp-content/uploads/thumbskeep/2024/10/10-best-Winter-Hiking-and-Snowshoeing-Pants.jpg,,"Philip Werner November 5, 2025Gear Guides
The best winter hiking and snowshoeing pants are highly breathable softshell pants that prevent perspiration from accumulating when hiking, snowshoeing, cli… [+12723 chars]",,"Beste Winterwander- und Schneeschuhwanderhose 2025–2026. Die besten Winterwander- und Schneeschuhhosen sind hoch atmungsaktive Softshellhosen, die verhindern, dass sich beim Wandern, Schneeschuhwandern, Klettern/Bergsteigen oder sogar beim Skitourengehen im Winter Schweiß ansammelt. Sie bestehen aus gewebtem Nylon oder Polyester, das …","Best Winter Hiking and Snowshoeing Pants of 2025-2026. The best winter hiking and snowshoeing pants are highly breathable softshell pants that prevent perspiration from accumulating when hiking, snowshoeing, climbing/mountaineering, or even ski touring in winter. They’re made with woven nylon or polyester, which …","Best Hiking and Snowshoeing Pants of 2025-2026. Optima hiems hiking et snowshoeing braccas sunt valde spirabiles softshell anhelat, qui prohibet sudorem accumulare cum hiking, snowshoeing, ascensus/montis, vel etiam ski in hieme. Contexitur nylon aut polyester, quod …",2025-10-21 13:36:59+00:00
46176d7de7350a8d27a91d2540d3678f,2025-11-05T13:00:28Z,'avalanche protection',www.denverpost.com,en,0.1,New to the backcountry? Colorado Avalanche Information Center launched a free safety class.,The Avalanche Aware online program is designed to help inexperienced users know where and when it's safe.,https://www.denverpost.com/2025/11/05/free-avalanche-class-colorado-caic/,https://www.denverpost.com/wp-content/uploads/2025/11/TDP-Z-Jones-Pass-snowshoer-01.jpg?w=1024&h=768,,"Because sound avalanche awareness isn’t important just for ski mountaineers who climb towering backcountry peaks in search of pristine powder slopes, the Colorado Avalanche Information Center is aimi… [+2931 chars]",,"Neu im Backcountry? Das Colorado Avalanche Information Center hat einen kostenlosen Sicherheitskurs gestartet. Das Avalanche Aware Online-Programm soll unerfahrenen Benutzern helfen, zu wissen, wo und wann es sicher ist.",New to the backcountry? Colorado Avalanche Information Center launched a free safety class.. The Avalanche Aware online program is designed to help inexperienced users know where and when it's safe.,Novus in deserto? Colorado Avalanche Information Centrum liberam salutem classis misit.,2025-10-21 13:36:59+00:00
d2620e944ad829db61b0cf2add0b7c3b,2025-11-06T06:00:00Z,'avalanche mountain',www.naturalnews.com,en,0.1,"Trump economy in free-fall, with American households now facing record $18.59 trillion in debt","Total U.S. household debt has climbed to a record $18.59 trillion, a $197 billion increase in just one quarter. Credit card delinquency rates have exploded to 12.41%, the highest level since 2011, signaling severe consumer distress. Student loan defaults are …",https://www.naturalnews.com/2025-11-06-american-households-now-facing-record-18-59-trillion-in-debt.html,https://www.naturalnews.com/wp-content/uploads/sites/91/2025/11/Debt-Red-Arrow-Increase.jpg,,"<ul><li>Total U.S. household debt has climbed to a record $18.59 trillion, a $197 billion increase in just one quarter.</li><li>Credit card delinquency rates have exploded to 12.41%, the highest leve… [+4539 chars]",,"Trumps Wirtschaft befindet sich im freien Fall, und die amerikanischen Haushalte stehen nun vor einer Rekordverschuldung von 18,59 Billionen US-Dollar. Die Gesamtverschuldung der US-Haushalte ist auf den Rekordwert von 18,59 Billionen US-Dollar gestiegen, ein Anstieg von 197 Milliarden US-Dollar in nur einem Quartal. Die Kreditkartenausfallraten sind auf 12,41 % explodiert, der höchste Stand seit 2011, was auf eine große Verzweiflung der Verbraucher hinweist. Ausfälle bei Studiendarlehen sind …","Trump economy in free-fall, with American households now facing record $18.59 trillion in debt. Total U.S. household debt has climbed to a record $18.59 trillion, a $197 billion increase in just one quarter. Credit card delinquency rates have exploded to 12.41%, the highest level since 2011, signaling severe consumer distress. Student loan defaults are …","Oeconomia tuba in libero-lapso cum Americanis familiaribus nunc spectantibus record $18.59 trillion obaeratorum. Totalis US familiari debitum ad $18.59 trillion recordum ascendit, a $197 miliarda in una parte tantum aucta est. Promeritum pecto delictum rates explosa sunt ad 12.41%, in summo gradu cum 2011, gravem dolorem significans angustiam. Studiosum loan defaltis sunt ...",2025-10-21 13:36:59+00:00
6e3fb6ef7d7ab7651b5be1a7ccf6d4df,2025-11-06T11:42:08Z,'avalanche mountain',acquiremag.com,en,0.1,Houdini and Osprey unveil the Allt Backpack,A backpack built for every adventure.,https://acquiremag.com/sports/houdini-and-osprey-unveil-the-allt-backpack/,https://i0.wp.com/xovvdk.infiniteuploads.cloud/2025/11/Houdini-x-Osprey-Packs_Mood_09.jpg?fit=1200%2C800&ssl=1,,"Named after the Swedish word for “everything,” the Allt is literally that, a four-season backpack built for every adventure whether you’re making your way up the mountain or need a high-performance p… [+680 chars]",,Houdini und Osprey stellen den Allt-Rucksack vor. Ein Rucksack für jedes Abenteuer.,Houdini and Osprey unveil the Allt Backpack. A backpack built for every adventure.,Houdini et Osprey detegunt Allt Backpack. MANTICA aedificata ad omnes casus.,2025-10-21 13:36:59+00:00
d89ff01e94b3985873401ee9afd21da5,2025-11-06T12:00:00Z,'avalanche search',www.nybooks.com,en,0.1,‘Have You Met Z?’,"It was almost weird to walk around New York City and not run into him. “Z was in just yesterday,” the barista at Little Flower in Astoria told me, pointing to a full-sized Zohran Mamdani cut-out stationed near the bathrooms. Mamdani is called Z by his friends…",http://www.nybooks.com/online/2025/11/06/have-you-met-z-zohran-mamdani/,https://www.nybooks.com/wp-content/uploads/2025/11/Chiasson202511_3.jpeg,http://web.archive.org/web/20251107035406/https://www.nybooks.com/online/2025/11/06/have-you-met-z-zohran-mamdani/,"It was almost weird to walk around New York City and not run into him. “Z was in just yesterday,” the barista at Little Flower in Astoria told me, pointing to a full-sized Zohran Mamdani cut-out stat… [+17797 chars]",,"„Kennen Sie Z?“. Es war fast seltsam, durch New York City zu laufen und ihm nicht zu begegnen. „Z war erst gestern da“, sagte mir der Barista im Little Flower in Astoria und zeigte auf einen lebensgroßen Zohran-Mamdani-Puppe, der in der Nähe der Toiletten stand. Mamdani wird von seinen Freunden Z genannt…","‘Have You Met Z?’. It was almost weird to walk around New York City and not run into him. “Z was in just yesterday,” the barista at Little Flower in Astoria told me, pointing to a full-sized Zohran Mamdani cut-out stationed near the bathrooms. Mamdani is called Z by his friends…","'Habestine Z?'. Prope fatum erat ut circum urbem New York ambulare neque in eum curreret. ""Z heri nuper erat"" barista apud Flos Minores in Astoria mihi dixit, demonstrans Zohran Mamdani incisam prope thermarum stantem esse plenam. Mamdani Z ab amicis appellatur.",2025-10-21 13:36:59+00:00
dfffcaefda023ebf14fcae1bf42ef715,2025-11-06T13:00:01Z,'avalanche mountain',www.mentalfloss.com,en,0.1,8 Volcano Hikes You Can Actually Do (Safely),There’s need to experience danger to come home with a great story when checking out these volcano hikes.,https://www.mentalfloss.com/geography/volcano-hikes-you-can-do-safely,"https://images2.minutemediacdn.com/image/upload/c_crop,x_0,y_1236,w_3334,h_1875/c_fill,w_1440,ar_1440:810,f_auto,q_auto,g_auto/images/GettyImages/mmsport/mentalfloss/01k9aszqkxmncfc0qje3.jpg",,"Theres something magnetic about volcanoes. While some are far too dangerous to approach, others invite you right up to the rim, offering front-row seats to natures raw energy. From Hawaiis fiery crat… [+6695 chars]",,"8 Vulkanwanderungen, die Sie tatsächlich (sicher) unternehmen können. Bei diesen Vulkanwanderungen muss man die Gefahr erlebt haben, um mit einer großartigen Geschichte nach Hause zu kommen.",8 Volcano Hikes You Can Actually Do (Safely). There’s need to experience danger to come home with a great story when checking out these volcano hikes.,8 Volcano Hikes vere potes facere (tutus). Magna fabula periculum est venire domum cum has vulcanos hikes reprehendo.,2025-10-21 13:36:59+00:00
09f4969635424ec6c8d6e1fcfe5dbeb3,2025-11-06T14:30:42Z,'avalanche warning system',economictimes.indiatimes.com,en,0.1,"Meta is earning a fortune on a deluge of fraudulent ads, internal documents show","Internal Meta documents reveal the company projected earning billions from scam ads, failing for years to stop fraudulent schemes targeting users. Despite internal warnings and a high volume of ""higher risk"" ads daily, Meta only bans advertisers with 95% cert…",https://economictimes.indiatimes.com/tech/technology/meta-is-earning-a-fortune-on-a-deluge-of-fraudulent-ads-internal-documents-show/articleshow/125136744.cms,"https://img.etimg.com/thumb/width-1200,height-900,imgsize-56192,resizemode-75,msid-125136744/tech/technology/meta-is-earning-a-fortune-on-a-deluge-of-fraudulent-ads-internal-documents-show.jpg",,"Meta internally projected late last year that it would earn about 10% of its overall annual revenue - or $16 billion - from running advertising for scams and banned goods, internal company documents … [+18143 chars]",,"Interne Dokumente belegen, dass Meta mit einer Flut betrügerischer Anzeigen ein Vermögen verdient. Aus internen Meta-Dokumenten geht hervor, dass das Unternehmen mit Betrugsanzeigen voraussichtlich Milliarden verdienen wird und es jahrelang nicht geschafft hat, betrügerische Machenschaften zu stoppen, die auf Nutzer abzielen. Trotz interner Warnungen und einer hohen Anzahl an Anzeigen mit „höherem Risiko“ pro Tag sperrt Meta nur Werbetreibende mit einer Zertifizierung von 95 %.","Meta is earning a fortune on a deluge of fraudulent ads, internal documents show. Internal Meta documents reveal the company projected earning billions from scam ads, failing for years to stop fraudulent schemes targeting users. Despite internal warnings and a high volume of ""higher risk"" ads daily, Meta only bans advertisers with 95% cert…","Meta fortunam consequitur in diluvio fraudum praeconiorum, documenta interna monstrant. Interna Meta documenta indicant societatis proiectae billions e scam additis, deficientibus annis obsistere fraudes machinas utentes machinae. Quamquam monita interna et volumen ""altius periculi"" cottidie adscribit, Meta tantum bans proscriptiones cum 95% cert.",2025-10-21 13:36:59+00:00
8c2b46c52eddd6f083a91992ef3aab35,2025-11-07T08:32:00Z,'avalanche warning system',www.thestar.com.my,en,0.1,"Meta earning a fortune on fraudulent ads, internal documents show","Nov 6 (Reuters): Meta internally projected late last year that it would earn about 10% of its overall annual revenue - or US$16bil - from running advertising for scams and banned goods, internal company documents show. Read full story",https://www.thestar.com.my/news/world/2025/11/07/meta-earning-a-fortune-on-fraudulent-ads-internal-documents-show,https://apicms.thestar.com.my/uploads/images/2025/11/07/3610928.jpeg,,"Nov 6 (Reuters): Meta internally projected late last year that it would earn about 10% of its overall annual revenue - or US$16bil - from running advertising for scams and banned goods, internal comp… [+17986 chars]",,"Interne Dokumente belegen, dass Meta mit betrügerischen Anzeigen ein Vermögen verdient. 6. November (Reuters): Interne Unternehmensdokumente zeigen, dass Meta Ende letzten Jahres intern prognostizierte, dass das Unternehmen etwa 10 % seines gesamten Jahresumsatzes – oder 16 Milliarden US-Dollar – mit Werbung für Betrug und verbotene Waren erzielen würde. Lesen Sie die ganze Geschichte","Meta earning a fortune on fraudulent ads, internal documents show. Nov 6 (Reuters): Meta internally projected late last year that it would earn about 10% of its overall annual revenue - or US$16bil - from running advertising for scams and banned goods, internal company documents show. Read full story","Meta promerendae fortunae dolosis praeconiis, documenta interna monstrant. Nov 6 (Reuters): Meta interne nuper anno proximo proiecta est ut circiter 10% altioris annui reditus mereretur - vel US$16bil - ex vendendi causa scams et bona interdicta, documenta societatis internae ostendunt. Read full story",2025-10-21 13:36:59+00:00
b8ea414aad0216eb910950d5bd52b1ec,2025-11-07T19:28:27Z,'avalanche climate change',www.the-independent.com,en,0.1,"Meta earns billions from ads for scams, report claims",Around 10 per cent of the Facebook owner’s revenue reportedly came from fraudulent ads last year,https://www.the-independent.com/tech/meta-ads-scam-facebook-instagram-zuckerberg-b2860980.html,https://static.the-independent.com/2025/11/07/16/42/GettyImages-2209215388.jpeg?width=1200&height=800&crop=1200:800,,"Your support helps us to tell the story
From reproductive rights to climate change to Big Tech, The Independent is on the ground when the story is developing. Whether it's investigating the financia… [+4048 chars]",,"Meta verdient Milliarden mit Anzeigen für Betrug, berichten Behauptungen. Berichten zufolge stammten im vergangenen Jahr rund 10 Prozent der Einnahmen des Facebook-Besitzers aus betrügerischen Anzeigen","Meta earns billions from ads for scams, report claims. Around 10 per cent of the Facebook owner’s revenue reportedly came from fraudulent ads last year","Meta billions ex additis scams, fama petit. Circiter 10 centesimae de proventibus domini Facebook in proximo anno a fraudulentis accesserunt",2025-10-21 13:36:59+00:00
b003793e7b631db0034c376e11599fbb,2025-11-08T02:25:54Z,'avalanche mountain',survivalblog.com,en,0.1,Editors’ Prepping Progress,"To be prepared for a crisis, every Prepper must establish goals and make both long-term and short-term plans. In this column, the SurvivalBlog editors review their week’s prep activities and planned prep activities for the coming week. These range from health…",https://survivalblog.com/2025/11/08/editors-prepping-progress-384/,https://survivalblog.com/wp-content/uploads/2024/10/Montana-Fall-Colors-Larch-7.jpg,,"To be prepared for a crisis, every Prepper must establish goals and make both long-term and short-term plans. In this column, the SurvivalBlog editors review their week’s prep activities and planned … [+6744 chars]",,"Vorbereitungsfortschritt der Redaktion. Um auf eine Krise vorbereitet zu sein, muss jeder Prepper Ziele festlegen und sowohl langfristige als auch kurzfristige Pläne erstellen. In dieser Kolumne besprechen die SurvivalBlog-Redakteure die Vorbereitungsaktivitäten ihrer Woche und die geplanten Vorbereitungsaktivitäten für die kommende Woche. Diese reichen von Gesundheit…","Editors’ Prepping Progress. To be prepared for a crisis, every Prepper must establish goals and make both long-term and short-term plans. In this column, the SurvivalBlog editors review their week’s prep activities and planned prep activities for the coming week. These range from health…","Curriculum Prepping. Ad crisim parandum, omnis Prepper proposita constituere debet et tum longum tempus et breve consilium statuere. In hac columna, editores SurvivalBlog actiones suas septimanatim recognoscant et praecogitatum operationes in futura septimana. Haec vagarentur a salute…",2025-10-21 13:36:59+00:00
fba5089cf5a2a59eb4edb545529bbc63,2025-11-08T03:40:01Z,'avalanche climate change',phys.org,en,0.1,Turning undersea cables into a global monitoring system for seismic and environmental hazards,EU researchers are exploring how undersea communication cables can double-up as environmental and seismic sensors—a potential game-changer for early warning systems.,https://phys.org/news/2025-11-undersea-cables-global-seismic-environmental.html,https://scx2.b-cdn.net/gfx/news/hires/2025/underwater-fiber-optic.jpg,,"EU researchers are exploring how undersea communication cables can double-up as environmental and seismic sensorsa potential game-changer for early warning systems.
Beneath the world's oceans, a sil… [+7605 chars]",,"Unterseekabel in ein globales Überwachungssystem für Erdbeben- und Umweltgefahren verwandeln. EU-Forscher erforschen, wie Unterwasser-Kommunikationskabel als Umwelt- und seismische Sensoren fungieren können – ein potenzieller Wendepunkt für Frühwarnsysteme.",Turning undersea cables into a global monitoring system for seismic and environmental hazards. EU researchers are exploring how undersea communication cables can double-up as environmental and seismic sensors—a potential game-changer for early warning systems.,Funiculos underseas convertens in systema vigilantia globali pro seismic et environmental discrimina. EU Investigatores explorant quomodo funes communicationis underseae duplicare possint sensoriis environmental et seismics - ludum potentialem mutante ad systemata praenuntia.,2025-10-21 13:36:59+00:00
