index,published,keyword,domain,language,valid,title,description,url,image,archive,content,quote,de,en,la,added
2c51259dcf4df1673d9682f453312c22,2026-07-01T16:15:00Z,'avalanche warning system',www.newser.com,en,0.2,"Shasta Climber Falls 1.5K Feet, Lives to Tell the Tale","One climber's attempt to summit Mount Shasta turned into a 1,500-foot plunge—and a rare survival story. Officials say the 31-year-old woman, part of a group of three ""novice"" climbers on the Avalanche Gulch route around 13,000 feet, tumbled down the steep fac…",https://www.newser.com/story/392065/shasta-climber-falls-15k-feet-lives-to-tell-the-tale.html,https://img1-azrcdn.newser.com/image/1695810-12-20260701111502.jpeg,http://web.archive.org/web/20260701164922/https://www.newser.com/story/392065/shasta-climber-falls-15k-feet-lives-to-tell-the-tale.html,"One climber's attempt to summit Mount Shasta turned into a 1,500-foot plunge—and a rare survival story. Officials say the 31-year-old woman, part of a group of three ""novice"" climbers on the Avalanch… [+958 chars]",,"Shasta Climber fällt 1,5000 Fuß hoch, lebt, um die Geschichte zu erzählen. Der Versuch eines Bergsteigers, den Mount Shasta zu besteigen, wurde zu einem 1.500-Fuß-Absturz – und zu einer seltenen Überlebensgeschichte. Beamte sagten, die 31-jährige Frau, Teil einer Gruppe von drei „Anfänger“-Kletterern auf der Avalanche Gulch-Route in etwa 13.000 Fuß Höhe, sei die steile Wand hinuntergestürzt.","Shasta Climber Falls 1.5K Feet, Lives to Tell the Tale. One climber's attempt to summit Mount Shasta turned into a 1,500-foot plunge—and a rare survival story. Officials say the 31-year-old woman, part of a group of three ""novice"" climbers on the Avalanche Gulch route around 13,000 feet, tumbled down the steep fac…","Shasta Climber cadit 1.5K Pedes, Vitas narrare fabulam. Conatus unus exhibuit in cacumen Montis Shasta se in immersionem pedis 1,500 - et raram superstitem fabulam. Magistratus dicunt mulierem XXXI annorum, partem globi trium ""noviciorum"" ascendentium in itinere Avalanche gulch circa 13,000 pedes, praecipitatum fac…",2026-07-03 23:13:55+00:00
bcb45bd0129b1123f3a19e51e15626b2,2026-07-02T00:52:43Z,'avalanche rescue',www.foxnews.com,en,0.7,"Novice climber survives 1,500-foot drop on California's Mount Shasta after helicopter rescue delayed by clouds","Climbing rangers hiked up Mount Shasta on foot after cloud cover blocked a direct helicopter rescue of a woman who slid 1,500 feet down Avalanche Gulch.",https://www.foxnews.com/us/novice-climber-survives-1500-foot-drop-californias-mount-shasta-after-helicopter-rescue-delayed-clouds,https://static.foxnews.com/foxnews.com/content/uploads/2026/07/dramatic-rescue-on-mount-shasta-fox-news-001.jpg,http://web.archive.org/web/20260703053834/https://www.foxnews.com/us/novice-climber-survives-1500-foot-drop-californias-mount-shasta-after-helicopter-rescue-delayed-clouds,"A 31-year-old novice climber survived a roughly 1,500-foot slide down California's Mount Shasta after worsening weather forced rescuers to abandon plans for a direct helicopter rescue, sending climbi… [+4096 chars]",,"Anfänger überlebt einen 1.500-Fuß-Absturz am kalifornischen Mount Shasta, nachdem die Helikopterrettung durch Wolken verzögert wurde. Bergsteiger wanderten zu Fuß den Mount Shasta hinauf, nachdem die Wolkendecke eine direkte Helikopterrettung einer Frau verhinderte, die 1.500 Fuß den Avalanche Gulch hinabgerutscht war.","Novice climber survives 1,500-foot drop on California's Mount Shasta after helicopter rescue delayed by clouds. Climbing rangers hiked up Mount Shasta on foot after cloud cover blocked a direct helicopter rescue of a woman who slid 1,500 feet down Avalanche Gulch.","Novitius exhibuit superstes 1,500-pedum gutta in monte Shasta Californiae post helicopterum nebulis morantibus liberandum. Scandentes vagantes montem Shasta in pede inspexerunt postquam nubes operimentum obstruxit directum helicopterum liberandum mulieris quae 1,500 pedibus delapsae NIVIS PYLAE.",2026-07-03 23:13:55+00:00
e4a0180327c4250418cdc813855c770a,2026-07-01T00:26:11Z,'avalanche missing',consent.yahoo.com,en,0.2,"Golden Knights Hand Avalanche Another Loss, Hire Eagles Head Coach Mark Letestu","The Golden Knights have poached a key member of the Avalanche organization, hiring Colorado Eagles head coach Mark Letestu after he led the AHL affiliate to the Western Conference Finals in his lone season behind the bench.",https://consent.yahoo.com/v2/collectConsent?sessionId=1_cc-session_ed958af0-c166-42cf-98f6-a46f53e193e8,,,"If you click 'Accept all', we and our partners, including 249 who are part of the IAB Transparency &amp; Consent Framework, will also store and / or access information on a device (in other words, us… [+1046 chars]",,"Golden Knights bescheren Avalanche einen weiteren Verlust, engagieren Eagles-Cheftrainer Mark Letestu. Die Golden Knights haben ein wichtiges Mitglied der Avalanche-Organisation abgeworben und den Cheftrainer der Colorado Eagles, Mark Letestu, engagiert, nachdem er die AHL-Tochter in seiner einzigen Saison hinter der Bank ins Finale der Western Conference geführt hatte.","Golden Knights Hand Avalanche Another Loss, Hire Eagles Head Coach Mark Letestu. The Golden Knights have poached a key member of the Avalanche organization, hiring Colorado Eagles head coach Mark Letestu after he led the AHL affiliate to the Western Conference Finals in his lone season behind the bench.","Aurei equites manus NIVIS aliud damnum, conducere aquilas caput PETORITUM Mark Letestu. Equites Aurei membri Avalanche organisationis clavem collocaverunt, Colorado aquilae raeda caput conducentes Mark Letestu postquam AHL affiliatum ad Occidentalem Conferentiam Finales duxit in suo soli tempore post scamnum.",2026-07-04 23:05:41+00:00
7e17f8c405811fe7dba8581cec7fe31b,2026-07-01T11:00:02Z,'avalanche warning system',www.theverge.com,en,0.3,Range anxiety,"The storm developed quickly over west central Illinois on April 17th, first as a single high-intensity system called a supercell, and then later that evening transforming into a long squall line of thunderstorms. Tucked inside a wall of wind were several smal…",https://www.theverge.com/cs/features/938196/rivian-r2-ev-factory-supply-chain,https://platform.theverge.com/wp-content/uploads/sites/2/2026/06/268434_Rivian_Factory_ATahlier_0009_3x4.jpg?quality=90&strip=all&crop=0%2C15.095986038394%2C100%2C69.808027923211&w=1200,http://web.archive.org/web/20260701233811/https://www.theverge.com/cs/features/938196/rivian-r2-ev-factory-supply-chain,"The storm developed quickly over west central Illinois on April 17th, first as a single high-intensity system called a supercell, and then later that evening transforming into a long squall line of t… [+51381 chars]",,"Reichweitenangst. Der Sturm entwickelte sich am 17. April schnell über West-Zentral-Illinois, zunächst als einzelnes System hoher Intensität, das als Superzelle bezeichnet wird, und verwandelte sich dann später am Abend in eine lange Sturmböenreihe. Versteckt in einer Windwand befanden sich mehrere kleine…","Range anxiety. The storm developed quickly over west central Illinois on April 17th, first as a single high-intensity system called a supercell, and then later that evening transforming into a long squall line of thunderstorms. Tucked inside a wall of wind were several smal…","Anxietates. Tempestas celeriter in occidentem media Illinois die 17 Aprilis processit, primum ut una ratio summus intensionem supercellam appellavit, deinde vespera illa in longam procellis tonitribus aciem convertens. Accingebantur intra murum venti parvæ aliquot…",2026-07-06 08:38:41+00:00
a23712e9f50f7de401ac0fd714633881,2026-07-03T18:00:00Z,'avalanche mountain',www.milehighhockey.com,en,0.2,Avalanche Bests and Blursts: 2005-2010,This is the third in an ongoing series covering thirty years of bests (and blursts) of Colorado Avalanche hockey!,https://www.milehighhockey.com/colorado-avalanche-feature-stories/64784/avalanche-bests-and-blursts-2005-2010,https://s.yimg.com/lo/mysterio/api/9b238e19f0605495b447551f05b3e9c87dd4eaaa6962f58fe3a3ce4e7e1c92f3/lightyear_networkapi/resizefill_w1200;quality_80;format_webp/https:%2F%2Fmedia.zenfs.com%2Fen%2Fsb_nation_articles_115%2Febe315c94470f0cb8616ca7238637528,http://web.archive.org/web/20260704061327/https://www.milehighhockey.com/colorado-avalanche-feature-stories/64784/avalanche-bests-and-blursts-2005-2010,"The past thirty years of Avalanche hockey have featured incredible highs, and some very, very dismal lows.
As an avid fan of The Simpsons, I've witnessed plenty of ""best of times"" moments, but also … [+19402 chars]",,Avalanche Bests und Blursts: 2005-2010. Dies ist der dritte Teil einer fortlaufenden Serie über dreißig Jahre voller Bestleistungen (und Höhepunkte) des Colorado Avalanche-Eishockeys!,Avalanche Bests and Blursts: 2005-2010. This is the third in an ongoing series covering thirty years of bests (and blursts) of Colorado Avalanche hockey!,Avalanche Raptores et Blursts: 2005-2010. Haec tertia est in serie continua triginta annorum obductis optimis (et blursts) hockey Colorado Avalanche!,2026-07-06 23:15:58+00:00
76ae4843292c5b70d4d2a395a5f718d3,2026-07-04T19:00:11Z,'avalanche mountain',thehockeynews.com,en,0.2,Avalanche's Cale Makar Extension Overshadows Artturi Lehkonen's Potential Contract Extension,"While locking down Cale Makar and his contract extension is likely the Avalanche's top priority, it looms over the potential shape of a potential Artturi Lehkonen contract.",https://thehockeynews.com/nhl/colorado-avalanche/players/avalanches-cale-makar-extension-overshadows-artturi-lehkonens-potential-contract-extension,https://s.yimg.com/ny/api/res/1.2/2mYJ03ygcuRerhWHFerOmg--/YXBwaWQ9aGlnaGxhbmRlcjt3PTEyMDA7aD04MTM7Y2Y9d2VicA--/https://media.zenfs.com/en/the_hockey_news_colorado_avalanche_articles_301/6f3a8484923b6afd59ed0df5769708f0,,"As July 1st, 2026, has passed, Cale Makar is available for a contract extension. He is set to be an unrestricted free agent next summer, and with how much the cap is going up, today's price is not to… [+5957 chars]",,"Die Verlängerung von Cale Makar durch Avalanche stellt die mögliche Vertragsverlängerung von Artturi Lehkonen in den Schatten. Während die Sperrung von Cale Makar und seine Vertragsverlängerung wahrscheinlich oberste Priorität für die Avalanche haben, steht die mögliche Ausgestaltung eines potenziellen Vertrags mit Artturi Lehkonen im Vordergrund.","Avalanche's Cale Makar Extension Overshadows Artturi Lehkonen's Potential Contract Extension. While locking down Cale Makar and his contract extension is likely the Avalanche's top priority, it looms over the potential shape of a potential Artturi Lehkonen contract.","Extensio Avalanche's Cale Makar obumbrat Artturi Lehkonen Potentialis Contractus Extensio. Dum obfirmatis deorsum Cale Makar et extensio contractus verisimile est prioritatem verticem Avalanche, instat super figura potentiale contractus potentiae Artturi Lehkonen.",2026-07-06 23:15:58+00:00
4d97476772c98ee0f12ed0d46cee8f2b,2026-07-05T18:43:22Z,'avalanche mountain',thehockeynews.com,en,0.2,Why The Avalanche Should Avoid The Shane Wright Gamble,"Shane Wright’s name is surfacing in trade speculation as a potential buy-low target for the Colorado Avalanche, but questions about fit, consistency, and Colorado’s win-now timeline suggest this is a gamble the franchise may be better off avoiding.",https://thehockeynews.com/nhl/colorado-avalanche/latest-news/why-the-avalanche-should-avoid-the-shane-wright-gamble,https://s.yimg.com/lo/mysterio/api/c5b668bdf09fa2ac9f0f4daaac03709cd826e841c339286331b416e4a05a3eda/lightyear_networkapi/resizefill_w1200;quality_80;format_webp/https:%2F%2Fmedia.zenfs.com%2Fen%2Fthe_hockey_news_colorado_avalanche_articles_301%2F5cfd50e2317454d66e4ea42b889150c9,,"The Colorado Avalanche have already taken a swing on a reclamation project this offseason, but some fans believe general manager Joe Sakic isn't done yetwith calls growing for another gamble, this ti… [+5520 chars]",,"Warum die Avalanche das Shane-Wright-Glücksspiel vermeiden sollte. Shane Wrights Name taucht in Handelsspekulationen als potenzielles Buy-Low-Ziel für die Colorado Avalanche auf, aber Fragen zu Passform, Konstanz und Colorados Win-Now-Zeitplan deuten darauf hin, dass dies ein Wagnis ist, das die Franchise besser vermeiden sollte.","Why The Avalanche Should Avoid The Shane Wright Gamble. Shane Wright’s name is surfacing in trade speculation as a potential buy-low target for the Colorado Avalanche, but questions about fit, consistency, and Colorado’s win-now timeline suggest this is a gamble the franchise may be better off avoiding.","Cur NIVIS vitare debet Shane Wright Gamble. Shane Wright nomen in speculatione mercaturae superficies est ut potentiale scopum emere-low pro Colorado Avalanche, quaestiones autem de commodo, constantia et Colorado conciliare nunc timeline hoc suadeant lusum libertatis melius esse vitandum.",2026-07-06 23:15:58+00:00
a9d3cb1353d5f1f159d990c1b01e8870,2026-07-06T17:19:33Z,'avalanche search',thehockeynews.com,en,0.2,Insider Reports The Avalanche Were In The Running For Jets’ Connor Hellebuyck,"With how crazy free agency has been, the Colorado Avalanche might have almost taken the lead in the biggest trade, given what is being reported.",https://thehockeynews.com/nhl/colorado-avalanche/latest-news/insider-reports-the-avalanche-were-in-the-running-for-jets-connor-hellebuyck,https://s.yimg.com/ny/api/res/1.2/qjYmUkVuFztZ3PSyD7e8mg--/YXBwaWQ9aGlnaGxhbmRlcjt3PTEyMDA7aD04MjQ7Y2Y9d2VicA--/https://media.zenfs.com/en/the_hockey_news_colorado_avalanche_articles_301/9f793034b4eed3741c8c3bc92702d3a6,,"The 2026 NHL Offseason has been one for the books, with the cap ceiling rising and many teams and players taking advantage. With ever-increasing cap hits, trades, offer sheets, and more, the Colorado… [+5208 chars]",,"Insider berichten, dass die Avalanche im Rennen um Connor Hellebuyck von den Jets waren. Angesichts der verrückten Free Agency hätte die Colorado Avalanche, wenn man bedenkt, was berichtet wird, beinahe die Führung im größten Trade übernommen.","Insider Reports The Avalanche Were In The Running For Jets’ Connor Hellebuyck. With how crazy free agency has been, the Colorado Avalanche might have almost taken the lead in the biggest trade, given what is being reported.","Insider Renuntiationes The Avalanche erant in Running For Jets Connor Hellebuyck. Quam insanus liberorum procuratio facta est, Colorado Avalanche principatum in maximis commercii fere cepisse potuit, quod nuntiatur datum.",2026-07-09 07:47:00+00:00
3c281c96ab3b39848d4289a850cd4f5e,2026-07-07T16:13:36Z,'avalanche search',cryptobriefing.com,en,0.2,Spain vs Belgium World Cup quarterfinal is crypto’s biggest stage yet,"The integration of crypto in major sports events like the World Cup could redefine fan engagement and test blockchain scalability on a global scale.
The post Spain vs Belgium World Cup quarterfinal is crypto’s biggest stage yet appeared first on Crypto Briefi…",https://cryptobriefing.com/spain-belgium-world-cup-crypto-fan-tokens/,https://static.cryptobriefing.com/wp-content/uploads/2026/07/07121329/belgium-history-flag-map-population-currency-climate-facts-b-800x420.jpeg,,"Kraken's historic FIFA sponsorship, surging fan tokens, and Avalanche-powered collectibles are turning the July 10 match at SoFi Stadium into a proving ground for sports crypto adoption. When Spain a… [+3202 chars]",,"Das Viertelfinale der WM zwischen Spanien und Belgien ist die bislang größte Phase der Kryptowährungen. Die Integration von Kryptowährungen in große Sportveranstaltungen wie die Weltmeisterschaft könnte die Einbindung der Fans neu definieren und die Skalierbarkeit der Blockchain auf globaler Ebene testen.
Das Post-Viertelfinale der Weltmeisterschaft zwischen Spanien und Belgien ist die bisher größte Phase der Kryptowährungen und erschien zuerst auf Crypto Briefi …","Spain vs Belgium World Cup quarterfinal is crypto’s biggest stage yet. The integration of crypto in major sports events like the World Cup could redefine fan engagement and test blockchain scalability on a global scale.
The post Spain vs Belgium World Cup quarterfinal is crypto’s biggest stage yet appeared first on Crypto Briefi…","Hispania vs Belgium World Cup meridionalis crypto maximus adhuc scaena est. Cryptae integratio in ludis maioribus eventibus, sicut Mundus Calicem in certamine ventilationis reducere potuit et in scalabilitate impedimenti probandi in global scala.
Post Hispaniam vs Belgium World Cup quarta pars maxima est crypto in Crypto Briefi... primus apparuit.",2026-07-09 07:47:00+00:00
124b2c23f3d4d862ba3afb129780bf42,2026-07-04T14:55:36Z,'avalanche missing',thehockeynews.com,en,0.2,Leo Carlsson’s $90 Million Deal Just Reignited The Cale Makar Contract Debate — And It’s Missing The Point,"Leo Carlsson’s $90 million extension in Philadelphia sparked immediate questions in Colorado, but Cale Makar’s next contract was never going to be shaped by it.",https://thehockeynews.com/nhl/colorado-avalanche/latest-news/leo-carlsson-s-90-million-deal-just-reignited-the-cale-makar-contract-debate-and-it-s-missing-the-point,https://s.yimg.com/ny/api/res/1.2/NaW6jfuJXBZd0n2oGvZ85w--/YXBwaWQ9aGlnaGxhbmRlcjt3PTEyMDA7aD04MDM7Y2Y9d2VicA--/https://media.zenfs.com/en/the_hockey_news_colorado_avalanche_articles_301/261e27a6e05e25f3d6a313156caf0a71,,"One contract doesnt usually shift a leagues center of gravity but every so often, it sparks the same question everywhere it lands.
So when the Philadelphia Flyers handed Leo Carlsson a five-year, $9… [+4934 chars]",,"Leo Carlssons 90-Millionen-Dollar-Deal hat gerade die Vertragsdebatte mit Cale Makar neu entfacht – und das geht am Thema vorbei. Leo Carlssons 90-Millionen-Dollar-Vertragsverlängerung in Philadelphia löste in Colorado sofort Fragen aus, aber Cale Makars nächster Vertrag würde davon nie geprägt sein.","Leo Carlsson’s $90 Million Deal Just Reignited The Cale Makar Contract Debate — And It’s Missing The Point. Leo Carlsson’s $90 million extension in Philadelphia sparked immediate questions in Colorado, but Cale Makar’s next contract was never going to be shaped by it.","Leo Carlsson $90 Million Deal Just Reignited The Cale Makar Contractus Debate — And It's Missing The Point. Leo Carlsson in Philadelphia $ XC decies centena milia extensionis in Colorado quaestiones immediatas excussit, sed Cale Makar in proximo contractus numquam ab ea formandus est.",2026-07-09 16:07:10+00:00
d6361cf26f0508a075dbbacb310da935,2026-07-06T16:47:08Z,'avalanche rescue',cryptobriefing.com,en,0.2,"AVAX One announces CEO transition, appoints Pete Wylie Jr. as interim leader","AVAX One's leadership change could impact its strategic direction, influencing AVAX token dynamics and investor confidence in crypto treasuries.
The post AVAX One announces CEO transition, appoints Pete Wylie Jr. as interim leader appeared first on Crypto Bri…",https://cryptobriefing.com/avax-one-ceo-transition-pete-wylie/,https://static.cryptobriefing.com/wp-content/uploads/2026/07/06124701/pete-wylie-sinful-single-800x420.jpeg,,"The Avalanche treasury company's CEO Jolie Kahn departed by mutual agreement, leaving the COO to steer a firm sitting on nearly $95 million in AVAX tokens. AVAX One Technology, the Nasdaq-listed comp… [+2580 chars]",,"AVAX One gibt den Wechsel des CEO bekannt und ernennt Pete Wylie Jr. zum Interimsleiter. Der Führungswechsel von AVAX One könnte sich auf seine strategische Ausrichtung auswirken und die AVAX-Token-Dynamik und das Vertrauen der Anleger in Krypto-Staatsanleihen beeinflussen.
Der Beitrag AVAX One kündigt CEO-Wechsel an und ernennt Pete Wylie Jr. zum Interimsleiter erschien zuerst auf Crypto Bri…","AVAX One announces CEO transition, appoints Pete Wylie Jr. as interim leader. AVAX One's leadership change could impact its strategic direction, influencing AVAX token dynamics and investor confidence in crypto treasuries.
The post AVAX One announces CEO transition, appoints Pete Wylie Jr. as interim leader appeared first on Crypto Bri…","AVAX CEO nuntiat transitum, Pete Wylie Jr. interim ducem ponit. AVAX Unius ductoris mutationi opportunam directionem suam infringere potuit, AVAX indicium dynamicorum et investor fiduciae in cryptis thesauris inducens.
Post AVAX Transitum CEO nuntiat, Pete Wylie Jr. interim ducem primo in Crypto Bri apparuit.",2026-07-09 23:20:27+00:00
23ed5fce8cc504236fd0f546f3c04d94,2026-07-01T09:30:00Z,'avalanche rescue',nypost.com,en,0.3,"Woman falls 1,500 feet down Mt. Shasta — leaves rescuers baffled by her condition","The rescue was complicated by low cloud cover, forcing rescuers to reach her on foot.",https://nypost.com/2026/07/01/us-news/novice-climber-31-survives-1500-foot-fall-down-mount-shasta/,https://nypost.com/wp-content/uploads/sites/2/2026/07/132882301.jpg?quality=75&strip=all&w=1200,http://web.archive.org/web/20260702075216/https://nypost.com/2026/07/01/us-news/novice-climber-31-survives-1500-foot-fall-down-mount-shasta/,"A novice climber somehow survived a terrifying 1,500-foot tumble down California’s Mount Shasta on Sunday astonishing rescuers who found her awake and conscious after the massive fall.
The 31-year-o… [+2153 chars]",,"Frau stürzt 1.500 Fuß den Mt. Shasta hinunter – Retter sind über ihren Zustand verwirrt. Die Rettung wurde durch die niedrige Wolkendecke erschwert, so dass die Retter gezwungen waren, sie zu Fuß zu erreichen.","Woman falls 1,500 feet down Mt. Shasta — leaves rescuers baffled by her condition. The rescue was complicated by low cloud cover, forcing rescuers to reach her on foot.","Mulier mille quingentos pedes decidit in montem Shasta — relinquit servatores sua conditione elusos. Sublevatio erat perplexa nubes humili operimento, ut eam in pedes pervenire cogeret.",2026-07-09 23:20:27+00:00
cae80a566801c9a795f484bfb439e644,2026-07-07T00:32:59Z,'avalanche protection',strata.highloop.co,en,0.3,Strata – An app that talks me out of dying outdoors,"Real-time backcountry safety analysis, live group awareness, and smart route discovery for skiers, hikers, and mountaineers.",https://strata.highloop.co/,https://strata.highloop.co/og-image.png,http://web.archive.org/web/20260708100830/https://strata.highloop.co/,"Backcountry trip planning · iOS
No spreadsheets, no five-app shuffle. Strata reads the
 avalanche bulletin, the slope angle, the aspect, and the live
 weather for any route then tells you, in plai… [+3918 chars]",,"Strata – Eine App, die mir das Sterben im Freien abrät. Echtzeit-Sicherheitsanalyse im Hinterland, Live-Gruppenbewusstsein und intelligente Routenfindung für Skifahrer, Wanderer und Bergsteiger.","Strata – An app that talks me out of dying outdoors. Real-time backcountry safety analysis, live group awareness, and smart route discovery for skiers, hikers, and mountaineers.","Strata - App quod me loquitur de foris mori. Realis-tempus salutis analysin fundi, vita coetus conscientia, et itineris captiosi inventio pro skiers, hikers et montani.",2026-07-10 15:36:51+00:00
ea0cae7d076ef61267c6d3f1e395b4c4,2026-07-04T15:50:10Z,'avalanche snow',consent.yahoo.com,en,0.2,“Unreal”: Beckett Hamilton Begins Avalanche Journey After “Surreal” Draft Day in Buffalo,"Beckett Hamilton reflected on his “surreal” draft day in Buffalo, being selected 74th overall by the Colorado Avalanche, and his early impressions of life inside the organization as he begins his NHL path.",https://consent.yahoo.com/v2/collectConsent?sessionId=1_cc-session_fe5be99a-4cc1-4843-9bde-1137d8b94971,,,"If you click 'Accept all', we and our partners, including 249 who are part of the IAB Transparency &amp; Consent Framework, will also store and / or access information on a device (in other words, us… [+1046 chars]",,"„Unreal“: Beckett Hamilton beginnt seine Lawinenreise nach dem „Surreal“ Draft Day in Buffalo. Beckett Hamilton dachte über seinen „surrealen“ Draft-Tag in Buffalo nach, als er von der Colorado Avalanche auf Platz 74 der Gesamtwertung gewählt wurde, und über seine ersten Eindrücke vom Leben innerhalb der Organisation, als er seinen NHL-Weg begann.","“Unreal”: Beckett Hamilton Begins Avalanche Journey After “Surreal” Draft Day in Buffalo. Beckett Hamilton reflected on his “surreal” draft day in Buffalo, being selected 74th overall by the Colorado Avalanche, and his early impressions of life inside the organization as he begins his NHL path.","""Unreal"": Amicis Hamilton incipit NIVIS iter Post ""Surreal"" Dies in Buffalo Draft. Beckett Hamilton de die suo ""surreal"" capturam in Buffalo meditatus est, 74th altiore a Colorado Avalanche electus est, et primae notae vitae intra ordinationem suam dum NHL iter incipit.",2026-07-10 23:06:37+00:00
