index,published,keyword,domain,language,valid,title,description,url,image,archive,content,quote,de,en,la,added
be39e2ba0f3a3a7c23a4070c9ecad0c9,2026-03-09T01:14:58Z,'avalanche search',www.denverpost.com,en,0.2,Keeler: Avalanche hero Nazem Kadri just made Nathan MacKinnon smile like it’s 2022 all over again,"You've heard of fans who can't wait to drive a player to the airport, right? Avalanche faithful apparently tried to get Nazem Kadri from DIA back to Ball Arena quicker after his plane landed late Saturday night.",https://www.denverpost.com/2026/03/08/nazem-kadri-avalanche-wild-nathan-mackinnon/,https://www.denverpost.com/wp-content/uploads/2026/03/TDP-L-AVS-WILDAO2_2904x.jpg?w=1024&h=711,,"It took one game for Nazem Kadri to turn the NHL’s perpetual frown completely upside down.
Nathan MacKinnon hasn’t flashed a smile like that on the ice since, what, June 2022?
Just saying.
“I’ve b… [+6408 chars]",,"Keeler: Lawinenheld Nazem Kadri hat Nathan MacKinnon gerade zum Lächeln gebracht, als wäre es wieder das Jahr 2022. Sie haben von Fans gehört, die es kaum erwarten können, einen Spieler zum Flughafen zu fahren, oder? Lawinentreue versuchten offenbar, Nazem Kadri von DIA schneller zurück in die Ballarena zu bringen, nachdem sein Flugzeug am späten Samstagabend gelandet war.","Keeler: Avalanche hero Nazem Kadri just made Nathan MacKinnon smile like it’s 2022 all over again. You've heard of fans who can't wait to drive a player to the airport, right? Avalanche faithful apparently tried to get Nazem Kadri from DIA back to Ball Arena quicker after his plane landed late Saturday night.","Keeler: Avalanche heros Nazem Kadri modo fecit Nathan MacKinnon ridere sicut suus 2022 de novo. Audivistis a nisl quis non expectare ad aeriportum lusorem agere, vox? Fidelis NIVIS apparenter conatus est ut Nazem Kadri e DIA redire ad Ball Arenam celerius post suum planum nocte multam sabbati appulit.",2026-03-15 13:53:31+00:00
d54b6d9dc026b743067c04195f91b4de,2026-03-09T04:28:00Z,'avalanche search',www.thesportingtribune.com,en,0.3,Lakers bludgeon Knicks in statement win,"Without LeBron, Los Angeles finds its inner beast, outmuscling New York 110-97 behind a 34-20 third-quarter avalanche and an 18-6 rebounding beatdown.",https://www.thesportingtribune.com/2026/03/08/lakers-bully-and-bludgeon-knicks,https://s.yimg.com/os/en/the_sporting_tribune_articles_423/79775c73ccf488705d86184c5f29dd00,,"LOS ANGELESWhen the Los Angeles Lakers played basketball at 12:30, an ungodly hour for NBA players accustomed to 7:00 PM tip-offs, it felt off. It felt weird. It felt wrong.
The noonday sunlight snu… [+11210 chars]",,"Die Lakers vernichten die Knicks beim Statement-Sieg. Ohne LeBron findet Los Angeles sein inneres Biest und besiegt New York mit 110:97, nach einer Lawine von 34:20 im dritten Viertel und einem Rebound-Sieg von 18:6.","Lakers bludgeon Knicks in statement win. Without LeBron, Los Angeles finds its inner beast, outmuscling New York 110-97 behind a 34-20 third-quarter avalanche and an 18-6 rebounding beatdown.","Turpis bludgeon Knicks in constitutione win. Sine LeBron, Los Angeles suam bestiam interiorem invenit, exusta Novi Eboraci 110-97 post 34-20 tertiam partem cadentis et 18-6 repercussus.",2026-03-15 13:53:31+00:00
b1bc6a8c65f24acd25e4f7641a470133,2026-03-08T18:56:58Z,'avalanche ski',www.denverpost.com,en,0.8,Skier killed in avalanche near Copper Mountain,"Rescue crews found a missing skier's body in avalanche debris near Copper Mountain early Sunday morning, state officials said.",https://www.denverpost.com/2026/03/08/missing-skier-death-copper-mountain/,https://www.denverpost.com/wp-content/uploads/2026/03/tdp-l-avalanche-copper-mountain.jpg?w=512&h=384,,"Rescue crews found a missing skier’s body in avalanche debris near Copper Mountain early Sunday morning, state officials said.
A snowmobiler was reported missing Saturday evening in the Boss Basin a… [+1481 chars]",,"Skifahrer bei Lawine in der Nähe von Copper Mountain getötet. Rettungskräfte fanden am frühen Sonntagmorgen die Leiche eines vermissten Skifahrers in Lawinenresten in der Nähe von Copper Mountain, sagten Staatsbeamte.","Skier killed in avalanche near Copper Mountain. Rescue crews found a missing skier's body in avalanche debris near Copper Mountain early Sunday morning, state officials said.","Skier in avalanche prope Montem Cuprum occisus est. Eripe nautae corpus absentis nautae in avalanche strages prope Montem Copperum primo die Dominico mane, ministri civitatis dixerunt.",2026-03-15 13:53:31+00:00
1f387b2c0d0d2936c2e9df1509bfdf4d,2026-03-09T06:29:35Z,'avalanche missing',consent.yahoo.com,en,0.8,"Several killed, others missing after massive avalanche of garbage at Indonesia’s largest landfill",,https://consent.yahoo.com/v2/collectConsent?sessionId=1_cc-session_5d7a46eb-a422-4711-9b7e-4aca56181b5e,,,"If you click 'Accept all', we and our partners, including 246 who are part of the IAB Transparency &amp; Consent Framework, will also store and / or access information on a device (in other words, us… [+1046 chars]",,"Mehrere Tote, weitere Vermisste nach gewaltiger Mülllawine auf Indonesiens größter Mülldeponie. Keiner","Several killed, others missing after massive avalanche of garbage at Indonesia’s largest landfill. None","Aliquot interfecti, alii absentis post magnam avalanche of quisquiliarum in maxima landfill Indonesia. Nullus",2026-03-15 13:53:31+00:00
b360749e1d894c36af1833707afdb9b9,2026-03-09T06:56:51Z,'avalanche missing',abcnews.com,en,0.8,Waste mound collapse at Indonesia's largest landfill kills at least 5 and leaves several missing,Officials say a massive avalanche of garbage at Indonesia’s largest landfill has killed at least five people and left several others missing after heavy overnight rain triggered the collapse,https://abcnews.com/International/wireStory/waste-mound-collapse-indonesias-largest-landfill-kills-5-130891981,https://i.abcnewsfe.com/a/19633a46-f81e-40f0-80c1-b2489ab4a45c/wirestory_44df10d091059a5e18316f6a6794f471_16x9.jpg?w=1600,http://web.archive.org/web/20260309220914/https://abcnews.com/International/wireStory/waste-mound-collapse-indonesias-largest-landfill-kills-5-130891981,"JAKARTA, Indonesia -- A massive avalanche of garbage at Indonesias largest landfill killed at least five people and left several others missing after heavy overnight rain triggered a rubbish dump col… [+2583 chars]",,"Einsturz eines Müllhaufens auf Indonesiens größter Mülldeponie fordert mindestens fünf Todesopfer, mehrere werden vermisst. Beamte sagen, dass eine riesige Mülllawine auf Indonesiens größter Mülldeponie mindestens fünf Menschen getötet und mehrere weitere vermisst hat, nachdem heftige Regenfälle über Nacht den Einsturz ausgelöst hatten",Waste mound collapse at Indonesia's largest landfill kills at least 5 and leaves several missing. Officials say a massive avalanche of garbage at Indonesia’s largest landfill has killed at least five people and left several others missing after heavy overnight rain triggered the collapse,Tumulus vastus ruina apud Indonesiae maximae landfill necat saltem 5 et aliquot folia desunt. Magistratus dicunt magnam avalanche of quisquiliarum maximae landfill Indonesiae saltem quinque homines occidisse et complures alios absentes reliquerunt postquam pluviae pernoctare urguere ruinam,2026-03-15 13:53:31+00:00
228cabd32aeb2d75838f2a807f4ec717,2026-03-10T09:00:00Z,'avalanche search',www.newser.com,en,0.8,Avalanche of Garbage Kills 7 at Landfill,"A massive avalanche of garbage at Indonesia's largest landfill killed seven people after heavy overnight rain triggered a rubbish dump collapse, officials said Tuesday. More than 300 search-and-rescue personnel, using heavy machinery and sniffer dogs, were de…",https://www.newser.com/story/385105/avalanche-of-garbage-kills-7-at-landfill.html,https://img2-azrcdn.newser.com/image/1669993-12-20260310040002.jpeg,http://web.archive.org/web/20260311104140/https://www.newser.com/story/385105/avalanche-of-garbage-kills-7-at-landfill.html,"A massive avalanche of garbage at Indonesia's largest landfill killed seven people after heavy overnight rain triggered a rubbish dump collapse, officials said Tuesday. More than 300 search-and-rescu… [+1729 chars]",,"Mülllawine tötet 7 auf der Mülldeponie. Bei einer gewaltigen Mülllawine auf Indonesiens größter Mülldeponie kamen sieben Menschen ums Leben, nachdem heftige Regenfälle über Nacht zum Einsturz einer Mülldeponie geführt hatten, sagten Beamte am Dienstag. Mehr als 300 Such- und Rettungskräfte setzten schwere Maschinen und Spürhunde ein.","Avalanche of Garbage Kills 7 at Landfill. A massive avalanche of garbage at Indonesia's largest landfill killed seven people after heavy overnight rain triggered a rubbish dump collapse, officials said Tuesday. More than 300 search-and-rescue personnel, using heavy machinery and sniffer dogs, were de…","Avalanche of Purgamentum interficit 7 apud Landfill. Avalanche ingens purgamentum in maxima landfill Indonesia septem homines interfecerunt postquam gravis pernoctare pluvia ruit rudera ruinae TUBER, officiales Martis dixerunt. Plus quam trecenti quaerendi et liberandi personas, gravibus machinis adhibitis et canibus olentis, de ...",2026-03-15 13:53:31+00:00
fc2bb4cb5d7b11897719c15acee4a312,2026-03-11T20:15:28Z,'avalanche missing',mymodernmet.com,en,0.8,Wife Uses “Find My iPhone” To Locate Skier Husband Trapped Under an Avalanche,"Wife Uses “Find My iPhone” To Locate Skier Husband Trapped Under an Avalanche
Michael Harris was skiing at Stevens Pass Ski Resort in Washington on Thursday, February 26, when he suddenly got caught in an avalanche. Trapped under the snow for more than four h…",https://mymodernmet.com/find-my-iphone-michael-harris-rescue/,https://mymodernmet.com/wp/wp-content/uploads/2026/03/michael-harris-avalanche-rescue-thumbnail.jpg,,"Michael Harris was skiing at Stevens Pass Ski Resort in Washington on Thursday, February 26, when he suddenly got caught in an avalanche. Trapped under the snow for more than four hours, he didn’t kn… [+2605 chars]",,"Ehefrau nutzt „Find My iPhone“, um ihren unter einer Lawine gefangenen Skifahrer-Ehemann zu lokalisieren. Ehefrau nutzt „Find My iPhone“, um ihren unter einer Lawine gefangenen Skifahrer-Ehemann zu lokalisieren
Michael Harris war am Donnerstag, dem 26. Februar, beim Skifahren im Stevens Pass Ski Resort in Washington, als er plötzlich von einer Lawine erfasst wurde. Mehr als vier Stunden lang unter dem Schnee gefangen …","Wife Uses “Find My iPhone” To Locate Skier Husband Trapped Under an Avalanche. Wife Uses “Find My iPhone” To Locate Skier Husband Trapped Under an Avalanche
Michael Harris was skiing at Stevens Pass Ski Resort in Washington on Thursday, February 26, when he suddenly got caught in an avalanche. Trapped under the snow for more than four h…","Uxor usus ""Inveni me iPhone"" Ad Locate skier maritum Capti sub NIVIS. Usus uxorem ""Inveni me iPhone"" Capti sub viro ad NIVIS Skier Locate
Michael Harris apud Stevens Pass Ski Obstinatus in Washington die Iovis ante diem festum 26 Februarii nata est, cum repente in montem cadentem deprehensus est. Capti sub nive plus quam quattuor h ...",2026-03-15 13:53:31+00:00
acd366b3214192de9a21269b543d812a,2026-03-06T21:20:56Z,'avalanche protection',www.sportingnews.com,en,0.2,How Avalanche traded for Nazem Kadri an hour after the NHL trade deadline,This was a wild swing.,https://www.sportingnews.com/us/nhl/colorado-avalanche/news/how-avalanche-traded-nazem-kadri-hour-after-nhl-trade-deadline/1361b4f9575df1aebe697351,https://s.yimg.com/os/en/the_sporting_news_articles_584/2dcbf3bf844b52be78895d2879ba637a,,"How Avalanche traded for Nazem Kadri an hour after the NHL trade deadline originally appeared on The Sporting News. Add The Sporting News as a Preferred Source by clicking here.
An hour passed.
Lit… [+1279 chars]",,Wie Avalanche eine Stunde nach NHL-Handelsschluss für Nazem Kadri gehandelt hat. Das war ein wilder Schwung.,How Avalanche traded for Nazem Kadri an hour after the NHL trade deadline. This was a wild swing.,Quomodo Avalanche negotiaverunt pro Nazem Kadri hora post NHL commercium notificatum. Hoc adductius silvestre fuit.,2026-03-17 05:25:31+00:00
a8f2d68930ac5e781480c5398bb6d4bd,2026-03-11T23:00:00Z,'avalanche death',allthatsinteresting.com,en,0.7,Why The Death Zone Of Mount Everest Has Claimed The Lives Of Hundreds Of Climbers,"Low oxygen levels, frigid temperatures, high winds, and frequent avalanches make Mount Everest's Death Zone one of the world's most lethal places.
The post Why The Death Zone Of Mount Everest Has Claimed The Lives Of Hundreds Of Climbers appeared first on All…",https://allthatsinteresting.com/mount-everest-death-zone,https://allthatsinteresting.com/wordpress/wp-content/uploads/2026/03/peak-of-everest-alongside-climbers-featured.jpg,,"Low oxygen levels, frigid temperatures, high winds, and frequent avalanches make Mount Everest's Death Zone one of the world's most lethal places.
Bijay Chaurasia/Wikimedia CommonsMount Everest’s De… [+7576 chars]",,"Warum die Todeszone des Mount Everest Hunderten von Bergsteigern das Leben gekostet hat. Niedrige Sauerstoffwerte, eisige Temperaturen, starke Winde und häufige Lawinen machen die Todeszone des Mount Everest zu einem der tödlichsten Orte der Welt.
Der Beitrag „Warum die Todeszone des Mount Everest das Leben von Hunderten von Bergsteigern gefordert hat“ erschien zuerst auf All…","Why The Death Zone Of Mount Everest Has Claimed The Lives Of Hundreds Of Climbers. Low oxygen levels, frigid temperatures, high winds, and frequent avalanches make Mount Everest's Death Zone one of the world's most lethal places.
The post Why The Death Zone Of Mount Everest Has Claimed The Lives Of Hundreds Of Climbers appeared first on All…","Quare Mors Zonam Montis Everestiani vitam centenariorum exhibuit. Minimum oxygeni gradus, temperaturas frigidas, venti alti, et frequentes avalanches faciunt Zonam Montis Everesti unam ex locis mundi maxime letalibus.
Post Cur Mors Zonam Montis Everestiani petiit Vitas Centum Climbers apparuit primum in omnes ...",2026-03-17 05:25:31+00:00
16cc4593bbccf7de48959c22fe6219c1,2026-03-09T07:56:52Z,'avalanche mountain',www.thelocal.se,en,0.8,Today in Sweden: A roundup of the latest news on Monday,There's a considerable risk of avalanches in the Swedish mountains and experts believe that the Iran war means Swedes can kiss any further interest rate cuts goodbye. More on that and the latest news here.,https://www.thelocal.se/20260309/today-in-sweden-a-roundup-of-the-latest-news-on-monday-235,https://assets.thelocal.com/cdn-cgi/rs:fit:1200/quality:75/plain/https://apiwp.thelocal.com/wp-content/uploads/2026/03/watermarks-logo-sdlaUf1pXYZSS0.jpg@webp,,There's a considerable risk of avalanches in the Swedish mountains and experts believe that the Iran war means Swedes can kiss any further interest rate cuts goodbye. More on that and the latest news… [+4486 chars],,"Heute in Schweden: Eine Zusammenfassung der neuesten Nachrichten vom Montag. In den schwedischen Bergen besteht erhebliche Lawinengefahr und Experten gehen davon aus, dass die Schweden aufgrund des Iran-Krieges von weiteren Zinssenkungen Abstand nehmen können. Mehr dazu und aktuelle Neuigkeiten hier.",Today in Sweden: A roundup of the latest news on Monday. There's a considerable risk of avalanches in the Swedish mountains and experts believe that the Iran war means Swedes can kiss any further interest rate cuts goodbye. More on that and the latest news here.,Hodie in Suecia: Circulus recentissimi nuntii die Lunae. Magnum periculum est avalanches in montibus Suecicis et periti credunt Iran bellum significat Suecos posse osculari amplius commodas vias secat vale. Morbi in ipsum et mauris auctor consequat.,2026-03-17 05:25:31+00:00
9c6cfdeb12a7be9c168f0ccb2f712248,2026-03-12T08:00:00Z,'avalanche mountain',www.cbc.ca,en,0.8,What's climate change doing to avalanches and how we predict them?,"A series of tragic deaths in Canada, the U.S. and Europe is showing how tricky avalanches still are to predict. Will that change with global warming?",https://www.cbc.ca/news/climate/avalanche-prediction-climate-change-danger-9.7124688,"https://i.cbc.ca/ais/1b2edafd-783a-4022-bd4b-cbd90743db62,1773260588827/full/max/0/default.jpg?im=Crop%2Crect%3D%280%2C312%2C6000%2C3375%29%3BResize%3D620",http://web.archive.org/web/20260312123811/https://www.cbc.ca/news/climate/avalanche-prediction-climate-change-danger-9.7124688,"In February, five people were killed in separate avalanches across B.C. and Alberta. That same month, more than a dozen people were killed in California and Utah, including a particularly deadly aval… [+5771 chars]",,"Was macht der Klimawandel mit Lawinen und wie prognostizieren wir sie? Eine Reihe tragischer Todesfälle in Kanada, den USA und Europa zeigt, wie schwierig die Vorhersage von Lawinen noch immer ist. Wird sich das mit der globalen Erwärmung ändern?","What's climate change doing to avalanches and how we predict them?. A series of tragic deaths in Canada, the U.S. and Europe is showing how tricky avalanches still are to predict. Will that change with global warming?","Quae mutatio climatis est avalanches facere et quomodo ea praedicimus? Series funerum tragicorum in Canada, Americae et Europae ostendit quam dolosas avalanches adhuc praedicent. Ista mutatio cum calefactione globali?",2026-03-17 05:25:31+00:00
47dc063ccbb3b597d4196ab56a02167b,2026-03-14T05:59:09Z,'avalanche rescue',www.bbc.com,en,0.9,Rescuers blame weather and 'underprepared skiers' for rise in Alps avalanche deaths,The BBC joins a French Alps rescue team as the number of skiers killed this season passes 100.,https://www.bbc.com/news/articles/cev7111kx9wo,https://ichef.bbci.co.uk/news/1024/branded_news/c670/live/c49e5040-141e-11f1-963a-55716ece1b4d.jpg,http://web.archive.org/web/20260314154524/https://www.bbc.com/news/articles/cev7111kx9wo,"""A lot of the victims are skiers who come here often, are technically skilled, but aren't necessarily connoisseurs of the mountain environment,"" suggests Stéphane Bornet, the director of Anena, a Fre… [+27 chars]",,"Retter machen das Wetter und „unzureichend vorbereitete Skifahrer“ für den Anstieg der Lawinentoten in den Alpen verantwortlich. Die BBC schließt sich einem französischen Alpenrettungsteam an, da die Zahl der in dieser Saison getöteten Skifahrer die 100-Marke überschreitet.",Rescuers blame weather and 'underprepared skiers' for rise in Alps avalanche deaths. The BBC joins a French Alps rescue team as the number of skiers killed this season passes 100.,Subventores tempestates reprehendunt et 'underprepared skiers' pro in Alpibus NIVIS funera surgunt. BBC Alpes Galliae coniungit ut turmas liberarent sicut numerus skiers occidit hoc tempore 100 transit.,2026-03-17 05:25:31+00:00
8f4db119d65bad58b91e0c6c0a8fce1e,2026-03-09T11:00:00Z,'avalanche ski',longreads.com,en,0.7,California’s Deadliest Avalanche Turned on One Choice,"""Why did a group of 15 skiers take a risky route on a dangerous day?""",http://longreads.com/2026/03/09/californias-deadliest-avalanche-turned-on-one-choice/,,http://web.archive.org/web/20260309125339/https://longreads.com/2026/03/09/californias-deadliest-avalanche-turned-on-one-choice/,"A powerful February storm triggered Californias deadliest avalanche in modern history, killing nine of 15 backcountry skiers traveling from the Frog Lake huts near Lake Tahoe. Joshua Partlow carefull… [+1092 chars]",,Kaliforniens tödlichste Lawine war auf One Choice zurückzuführen. „Warum ist eine Gruppe von 15 Skifahrern an einem gefährlichen Tag eine riskante Route gegangen?“,"California’s Deadliest Avalanche Turned on One Choice. ""Why did a group of 15 skiers take a risky route on a dangerous day?""","California's Deadliest Avalanche in One Choice vertitur. ""Quare coetus nautarum XV periculosum iter arripere in periculoso die?""",2026-03-17 14:21:52+00:00
c83c71f825a12a96ca7b3549e57ae936,2026-03-16T06:00:00Z,'avalanche warning system',www.naturalnews.com,en,0.3,The Great Taking Has Begun: Why Your Financial Assets Are Now Trapped in a War Zone,The First Domino: Your Money Is Already Frozen I believe we have passed the point of theoretical warnings and entered the realm of undeniable action. The system you were told was liquid and secure is actively locking the doors. Investment funds are not a futu…,https://www.naturalnews.com/2026-03-16-the-great-taking-has-begun-assets-trapped.html,https://www.naturalnews.com/wp-content/uploads/sites/91/2026/03/financial-crisis-asset-liquidity-bail-in-mechanism-517-original.jpg,,"The First Domino: Your Money Is Already Frozen
I believe we have passed the point of theoretical warnings and entered the realm of undeniable action. The system you were told was liquid and secure i… [+11422 chars]",,"Die große Übernahme hat begonnen: Warum Ihre finanziellen Vermögenswerte jetzt in einem Kriegsgebiet gefangen sind. Der erste Dominostein: Ihr Geld ist bereits eingefroren Ich glaube, wir haben den Punkt der theoretischen Warnungen überschritten und sind in den Bereich unbestreitbarer Taten eingetreten. Das System, von dem Ihnen gesagt wurde, es sei flüssig und sicher, verriegelt aktiv die Türen. Investmentfonds sind keine Zukunftsmusik …",The Great Taking Has Begun: Why Your Financial Assets Are Now Trapped in a War Zone. The First Domino: Your Money Is Already Frozen I believe we have passed the point of theoretical warnings and entered the realm of undeniable action. The system you were told was liquid and secure is actively locking the doors. Investment funds are not a futu…,"The Great taking has began: Why Your Financial BONA Nunc capti in bello Zona. Primum Domino: Pecunia tua iam glaciata est, credo, nos punctum admonitionis theoreticae transisse et in regnum pernegationis actionis intravimus. Ratio, quam tibi dixi, liquida et securum est strenue fores claudendi. Pecuniae investment non sunt futu…",2026-03-17 22:43:24+00:00
930d75972f3c9a6d27de6f5531693d8e,2026-03-06T23:38:00Z,'avalanche protection',timesofindia.indiatimes.com,en,0.3,"Maharashtra: Man harasses woman railway constable at Digha railway station, gets 1-year jail","Thane: Pointing \""law breakers need to be dealt with deterrently\"" and protection of women must be reinforced, an additional sessions court in Thane rec.",https://timesofindia.indiatimes.com/city/mumbai/maharashtra-man-harasses-woman-railway-constable-at-digha-railway-station-gets-1-year-jail/articleshow/129173234.cms,"https://static.toiimg.com/thumb/msid-129173227,width-1280,height-720,imgsize-19896,resizemode-6,overlay-toi_sw,pt-32,y_pad-600/photo.jpg",http://web.archive.org/web/20260307005432/https://timesofindia.indiatimes.com/city/mumbai/maharashtra-man-harasses-woman-railway-constable-at-digha-railway-station-gets-1-year-jail/articleshow/129173234.cms,"Follow Us On Social Media
GULF UNDER FIRE: Iran Launches Massive Strike On US Bases In Qatar, UAE, Kuwait | WatchVIRAL: Iranian Missile Slams Into American Base In Middle East? Shocking Footage Amid… [+3331 chars]",,"Maharashtra: Mann belästigt Bahnpolizistin am Bahnhof Digha und bekommt ein Jahr Gefängnis. Thane: Ein zusätzliches Sitzungsgericht in Thane weist darauf hin, dass „Gesetzesverstöße abschreckend behandelt werden müssen“ und der Schutz von Frauen gestärkt werden muss.","Maharashtra: Man harasses woman railway constable at Digha railway station, gets 1-year jail. Thane: Pointing \""law breakers need to be dealt with deterrently\"" and protection of women must be reinforced, an additional sessions court in Thane rec.","Maharashtra: homo feminam constabulariam ferriviariam apud Digha statione ferriviaria vexat, carcerem 1 annorum accipit. Thane: Demonstratio \"" legis praevaricatores tractandos esse depellendo"" et feminarum tutelam firmandas esse debent, additis sessionibus curiae in Thane rec.",2026-03-18 14:25:20+00:00
4fc911ea3690260548ea3cabbc04837a,2026-03-10T14:18:31Z,'avalanche protection',cointelegraph.com,en,0.3,Trust Wallet adds real-time scam address checks for crypto users,"Trust Wallet launched address poisoning protection on 32 EVM chains, adding scam address screening as wallet security pressure intensifies.",https://cointelegraph.com/news/trust-wallet-address-poisoning-protection-32-evm-chains,"https://images.cointelegraph.com/cdn-cgi/image/f=auto,onerror=redirect,w=1200/https://s3.cointelegraph.com/uploads/2025-12/019b2754-5ee7-734d-872e-d899106c1167.jpg",http://web.archive.org/web/20260310170856/https://cointelegraph.com/news/trust-wallet-address-poisoning-protection-32-evm-chains,"Trust Wallet has introduced address-poisoning protection, adding a new screening feature designed to help users avoid sending cryptocurrency to scam wallets that mimic legitimate addresses.
The nonc… [+2339 chars]",,"Trust Wallet bietet Echtzeit-Adressprüfungen für Krypto-Nutzer. Trust Wallet hat den Adressvergiftungsschutz für 32 EVM-Ketten eingeführt und die Überprüfung betrügerischer Adressen hinzugefügt, da der Druck auf die Wallet-Sicherheit zunimmt.","Trust Wallet adds real-time scam address checks for crypto users. Trust Wallet launched address poisoning protection on 32 EVM chains, adding scam address screening as wallet security pressure intensifies.","Fiducia Wallet addit real-time scam oratio compescit pro crypto utentes. Fiducia Wallet inscriptio veneficii tutelam in 32 EVM vincula immissa, addito scam inscriptione protegendo ut crumenam securitatis pressionis augeat.",2026-03-18 14:25:20+00:00
