index,published,keyword,domain,language,valid,title,description,url,image,archive,content,quote,de,en,la,added
dd68c5b757c5e8752c1211f2aeaafc4f,2026-03-04T04:49:00Z,'avalanche climate change',consent.yahoo.com,en,0.3,BASEBALL: Floyd’s third-inning blast ignites Claremore's season-opening rout at Edison,Brayden Floyd turned a comfortable lead into a runaway with one swing Monday evening. The junior slugger’s 2-run home run in the third inning sparked an 8-run avalanche that powered Claremore to a 15-1 season- and district-opening victory over Edison on the r…,https://consent.yahoo.com/v2/collectConsent?sessionId=1_cc-session_7d10737c-a114-41d1-84df-43901d91ba1d,,,"If you click 'Accept all', we and our partners, including 246 who are part of the IAB Transparency &amp; Consent Framework, will also store and / or access information on a device (in other words, us… [+1046 chars]",,"BASEBALL: Floyds Knall im dritten Inning entfacht Claremores Saisoneröffnungsniederlage bei Edison. Brayden Floyd verwandelte am Montagabend mit einem Schlag einen komfortablen Vorsprung in einen Ausreißer. Der 2-Run-Homerun des Junior-Schlägers im dritten Inning löste eine 8-Run-Lawine aus, die Claremore zu einem 15:1-Saison- und Bezirkseröffnungssieg über Edison auf dem R … bescherte.",BASEBALL: Floyd’s third-inning blast ignites Claremore's season-opening rout at Edison. Brayden Floyd turned a comfortable lead into a runaway with one swing Monday evening. The junior slugger’s 2-run home run in the third inning sparked an 8-run avalanche that powered Claremore to a 15-1 season- and district-opening victory over Edison on the r…,BASEBALL: Floyd tertia inspiratione inninge temporis aperturae apud Edison incendit Claremorei. Brayden Floyd convertit commoda plumbum in fugitivum cum uno adductius Lunae vesperi. Iunior 2-run domus slugger currit in tertio inninge avalanche commovit quod 8-run avalanche quae Claremore potestas est 15-1 temporum et regio-aperturae victoriae de Edison super r...,2026-03-06 22:38:46+00:00
b7b02a8cf1f68aecf549f1bc3e75c9a0,2026-03-01T14:55:52Z,'avalanche search',newsonjapan.com,en,0.7,"Avalanche Strikes Nagano-Niigata Ski Resort, Four Injured","An avalanche struck an advanced-level course at Madarao Kogen Ski Resort, which spans Niigata and Nagano prefectures, on February 28th, leaving four people injured, including two family members. (News On Japan)",https://newsonjapan.com/article/148514.php,https://i2.ytimg.com/vi/IB0imRru1oE/mqdefault.jpg,http://web.archive.org/web/20260301155245/https://www.newsonjapan.com/article/148514.php,"Nagano, Mar 01 (News On Japan) -
 An avalanche struck an advanced-level course at Madarao Kogen Ski Resort, which spans Niigata and Nagano prefectures, on February 28th, leaving four people injured,… [+1091 chars]",,"Lawine trifft Skigebiet Nagano-Niigata, vier Verletzte. Am 28. Februar traf eine Lawine einen Fortgeschrittenenkurs im Skigebiet Madarao Kogen, das sich über die Präfekturen Niigata und Nagano erstreckt. Dabei wurden vier Menschen verletzt, darunter zwei Familienmitglieder. (Neuigkeiten über Japan)","Avalanche Strikes Nagano-Niigata Ski Resort, Four Injured. An avalanche struck an advanced-level course at Madarao Kogen Ski Resort, which spans Niigata and Nagano prefectures, on February 28th, leaving four people injured, including two family members. (News On Japan)","Avalanche Ictus Nagano-Niigata Ski Obstinatus, Quattuor Laesus. Avalanche cursum provectum in Madarao Kogen Ski Obstinatus percussit, quod praefecturas Niigata et Nagano palmos nonis Februariis die 28 mensis Februarii reliquit, quattuor homines laesi, inter duo membra familiaria relinquens. (News On Japan)",2026-03-06 22:38:46+00:00
1146927153497715b2384d0abe41239b,2026-03-04T18:44:22Z,'avalanche search',consent.yahoo.com,en,0.7,New details in fatal avalanche: Skiers not wearing avalanche airbag systems,,https://consent.yahoo.com/v2/collectConsent?sessionId=1_cc-session_4d2247b3-d213-4f62-aa6a-12bf4a7cb257,,,"If you click 'Accept all', we and our partners, including 246 who are part of the IAB Transparency &amp; Consent Framework, will also store and / or access information on a device (in other words, us… [+1046 chars]",,Neue Details zur tödlichen Lawine: Skifahrer tragen kein Lawinen-Airbag-System. Keiner,New details in fatal avalanche: Skiers not wearing avalanche airbag systems. None,Nova singularia in NIVIS exitiale: skiers non NIVIS CASUALIS systemata gerens. Nullus,2026-03-06 22:38:46+00:00
39e23fd29d1135aa780d4cd43bc5579e,2026-03-05T14:00:00Z,'avalanche climate change',wattsupwiththat.com,en,0.7,"Media Say, ‘Climate Change’ Caused the Deadly Lake Tahoe Avalanche. They’re Wrong.","Declaring each avalanche is evidence of “climate collapse,” despite avalanches being common or at least not unusual, throughout history, even when temperatures were cooler and atmospheric greenhouse gas levels were lower, is not serious climate journalism. It…",https://wattsupwiththat.com/2026/03/05/media-say-climate-change-caused-the-deadly-lake-tahoe-avalanche-theyre-wrong/,https://i0.wp.com/wattsupwiththat.com/wp-content/uploads/2026/03/sierra-navada-awatts-1.webp?fit=1024%2C512&quality=75&ssl=1,,"On February 17, 2026, an avalanche struck north of Lake Tahoe, California, killing nine people amid a heavy, multi-day snowstorm in the area. The media falsely blamed climate change for the event. He… [+8915 chars]",,"Medien sagen, dass der „Klimawandel“ die tödliche Lake-Tahoe-Lawine verursacht hat. Sie liegen falsch. Zu behaupten, dass jede Lawine ein Beweis für einen „Klimakollaps“ sei, obwohl Lawinen im Laufe der Geschichte häufig oder zumindest nicht ungewöhnlich waren, selbst wenn die Temperaturen kühler und die Treibhausgaswerte in der Atmosphäre niedriger waren, ist kein ernsthafter Klimajournalismus. Es…","Media Say, ‘Climate Change’ Caused the Deadly Lake Tahoe Avalanche. They’re Wrong.. Declaring each avalanche is evidence of “climate collapse,” despite avalanches being common or at least not unusual, throughout history, even when temperatures were cooler and atmospheric greenhouse gas levels were lower, is not serious climate journalism. It…","Media Say, Clima Mutationem Lacum Tahoe Avalanche mortificatum effecit. Iniuriam faciunt. It…",2026-03-07 13:43:15+00:00
27b62015b7a1e9bec405969e9d367ef6,2026-03-04T18:25:00Z,'avalanche rescue',www.foxnews.com,en,0.8,Washington skier buried in avalanche is rescued after wife uses phone app to track him,A skier buried for hours in a Washington avalanche last week was saved after wife's intuition led her to check his phone's location using an app.,https://www.foxnews.com/us/washington-skier-buried-avalanche-rescued-after-wife-uses-phone-app-track-him,https://static.foxnews.com/foxnews.com/content/uploads/2026/03/michael-harris-penny-hospital.jpg,,"A skier buried for hours in an avalanche in Washington State last week was saved, after his wife followed her feeling that something was wrong when he failed to answer his phone.
Michael Harris was … [+1907 chars]",,"In einer Lawine verschütteter Washingtoner Skifahrer wird gerettet, nachdem seine Frau ihn mithilfe einer Telefon-App geortet hat. Ein Skifahrer, der letzte Woche stundenlang in einer Lawine in Washington verschüttet wurde, konnte gerettet werden, nachdem die Intuition seiner Frau sie dazu veranlasste, den Standort seines Telefons mithilfe einer App zu überprüfen.",Washington skier buried in avalanche is rescued after wife uses phone app to track him. A skier buried for hours in a Washington avalanche last week was saved after wife's intuition led her to check his phone's location using an app.,"Washington nauta sepultus in NIVIS, servatus est postquam uxor telephonica app ut eum indagare utitur. Nauta per horas sepelitur in Washington NIVIS Ultima septimana servata est postquam uxor intuitus eam ad reprimendam telephonicii locum utens app.",2026-03-07 22:33:08+00:00
5d654b57fedbf763b3fa97582bc7937d,2026-03-04T20:59:32Z,'avalanche ski',nypost.com,en,0.8,"Horrifying new details released after Lake Tahoe avalanche killed nine people, possible reason why so many died","Horrifying new details have been released in the Lake Tahoe avalanche that killed nine people last month. Sierra Avalanche Center said the backcountry skiers got caught in a “small depression” in the terrain, which may have been why the snow piled so high abo…",https://nypost.com/2026/03/04/us-news/horrifying-new-details-released-after-lake-tahoe-avalanche-that-killed-nine-people/,https://nypost.com/wp-content/uploads/sites/2/2026/03/122763198.jpg?quality=75&strip=all&w=1200,,"Horrifying new details have been released in the Lake Tahoe avalanche that killed nine people last month.
Sierra Avalanche Center said the backcountry skiers got caught in a “small depression” in th… [+1400 chars]",,"Erschreckende neue Details wurden veröffentlicht, nachdem bei der Lawine in Lake Tahoe neun Menschen ums Leben kamen, was möglicherweise der Grund dafür ist, dass so viele starben. Über die Lawine am Lake Tahoe, bei der letzten Monat neun Menschen ums Leben kamen, wurden erschreckende neue Details veröffentlicht. Das Sierra Avalanche Center sagte, die Backcountry-Skifahrer seien in einer „kleinen Senke“ im Gelände gefangen gewesen, was möglicherweise der Grund dafür sei, dass sich der Schnee so hoch über dem Gelände anhäufte.","Horrifying new details released after Lake Tahoe avalanche killed nine people, possible reason why so many died. Horrifying new details have been released in the Lake Tahoe avalanche that killed nine people last month. Sierra Avalanche Center said the backcountry skiers got caught in a “small depression” in the terrain, which may have been why the snow piled so high abo…","Singula nova horrenda dimiserunt postquam Lacus Tahoe NIVIS CASUS novem homines interfecit, fieri potest causa cur tot mortui sint. Novitates horrendas in lacu Tahoe avalanche dimissae sunt, qui novem homines proximo mense occiderunt. Sierra Avalanche Centrum dixit scaenicos nautas in ""minutis depressionibus"" in locis deprehensos esse, quod fieri potest cur nix tam alta abo... coacervata.",2026-03-07 22:33:08+00:00
656225860a8e8bfce4e2b397f9e3dbf0,2026-03-04T22:30:00Z,'avalanche ski',www.newser.com,en,0.8,Her Husband Didn't Answer. Her Hunch Saved His Life,"A Washington skier who was caught up in an avalanche owes his survival to a buried iPhone and a spouse who trusted her gut. Michael Harris was skiing Big Chief Bowl at Stevens Pass on Thursday when an avalanche swept him up, trapping him upright in a snow hol…",https://www.newser.com/story/384806/her-husband-didnt-answer-her-hunch-saved-his-life.html,https://img1-azrcdn.newser.com/image/1668896-12-20260304165117.jpeg,,"""You get a feeling something's just not right,"" wife Penny: He didn't answer her calls, and she saw that his location was stationary according to Apple's Find My iPhone feature. She alerted ski patro… [+613 chars]",,"Ihr Mann antwortete nicht. Ihre Ahnung rettete ihm das Leben. Ein Skifahrer aus Washington, der von einer Lawine erfasst wurde, verdankt sein Überleben einem vergrabenen iPhone und einer Ehefrau, die auf ihr Bauchgefühl vertraute. Michael Harris fuhr am Donnerstag beim Big Chief Bowl am Stevens Pass Ski, als eine Lawine ihn hochriss und ihn aufrecht in einem Schneeloch festhielt …","Her Husband Didn't Answer. Her Hunch Saved His Life. A Washington skier who was caught up in an avalanche owes his survival to a buried iPhone and a spouse who trusted her gut. Michael Harris was skiing Big Chief Bowl at Stevens Pass on Thursday when an avalanche swept him up, trapping him upright in a snow hol…","Vir eius non respondit ei. Her hunch vitam suam servavit. A Washington nauta qui in NIVIS CASUS captus est salutem suam debet pro iPhone sepulto et coniugi quae ventrem eius credidit. Michael Harris magnus dux Crater nartis ad Stevens transiens die Iovis cum NIVIS eum rapuit, eum rectum in nivis hol…",2026-03-07 22:33:08+00:00
c6deb44bae814a588881132a65393064,2026-03-07T01:26:38Z,'avalanche warning system',www.cbc.ca,en,0.3,Warm storm raising avalanche risk across B.C. during historically deadly month,Forecasters say a warm storm sweeping across British Columbia this weekend has heightened risks at a time of year that is historically the deadliest for avalanches in Canada.,https://www.cbc.ca/news/canada/british-columbia/warm-storm-raises-avalanche-risk-in-b-c-9.7118546,"https://i.cbc.ca/ais/1.6273967,1699847723000/full/max/0/default.jpg?im=Crop%2Crect%3D%280%2C0%2C1919%2C1079%29%3BResize%3D620",,"Forecasters say a warm storm sweeping across British Columbia this weekend is increasing risks at a time of year that is historically the deadliest for avalanches in Canada.
Environment and Climate … [+4139 chars]",,"Warmer Sturm erhöht Lawinengefahr in ganz B.C. während eines historisch tödlichen Monats. Prognostiker sagen, dass ein warmer Sturm, der an diesem Wochenende über British Columbia hinwegfegt, die Risiken erhöht hat, und das zu einer Jahreszeit, die historisch gesehen die tödlichste Lawinengefahr in Kanada darstellt.",Warm storm raising avalanche risk across B.C. during historically deadly month. Forecasters say a warm storm sweeping across British Columbia this weekend has heightened risks at a time of year that is historically the deadliest for avalanches in Canada.,"Tempestas tepida sublato NIVIS periculo trans B.C. in historicis exitialibus mensis. Praedictores dicunt tempestatem calidam per Britanniam Columbiam lapsam hanc volutpat periculum augere tempore anni, quod historice maximum est avalanches in Canada.",2026-03-09 22:39:05+00:00
bf34443f31e7216bfaed0252b73e80c3,2026-03-08T16:19:12Z,'avalanche mountain',nypost.com,en,0.8,Inside the high-tech race to prevent avalanches — and why the window to survive one is so brutally narrow,"After nine people were killed in a California avalanche, one expert said: “We can reduce risk in the mountains. But we cannot eliminate risk.”",https://nypost.com/2026/03/08/sports/inside-the-high-tech-race-to-prevent-avalanches/,https://nypost.com/wp-content/uploads/sites/2/2026/03/crop-38711905.jpg?quality=75&strip=all&w=1200,,"By any measure, Americans are flooding into avalanche country at a staggering rate. Some estimates suggest a hundred times more people are venturing into the backcountry now than 25 years ago. And ye… [+11433 chars]",,"Im High-Tech-Wettlauf um die Verhinderung von Lawinen – und warum das Zeitfenster zum Überleben so brutal eng ist. Nachdem bei einer Lawine in Kalifornien neun Menschen ums Leben kamen, sagte ein Experte: „Wir können das Risiko in den Bergen verringern. Aber wir können das Risiko nicht beseitigen.“","Inside the high-tech race to prevent avalanches — and why the window to survive one is so brutally narrow. After nine people were killed in a California avalanche, one expert said: “We can reduce risk in the mountains. But we cannot eliminate risk.”","Intus summus tech genus ne avalanches - et cur fenestra superstes est tam crudeliter angusta. Post novem homines in California NIVIS caesi, unus peritus dixit: ""Periculosum in montibus possumus reducere. Sed periculum tollere non possumus.""",2026-03-09 22:39:05+00:00
4e3add645d0554047f2c262fefec53be,2026-03-09T04:45:00Z,'avalanche rescue',www.cbsnews.com,en,0.8,"Skier killed in avalanche in Boss Basin, first Colorado ski death of season","Early Sunday morning, Colorado rescue crews found the body of a missing skier who was killed in a recent avalanche.",https://www.cbsnews.com/colorado/news/skier-killed-avalanche-colorado-boss-basin/,https://assets3.cbsnewsstatic.com/hub/i/r/2026/03/08/48c32c8f-086e-437d-998c-39629b749f11/thumbnail/1200x630g2/c73634f890a9281e2376e9ad4eaca951/boss-basin-fatal-avalanche-2-slide-from-caic-on-fb.jpg,,"Early Sunday morning, Colorado rescue crews found the body of a missing skier who was killed in a recent avalanche.
The skier was reported missing in the Boss Basin area in the upper portion of Reso… [+2689 chars]",,"Skifahrer bei Lawine im Boss Basin getötet, erster Colorado-Skitodesfall der Saison. Am frühen Sonntagmorgen fanden Rettungskräfte aus Colorado die Leiche eines vermissten Skifahrers, der kürzlich bei einem Lawinenunglück ums Leben gekommen war.","Skier killed in avalanche in Boss Basin, first Colorado ski death of season. Early Sunday morning, Colorado rescue crews found the body of a missing skier who was killed in a recent avalanche.","Skier in avalanche in Boss Rasin occisus est, primus Colorado ski mors importuna. Primo die dominico mane, Colorado nautarum liberandi corpus nautae absentis invenit qui in recenti NIVIS CASUS occisus est.",2026-03-10 22:37:42+00:00
9fa7ef39f5e4b3f6a0f0c2a6f86b1342,2026-03-07T00:54:07Z,'avalanche warning system',consent.yahoo.com,en,0.2,Stanley Cup chase is wide open and more takeaways from the NHL trade deadline,"The NHL trade deadline showed that the race to succeed the Florida Panthers as Stanley Cup champions after they went back to back and fell short this season is wide open. The Colorado Avalanche are rightfully the betting favorites, 5-2 on BetMGM Sportsbook, s…",https://consent.yahoo.com/v2/collectConsent?sessionId=1_cc-session_f2c7f223-8afe-451f-831b-26fb5d653a0d,,,"If you click 'Accept all', we and our partners, including 246 who are part of the IAB Transparency &amp; Consent Framework, will also store and / or access information on a device (in other words, us… [+1046 chars]",,"Stanley Cup chase is wide open and more takeaways from the NHL trade deadline. Der Handelsschluss der NHL hat gezeigt, dass das Rennen um die Nachfolge der Florida Panthers als Stanley-Cup-Meister, nachdem sie in dieser Saison zweimal hintereinander scheiterten, offen ist. Die Colorado Avalanche sind zu Recht der Wettfavorit, 5:2 bei BetMGM Sportsbook, s…","Stanley Cup chase is wide open and more takeaways from the NHL trade deadline. The NHL trade deadline showed that the race to succeed the Florida Panthers as Stanley Cup champions after they went back to back and fell short this season is wide open. The Colorado Avalanche are rightfully the betting favorites, 5-2 on BetMGM Sportsbook, s…","Stanley Cup chase is wide open and more takeaways from the NHL trade deadline. NHL commercium fatale monstravit genus pantherarum Floridae succedere sicut Stanley Cup pugiles postquam retro recesserunt et deficiebant hoc tempore apertis. Colorado Avalanche, merito sponsio favoris, 5-2 in BetMGM Sportsbook, s…",2026-03-11 05:16:30+00:00
31b01d13599e0f36af0cb668884ddb53,2026-03-09T03:52:31Z,'avalanche warning system',consent.yahoo.com,en,0.3,Spurs unleash offensive avalanche in 145-120 rout of Rockets,San Antonio’s balanced attack and relentless pace overwhelm Houston in statement win.,https://consent.yahoo.com/v2/collectConsent?sessionId=1_cc-session_662a0147-ad47-47ef-8990-41153bf5f37b,,,"If you click 'Accept all', we and our partners, including 246 who are part of the IAB Transparency &amp; Consent Framework, will also store and / or access information on a device (in other words, us… [+1046 chars]",,Die Spurs entfesseln eine Offensivlawine in der 145:120-Niederlage der Rockets. San Antonios ausgewogener Angriff und sein unermüdliches Tempo überwältigen Houston und verhelfen ihm zum klaren Sieg.,Spurs unleash offensive avalanche in 145-120 rout of Rockets. San Antonio’s balanced attack and relentless pace overwhelm Houston in statement win.,Calcaribus involvat ingrata NIVIS in 145-120 fusa Rockets. San Antonio impetus libratus et indefessa gressu opprimunt Houston in propositione win.,2026-03-11 05:16:30+00:00
133d550402d2088842156521d5a6b7a5,2026-03-11T05:09:12Z,'avalanche mountain',consent.yahoo.com,en,0.2,McDavid’s late power-play winner lifts the Oilers past the Avalanche 4-3,"Ryan Nugent-Hopkins scored two goals, Connor McDavid had a goal and an assist, and the Edmonton Oilers defeated the Colorado Avalanche 4-3 on Tuesday night. McDavid’s goal, his 36th of the season, came on a snap shot on the power play with 10:57 remaining in …",https://consent.yahoo.com/v2/collectConsent?sessionId=1_cc-session_64b46338-fff4-4452-9819-ee8c0e3b14c2,,,"If you click 'Accept all', we and our partners, including 245 who are part of the IAB Transparency &amp; Consent Framework, will also store and / or access information on a device (in other words, us… [+1046 chars]",,"McDavids später Siegtreffer im Powerplay führt die Oilers mit 4:3 an der Avalanche vorbei. Ryan Nugent-Hopkins erzielte zwei Tore, Connor McDavid hatte ein Tor und einen Assist und die Edmonton Oilers besiegten die Colorado Avalanche am Dienstagabend mit 4:3. McDavids Tor, sein 36. in dieser Saison, fiel mit einem Schnappschuss im Powerplay, 10:57 vor Schluss …","McDavid’s late power-play winner lifts the Oilers past the Avalanche 4-3. Ryan Nugent-Hopkins scored two goals, Connor McDavid had a goal and an assist, and the Edmonton Oilers defeated the Colorado Avalanche 4-3 on Tuesday night. McDavid’s goal, his 36th of the season, came on a snap shot on the power play with 10:57 remaining in …","McDavid’s late power-play winner lifts the Oilers past the Avalanche 4-3. Ryan Nugent-Hopkins duas metas laceravit, Connor McDavid propositum et adiutorium habuit, et Edmonton Oilers Colorado Avalanche die Martis 4-3 superavit. McDavid’s goal, his 36th of the season, came on a snap shot on the power play with 10:57 remaining in …",2026-03-13 05:17:35+00:00
0015b55d100480c2601bf1bd27628330,2026-03-11T21:04:02Z,'avalanche search',consent.yahoo.com,en,0.2,Oilers’ $41M forward sends bold warning to NHL teams: “We can beat anybody”,"Ryan Nugent-Hopkins sent a clear message to the NHL after helping the Edmonton Oilers beat the Colorado Avalanche 4-3 on Tuesday. The veteran forward, who is a 2011 first overall pick, scored twice and helped Edmonton secure an important win.…",https://consent.yahoo.com/v2/collectConsent?sessionId=1_cc-session_d8ab1924-7a9f-4da9-8e01-d1e728d281d7,,,"If you click 'Accept all', we and our partners, including 245 who are part of the IAB Transparency &amp; Consent Framework, will also store and / or access information on a device (in other words, us… [+1046 chars]",,"Der 41-Millionen-Dollar-Stürmer der Oilers sendet eine deutliche Warnung an die NHL-Teams: „Wir können jeden schlagen.“ Ryan Nugent-Hopkins sendete eine klare Botschaft an die NHL, nachdem er den Edmonton Oilers am Dienstag beim 4:3-Sieg gegen die Colorado Avalanche geholfen hatte. Der erfahrene Stürmer, der 2011 zur ersten Wahl gewählt wurde, erzielte zwei Tore und verhalf Edmonton zu einem wichtigen Sieg.…","Oilers’ $41M forward sends bold warning to NHL teams: “We can beat anybody”. Ryan Nugent-Hopkins sent a clear message to the NHL after helping the Edmonton Oilers beat the Colorado Avalanche 4-3 on Tuesday. The veteran forward, who is a 2011 first overall pick, scored twice and helped Edmonton secure an important win.…","Oilers' $41M proferre audacter monitionem ad NHL teams: ""quemquam possumus verberare"". Ryan Nugent-Hopkins clarum nuntium misit ad NHL postquam Edmonton Oilers adiuvat, Colorado Avalanche die Martis 4-3 verberavit. Veteres deinceps, qui 2011 prima altiore robur est, bis notatos et Edmontonus magni ponderis conciliare studeant.",2026-03-13 22:37:06+00:00
3be609fc0e8f7ee4586fe08d8ea3c31e,2026-03-07T19:38:02Z,'avalanche search',www.denverpost.com,en,0.2,Avalanche players react to Nazem Kadri’s return: “I love the guy”,The Colorado Avalanche celebrated more than just one of its best wins of the season Friday night.,https://www.denverpost.com/2026/03/07/avalanche-kadri-trade-reaction-mackinnon-landeskog/,https://www.denverpost.com/wp-content/uploads/2022/06/TDP-L-AVS-LIGHTNING-_AAO2724x.jpg?w=1024&h=702,,"DALLAS — The Colorado Avalanche celebrated more than just one of its best wins of the season Friday night.
Just a few hours before the Avs came back from two goals down to defeat the Dallas Stars at… [+3647 chars]",,Lawinenspieler reagieren auf die Rückkehr von Nazem Kadri: „Ich liebe den Kerl.“ Die Colorado Avalanche feierte am Freitagabend mehr als nur einen ihrer besten Saisonsiege.,Avalanche players react to Nazem Kadri’s return: “I love the guy”. The Colorado Avalanche celebrated more than just one of its best wins of the season Friday night.,"Avalanche lusores de reditu in Nazem Kadri reflectunt: ""Guido"". Colorado Avalanche celebratur plus quam unum ex optimis suis vicissitudines noctis Veneris.",2026-03-15 13:53:31+00:00
510bf6d9d3b408c70cd18a8d3d64cf50,2026-03-08T17:44:45Z,'avalanche search',www.denverpost.com,en,0.2,Avalanche captain Gabe Landeskog is out with a lower-body injury,"Just as a key member of the 2022 Stanley Cup champions returns to Denver, another will be out for a while.",https://www.denverpost.com/2026/03/08/avalanche-landeskog-injury-captain-kadri/,https://www.denverpost.com/wp-content/uploads/2026/01/tdp-z-refer-01.jpg?w=1024&h=683,,"Just as a key member of the 2022 Stanley Cup champions returns to Denver, another will be out for a while.
Avalanche captain Gabe Landeskog will not play Sunday afternoon against the Minnesota Wild … [+1160 chars]",,"Lawinenkapitän Gabe Landeskog fällt wegen einer Unterkörperverletzung aus. Gerade als ein Schlüsselspieler des Stanley-Cup-Meisters 2022 nach Denver zurückkehrt, wird ein anderer für eine Weile ausfallen.","Avalanche captain Gabe Landeskog is out with a lower-body injury. Just as a key member of the 2022 Stanley Cup champions returns to Denver, another will be out for a while.","Avalanche princeps Gabe Landeskog est cum inferiori corpore iniuriam. Quemadmodum praecipuum membrum 2022 Stanley Cup pugiles ad Denver redit, alius aliquandiu exibit.",2026-03-15 13:53:31+00:00
