index,published,keyword,domain,language,valid,title,description,url,image,archive,content,quote,de,en,la,added
08bac7e4c53966a15cce1fd2faf80c5f,2026-06-02T14:49:57Z,'avalanche warning system',consent.yahoo.com,en,0.2,Predators given permission to speak to Avalanche GM Chris MacFarland,The Predators have been granted permission to speak to Colorado Avalanche general manager Chris MacFarland.,https://consent.yahoo.com/v2/collectConsent?sessionId=1_cc-session_b378b6a9-828f-45ed-bf38-a93b84c1daad,,,"If you click 'Accept all', we and our partners, including 247 who are part of the IAB Transparency &amp; Consent Framework, will also store and / or access information on a device (in other words, us… [+1046 chars]",,"Predators erhielten die Erlaubnis, mit Avalanche GM Chris MacFarland zu sprechen. Den Predators wurde die Erlaubnis erteilt, mit Chris MacFarland, General Manager der Colorado Avalanche, zu sprechen.",Predators given permission to speak to Avalanche GM Chris MacFarland. The Predators have been granted permission to speak to Colorado Avalanche general manager Chris MacFarland.,"Predatores facultatem loquendi ad Avalanche GM Chris MacFarland dederunt. Colorado Avalanche, procurator generalis Chris MacFarland, datus est Predatoribus licentiam loquendi ad Colorados.",2026-06-03 18:03:25+00:00
8369cbfbf9c94c4bca49f3191ad4ac99,2026-06-02T15:44:51Z,'avalanche warning system',www.tennessean.com,en,0.2,Who is Chris MacFarland? Avalanche GM granted permission to speak to Predators,Colorado Avalanche general manager Chris MacFarland has been granted permission to speak to the Nashville Predators for their open GM position.,https://www.tennessean.com/story/sports/nhl/predators/2026/06/02/chris-macfarland-nashville-predators-colorado-avalanche-general-manager/90369230007/,https://s.yimg.com/ny/api/res/1.2/6Tg5JAL.W0UL2ftaUYkGNQ--/YXBwaWQ9aGlnaGxhbmRlcjt3PTEyMDA7aD04NDM7Y2Y9d2VicA--/https://media.zenfs.com/en/the_tennessean_natl_articles_921/d1b2ccfb39303730577aeaa4d1bb139d,,"The Nashville Predators have been granted permission to speak to Colorado Avalanche general manager Chris MacFarland, adding another name to their general manager search.
MacFarland has been the gen… [+2920 chars]",,"Wer ist Chris MacFarland? Avalanche GM hat die Erlaubnis erteilt, mit Predators zu sprechen. Chris MacFarland, General Manager der Colorado Avalanche, hat die Erlaubnis erhalten, mit den Nashville Predators über ihre offene GM-Position zu sprechen.",Who is Chris MacFarland? Avalanche GM granted permission to speak to Predators. Colorado Avalanche general manager Chris MacFarland has been granted permission to speak to the Nashville Predators for their open GM position.,Who is Chris MacFarland? NIVIS GM facultatem loquendi cum Predatoribus concessit. Colorado Avalanche procurator generalis Chris MacFarland facultatem loquendi cum Nashville Predatoribus pro patenti GM positionis concessit.,2026-06-03 18:03:25+00:00
5caac51f79a3295368b12444374d912f,2026-06-02T17:20:18Z,'avalanche warning system',www.tennessean.com,en,0.2,"Nashville Predators hire Chris MacFarland as president of hockey operations, GM",The Nashville Predators are hiring Chris MacFarland to be their president of hockey operations and general manager to replace Barry Trotz.,https://www.tennessean.com/story/sports/nhl/predators/2026/06/02/nashville-predators-chris-macfarland-general-manager-hockey-operations-colorado-avalanche/90273122007/,https://s.yimg.com/ny/api/res/1.2/KT1BMq6AJmj7MvoJszZNGA--/YXBwaWQ9aGlnaGxhbmRlcjt3PTEyMDA7aD04NDM7Y2Y9d2VicA--/https://media.zenfs.com/en/the-tennessean/d1b2ccfb39303730577aeaa4d1bb139d,,"The Nashville Predators are hiring Chris MacFarland to be their president of hockey operations and general manager, hiring him away from their Central Division rival Colorado Avalanche.
MacFarland, … [+2615 chars]",,"Die Nashville Predators verpflichten Chris MacFarland als President of Hockey Operations, GM. Die Nashville Predators stellen Chris MacFarland als President of Hockey Operations und General Manager ein, um Barry Trotz zu ersetzen.","Nashville Predators hire Chris MacFarland as president of hockey operations, GM. The Nashville Predators are hiring Chris MacFarland to be their president of hockey operations and general manager to replace Barry Trotz.","Nashville Predators conducere Chris MacFarland tamquam praesidens operationum hockey, GM. Praedatores Nashville conduxerunt Chris MacFarland ut eorum praeses operationum hockey et generalis procurator Barry Trotz reponeret.",2026-06-03 18:03:25+00:00
b231c16d5693fa3073c55baf5fcbb4f7,2026-06-02T18:00:08Z,'avalanche climate change',thehockeynews.com,en,0.2,Predators Land Chris MacFarland As Colorado Returns To Sakic At Helm,"Chris MacFarland is leaving the Colorado Avalanche after more than a decade with the organization to become president of hockey operations and general manager of the Nashville Predators, marking a significant front-office shift for both Western Conference clu…",https://thehockeynews.com/nhl/colorado-avalanche/latest-news/predators-land-chris-macfarland-as-colorado-returns-to-sakic-at-helm,https://s.yimg.com/ny/api/res/1.2/3lFg_NKuILjrA9K.5qzZSg--/YXBwaWQ9aGlnaGxhbmRlcjt3PTEyMDA7aD04MTQ7Y2Y9d2VicA--/https://media.zenfs.com/en/the_hockey_news_colorado_avalanche_articles_301/b82d8648710cf593fb1cce109555b943,,"Colorados front office is heading into a familiar-looking transition point, as Chris MacFarland moves on from the Avalanche after more than a decade with the organization to take over hockey operatio… [+3059 chars]",,"Predators landen Chris MacFarland, während Colorado zu Sakic an der Spitze zurückkehrt. Chris MacFarland verlässt die Colorado Avalanche nach mehr als einem Jahrzehnt bei der Organisation und wird Präsident des Eishockeybetriebs und General Manager der Nashville Predators.","Predators Land Chris MacFarland As Colorado Returns To Sakic At Helm. Chris MacFarland is leaving the Colorado Avalanche after more than a decade with the organization to become president of hockey operations and general manager of the Nashville Predators, marking a significant front-office shift for both Western Conference clu…","Predators Land Chris MacFarland As Colorado redit ad Sakic At Helm. Chris MacFarland discedit Colorado Avalanche post plus quam decennium cum ordinatione ad praeses operationum hockey et generalis Praedatorum Nashville factus, insignis mutationi ante-officii notans utriusque Conference Occidentis Clu…",2026-06-03 23:52:38+00:00
40f9c2d5d99b6e22a9f72fbfb958285f,2026-06-02T19:40:49Z,'avalanche search',www.usatoday.com,en,0.2,"Nashville Predators hire Chris MacFarland as president of hockey operations, GM",The Nashville Predators are hiring Chris MacFarland to be their president of hockey operations and general manager to replace Barry Trotz.,https://www.usatoday.com/story/sports/nhl/predators/2026/06/02/predators-hire-chris-macfarland-president-general-manager/90375565007/,https://s.yimg.com/ny/api/res/1.2/MiCggfW.WjypwtrxHMeGGQ--/YXBwaWQ9aGlnaGxhbmRlcjt3PTEyMDA7aD04NDM7Y2Y9d2VicA--/https://media.zenfs.com/en/usa_today_sports_articles_558/d1b2ccfb39303730577aeaa4d1bb139d,,"The Nashville Predators have hired Chris MacFarland to be their president of hockey operations and general manager, luring him away from their Central Division rival Colorado Avalanche.
MacFarland, … [+3185 chars]",,"Die Nashville Predators verpflichten Chris MacFarland als President of Hockey Operations, GM. Die Nashville Predators stellen Chris MacFarland als President of Hockey Operations und General Manager ein, um Barry Trotz zu ersetzen.","Nashville Predators hire Chris MacFarland as president of hockey operations, GM. The Nashville Predators are hiring Chris MacFarland to be their president of hockey operations and general manager to replace Barry Trotz.","Nashville Predators conducere Chris MacFarland tamquam praesidens operationum hockey, GM. Praedatores Nashville conduxerunt Chris MacFarland ut eorum praeses operationum hockey et generalis procurator Barry Trotz reponeret.",2026-06-03 23:52:38+00:00
21b3f2110fdbe158654146dfd724b076,2026-06-02T20:31:25Z,'avalanche climate change',thehockeynews.com,en,0.2,Predators Name Chris McFarland President Of Hockey Operations & General Manager,"Fresh off a successful tenure in Colorado, the veteran executive takes the reins in Nashville to navigate a pivotal offseason defined by roster restructuring and bold personnel moves.",https://thehockeynews.com/nhl/nashville-predators/latest-news/predators-name-chris-mcfarland-president-of-hockey-operations-general-manager,https://s.yimg.com/ny/api/res/1.2/LJzCqa0EV_ms6lYdY93_eA--/YXBwaWQ9aGlnaGxhbmRlcjt3PTEyMDA7aD04MDA7Y2Y9d2VicA--/https://media.zenfs.com/en/the_hockey_news_nashville_predators_articles_901/ac68aaa721c74a3b3ac5fed59442fcc2,,"The Nashville Predators have found their new general manager.
As my colleague Jack Williams alluded to in an earlier report, the Predators had permission to speak with Colorado Avalanche general man… [+3248 chars]",,"Predators ernennen Chris McFarland zum President of Hockey Operations und General Manager. Frisch nach einer erfolgreichen Amtszeit in Colorado übernimmt der erfahrene Manager in Nashville die Zügel, um eine entscheidende Nebensaison zu meistern, die von Kaderumstrukturierungen und mutigen Personalwechseln geprägt ist.","Predators Name Chris McFarland President Of Hockey Operations & General Manager. Fresh off a successful tenure in Colorado, the veteran executive takes the reins in Nashville to navigate a pivotal offseason defined by roster restructuring and bold personnel moves.","Predators Name Chris McFarland President Of Hockey Operations & Procurator Generalis. In Colorado recenti tenure prospero, veteranus exsecutivus habenas in Nashville accipit, ut offseason cardo navigandi definita per rostra reficiendi et audaces personas moveat.",2026-06-03 23:52:38+00:00
