index,published,keyword,domain,language,valid,title,description,url,image,archive,content,quote,de,en,la,added
b070dd2a80393d9fab3a7834b91db367,2026-04-04T22:29:45Z,'avalanche warning system',coloradohockeynow.com,en,0.2,"Postgame: Avalanche, Wedgewood Secure Impressive 2-0 Shutout In Dallas","One real goal separated the Avalanche from the Dallas Stars on Saturday. The Avs scored it with 9:21 remaining in […] The post Postgame: Avalanche, Wedgewood Secure Impressive 2-0 Shutout In Dallas appeared first on Colorado Hockey Now.",https://coloradohockeynow.com/postgame-avalanche-wedgwood-secure-impressive-2-0-shutout-in-dallas/,https://s.yimg.com/ny/api/res/1.2/2acGN0e54Oj1vvvwDzqzWg--/YXBwaWQ9aGlnaGxhbmRlcjt3PTEyMDA7aD04MDA7Y2Y9d2VicA--/https://media.zenfs.com/en/colorado_hockey_now_articles_612/c78a0551c8cc23f9f0b7228a3dc2dea9,,One real goal separated the Avalanche from the Dallas Stars on Saturday. The Avs scored it with 9:21 remaining in regulation before adding an empty netter on their way to an impressive 2-0 shutout vi… [+4027 chars],,"Nach dem Spiel: Avalanche und Wedgewood sichern sich in Dallas einen beeindruckenden 2:0-Shutout. Ein echtes Tor trennte die Avalanche am Samstag von den Dallas Stars. Die Avs punkteten 9:21 vor Schluss in […] Der Beitrag Nach dem Spiel: Avalanche, Wedgewood sichert sich beeindruckendes 2:0-Shutout in Dallas erschien zuerst auf Colorado Hockey Now.","Postgame: Avalanche, Wedgewood Secure Impressive 2-0 Shutout In Dallas. One real goal separated the Avalanche from the Dallas Stars on Saturday. The Avs scored it with 9:21 remaining in […] The post Postgame: Avalanche, Wedgewood Secure Impressive 2-0 Shutout In Dallas appeared first on Colorado Hockey Now.","Postgame: Avalanche, Wedgewood Secure Gravis 2-0 Shutout in Dallas. Una realis meta Avalanche a Dallas stellis die Saturni separavit. Avs illud laceratum cum 9:21 remanentibus in […] Post Postgame: Avalanche, Wedgewood Secure impressiva 2-0 Shutout In Dallas apparuit primum in Colorado Hockey Now.",2026-04-15 06:06:41+00:00
504cedaa5f193b62bd97d8cb9b448bc1,2026-04-08T04:19:22Z,'avalanche warning system',coloradohockeynow.com,en,0.2,10 Takeaways: One More Win Will Secure Presidents’ Trophy For Avalanche,The Avalanche secured the No. 1 seed in the Western Conference on Tuesday. One more win will officially clinch the […] The post 10 Takeaways: One More Win Will Secure Presidents’ Trophy For Avalanche appeared first on Colorado Hockey Now.,https://coloradohockeynow.com/10-takeaways-one-more-win-will-secure-presidents-trophy-for-avalanche/,https://s.yimg.com/ny/api/res/1.2/JaykcTrlzD1WX.Iy7Yn31g--/YXBwaWQ9aGlnaGxhbmRlcjt3PTEyMDA7aD04MDA7Y2Y9d2VicA--/https://media.zenfs.com/en/colorado_hockey_now_articles_612/2d2df6668c1f61ea276a970acd96842a,,The Avalanche secured the No. 1 seed in the Western Conference on Tuesday. One more win will officially clinch the Presidents Trophy and guaranteed home-ice advantage for the entirety of the Stanley … [+5106 chars],,10 Erkenntnisse: Ein weiterer Sieg sichert Avalanche die Präsidententrophäe. Die Avalanche sicherten sich am Dienstag den ersten Platz in der Western Conference. Ein weiterer Sieg sichert offiziell die […] Der Beitrag „10 Takeaways: Ein weiterer Sieg wird sich die Presidents‘ Trophy für Avalanche sichern“ erschien zuerst auf Colorado Hockey Now.,10 Takeaways: One More Win Will Secure Presidents’ Trophy For Avalanche. The Avalanche secured the No. 1 seed in the Western Conference on Tuesday. One more win will officially clinch the […] The post 10 Takeaways: One More Win Will Secure Presidents’ Trophy For Avalanche appeared first on Colorado Hockey Now.,10 Takeaways: One More Win will secure Presidents Trophy For Avalanche. NIVIS CASUS N. 1 semen in Occidentali Conferentia die Martis obtinuit. Unus plus vincet publice astringet […] Post 10 Takeaways: One More Win Will Secure Praesides Trophy For Avalanche visus primus in Colorado Hockey Now.,2026-04-15 06:06:41+00:00
4f19249c58b1e96eadf2ba650bd78222,2026-04-10T19:47:21Z,'avalanche warning system',sports.yahoo.com,en,0.2,Avalanche capture the Presidents' Trophy again. They're hoping to apply their Cup-chasing lessons,"The Colorado Avalanche realize history isn't exactly on their side and they're just fine with that. Fresh off winning the Presidents' Trophy, they now contend with this stat: Just eight teams since 1986 have earned the NHL's top overall seed and proceeded to …",https://sports.yahoo.com/articles/avalanche-capture-presidents-trophy-again-194721382.html,https://s.yimg.com/ny/api/res/1.2/p2gzDiqfK6fAtKZskjY8hA--/YXBwaWQ9aGlnaGxhbmRlcjt3PTEyMDA7aD04MDA7Y2Y9d2VicA--/https://media.zenfs.com/en/ap.org/bff57fa5b12fb041212962d8c361f449,,"DENVER (AP) The Colorado Avalanche realize history isn't exactly on their side and they're just fine with that.
Fresh off winning the Presidents' Trophy, they now contend with this stat: Just eight … [+3973 chars]",,"Avalanche holt sich erneut die Presidents' Trophy. Sie hoffen, ihre Lektionen aus der Pokaljagd anwenden zu können. Die Colorado Avalanche haben erkannt, dass die Geschichte nicht gerade auf ihrer Seite ist, und sie sind damit völlig einverstanden. Nachdem sie gerade die Presidents' Trophy gewonnen haben, müssen sie sich nun mit dieser Statistik zufrieden geben: Nur acht Teams haben sich seit 1986 den ersten Platz in der NHL-Gesamtwertung gesichert und …","Avalanche capture the Presidents' Trophy again. They're hoping to apply their Cup-chasing lessons. The Colorado Avalanche realize history isn't exactly on their side and they're just fine with that. Fresh off winning the Presidents' Trophy, they now contend with this stat: Just eight teams since 1986 have earned the NHL's top overall seed and proceeded to …",Avalanche iterum Trophaeum Praesidum ceperunt. Cupiunt lectiones suas ad Calicem persequendum applicare. Colorado Avalanche animadverto historiam non prorsus in parte eorum et iustus denique cum illo. Recentes conciliationis Praesidum Trophaeus nunc contendunt cum hoc statu: Octo iugis cum anno 1986 meruerunt NHL verticem altiore seminis ac ... processerunt.,2026-04-15 06:06:41+00:00
807847c465498d0f6ce25b11bc1518f3,2026-04-13T09:00:00Z,'avalanche warning system',www.propublica.org,en,0.3,Inside Trump’s Effort to “Take Over” the Midterm Elections,"When Trump tried to overturn the 2020 election, the institutional guardrails of American democracy held. But if faced with the same tests today, those barriers — and people who held the line — would largely be missing.",http://www.propublica.org/article/trump-midterm-elections-takeover,https://www.propublica.org/wp-content/uploads/2026/04/20260410-guardrails-opener-still.jpg?w=2000,,"<ul><li>Safeguards Destroyed: In advance of this years midterm elections, President Donald Trump has systematically demolished federal guardrails that prevented him from overturning the 2020 election… [+31831 chars]",,"Einblicke in Trumps Bemühungen, die Zwischenwahlen zu „übernehmen“. Als Trump versuchte, die Wahl 2020 zu stürzen, hielten die institutionellen Leitplanken der amerikanischen Demokratie stand. Aber wenn man sich heute denselben Prüfungen stellen müsste, würden diese Barrieren – und die Menschen, die die Linie aufrechterhielten – weitgehend fehlen.","Inside Trump’s Effort to “Take Over” the Midterm Elections. When Trump tried to overturn the 2020 election, the institutional guardrails of American democracy held. But if faced with the same tests today, those barriers — and people who held the line — would largely be missing.","Inside Trump conatus est ""Accipere"" electiones Midterm. Cum Trump electionem 2020 evertere conatus est, custodes institutionales democratiae Americanae tenuerunt. Sed, si hodie imminerent iisdem probationibus, claustra — et homines qui rectam tenebant — multum abessent.",2026-04-15 06:06:41+00:00
009801e105af0a2827245784ef1bce18,2026-04-14T05:03:47Z,'avalanche ski',sports.yahoo.com,en,0.7,Nathan MacKinnon scores in shootout as Avalanche top Oilers 2-1,Nathan MacKinnon scored the decisive goal in a shootout and the Colorado Avalanche beat the Edmonton Oilers 2-1 on Monday night. Sam Malinski scored in...,https://sports.yahoo.com/articles/nathan-mackinnon-scores-shootout-avalanche-050347858.html,https://s.yimg.com/ny/api/res/1.2/pM_Hgc20ovrj04_lKnVMTg--/YXBwaWQ9aGlnaGxhbmRlcjt3PTEyMDA7aD04MjM7Y2Y9d2VicA--/https://media.zenfs.com/en/ap.org/f2db6f60058e1d56731f97b4d7bf0824,,"EDMONTON, Alberta (AP) Nathan MacKinnon scored the decisive goal in a shootout and the Colorado Avalanche beat the Edmonton Oilers 2-1 on Monday night.
Sam Malinski scored in regulation for the NHL-… [+1454 chars]",,"Nathan MacKinnon punktet im Shootout, als die Avalanche die Oilers mit 2:1 anführen. Nathan MacKinnon erzielte das entscheidende Tor in einem Shootout und die Colorado Avalanche besiegten die Edmonton Oilers am Montagabend mit 2:1. Sam Malinski punktete in...",Nathan MacKinnon scores in shootout as Avalanche top Oilers 2-1. Nathan MacKinnon scored the decisive goal in a shootout and the Colorado Avalanche beat the Edmonton Oilers 2-1 on Monday night. Sam Malinski scored in...,Nathan MacKinnon scores in shootout as Avalanche top Oilers 2-1. Nathan MacKinnon finem decretorium in emissione laceravit et Colorado Avalanche Edmonton Oilers die 2-1 die Lunae nocte verberavit. Sam Malinski notatos in...,2026-04-15 06:06:41+00:00
c70defc22b21c6241f76483815ea0ec4,2026-04-03T15:43:38Z,'avalanche mountain',sports.yahoo.com,en,0.2,"At 41, defenseman Brent Burns set for 1,000th straight regular-season game as the Avs chase top seed","Brent Burns took a wayward stick to the face while playing for San Jose in October 2013 that ended up costing him teeth and time on the ice. Burns, now 41 years old and with the Colorado Avalanche, is set to play in his 1,000th straight regular-season game Sa…",https://sports.yahoo.com/articles/41-defenseman-brent-burns-set-154338280.html,https://s.yimg.com/ny/api/res/1.2/u9Rezn5NH.2_rdNZMwYgtQ--/YXBwaWQ9aGlnaGxhbmRlcjt3PTEyMDA7aD04MDA7Y2Y9d2VicA--/https://media.zenfs.com/en/ap.org/d8fad0afe192c6a872ebe244027971b0,,"DENVER (AP) Brent Burns took a wayward stick to the face while playing for San Jose in October 2013 that ended up costing him teeth and time on the ice.
Since his return Nov. 21, 2013, to be precise… [+4345 chars]",,"Mit 41 Jahren bereitet sich Verteidiger Brent Burns auf das 1.000. Spiel in Folge in der regulären Saison vor, während die Avs auf der Jagd nach dem Topgesetzten sind. Brent Burns erlitt im Oktober 2013 während seines Spiels für San Jose einen eigensinnigen Stockschlag im Gesicht, der ihn Zähne und Zeit auf dem Eis kostete. Burns, jetzt 41 Jahre alt und bei den Colorado Avalanche, wird voraussichtlich sein 1.000. Spiel in Folge in der regulären Saison bestreiten …","At 41, defenseman Brent Burns set for 1,000th straight regular-season game as the Avs chase top seed. Brent Burns took a wayward stick to the face while playing for San Jose in October 2013 that ended up costing him teeth and time on the ice. Burns, now 41 years old and with the Colorado Avalanche, is set to play in his 1,000th straight regular-season game Sa…","Ad 41, defensionis Brent Burns pro 1,000th recta temporum regularium venatus ut Avs summo semine insequitur. Brent Burns baculum devium ad faciem accepit dum ludens pro San Jose mense Octobre 2013 quod finivit eum dentes et tempus in glacie mercatus est. Ardet iam 41 annos natus et cum Colorado Avalanche, ludo suo 1,000th recta temporum regularium ludorum Sa…",2026-04-16 06:09:19+00:00
e438445a9bfd90482122b779e7dfdb4d,2026-04-03T16:14:57Z,'avalanche missing',www.nbcsports.com,en,0.7,"At 41, defenseman Brent Burns set for 1,000th straight regular-season game as the Avalanche chase top seed","Brent Burns, who turned 41 on March 9, joined the Avalanche on a one-year deal this season to chase the only thing missing from his résumé — a Stanley Cup title.",https://www.nbcsports.com/nhl/news/at-41-defenseman-brent-burns-set-for-1-000th-straight-regular-season-game-as-the-avalanche-chase-top-seed,https://s.yimg.com/ny/api/res/1.2/DKJ9eXOCEKdFQ_sDwc40gA--/YXBwaWQ9aGlnaGxhbmRlcjt3PTEyMDA7aD02NzU7Y2Y9d2VicA--/https://media.zenfs.com/en/nbcsports.com/0752c2bbaa7f9db1cb049c2b8889b7ce,,"DENVER Brent Burns took a wayward stick to the face while playing for San Jose in October 2013 that ended up costing him teeth and time on the ice.
Since his return Nov. 21, 2013, to be precise hes … [+4263 chars]",,"Mit 41 Jahren bereitet sich Verteidiger Brent Burns auf das 1.000ste Spiel in Folge in der regulären Saison vor, während die Avalanche auf der Jagd nach dem Topgesetzten sind. Brent Burns, der am 9. März 41 Jahre alt wurde, schloss sich in dieser Saison einem Einjahresvertrag mit den Avalanche an, um das Einzige zu verfolgen, was in seinem Lebenslauf noch fehlte – einen Stanley-Cup-Titel.","At 41, defenseman Brent Burns set for 1,000th straight regular-season game as the Avalanche chase top seed. Brent Burns, who turned 41 on March 9, joined the Avalanche on a one-year deal this season to chase the only thing missing from his résumé — a Stanley Cup title.","Ad 41, defensus Brent Burns positus pro 1,000th recta temporum regularium venatus ut NIVIS VENANTI vertice semen. Brent Burns, qui 41 die Martii 9 conversus est, Avalanche in uno anno hoc tempore multum coniunxit, ut solus res demissas a suo repeteret — titulo Stanley Cup.",2026-04-16 06:09:19+00:00
a4cf54f88025f673de0f9e1cb100d571,2026-04-05T03:43:59Z,'avalanche search',consent.yahoo.com,en,0.2,Avalanche beat Stars 2-0 to extend their edge in the Central Division race,"Martin Necas broke a scoreless tie midway through the third period, Nathan MacKinnon added an empty-netter and the NHL-leading Colorado Avalanche took a big step toward home-ice advantage throughout the playoffs with a 2-0 victory over the Dallas Stars on Sat…",https://consent.yahoo.com/v2/collectConsent?sessionId=1_cc-session_9b13b54b-7c21-40d6-a793-3517f0b87a90,,,"If you click 'Accept all', we and our partners, including 251 who are part of the IAB Transparency &amp; Consent Framework, will also store and / or access information on a device (in other words, us… [+1046 chars]",,"Avalanche besiegte Stars mit 2:0 und baute seinen Vorsprung im Rennen um die Central Division aus. Martin Necas sorgte in der Mitte des dritten Drittels für ein torloses Unentschieden, Nathan MacKinnon erzielte einen leeren Treffer und die NHL-Spitzenreiter Colorado Avalanche machten in den Playoffs mit einem 2:0-Sieg über die Dallas Stars am Samstag einen großen Schritt in Richtung Heimvorteil.","Avalanche beat Stars 2-0 to extend their edge in the Central Division race. Martin Necas broke a scoreless tie midway through the third period, Nathan MacKinnon added an empty-netter and the NHL-leading Colorado Avalanche took a big step toward home-ice advantage throughout the playoffs with a 2-0 victory over the Dallas Stars on Sat…","NIVIS CASUS stellas 2-0 percutere ut aciem suam extendere in stadio Mediae Divisionis. Martin Necas ligaturam inhonestam fregit per tertiam periodum, Nathan MacKinnon nettem inanem adiunxit et NHL Colorado Avalanche magnum gradum ad glaciem domesticam per commodum per ludos sumpsit cum 2-0 victoria de Dallas stellis in Sat...",2026-04-16 15:03:40+00:00
0aeb314df1e6b2993d98e4a2a8dbf6d6,2026-04-05T13:00:00Z,'avalanche search',consent.yahoo.com,en,0.2,Deen’s Daily: Preds Retake Playoff Spot; Eastern Wildcard Update; Avs Playoff Preview?,The Avalanche defeated the Dallas Stars to take a slight edge in the season series. Will they meet again in […] The post Deen’s Daily: Preds Retake Playoff Spot; Eastern Wildcard Update; Avs Playoff Preview? appeared first on Colorado Hockey Now.,https://consent.yahoo.com/v2/collectConsent?sessionId=1_cc-session_c3989ff6-0931-4e33-b6b4-9d98abc5ed5a,,,"If you click 'Accept all', we and our partners, including 251 who are part of the IAB Transparency &amp; Consent Framework, will also store and / or access information on a device (in other words, us… [+1046 chars]",,Deen’s Daily: Preds erobern Playoff-Platz zurück; Eastern Wildcard-Update; Avs Playoff-Vorschau?. Die Avalanche besiegten die Dallas Stars und sicherten sich in der Saisonserie einen leichten Vorsprung. Werden sie sich in […] wiedersehen? Der Beitrag Deen’s Daily: Preds erobern sich den Playoff-Platz zurück; Eastern Wildcard-Update; Avs Playoff-Vorschau? erschien zuerst auf Colorado Hockey Now.,Deen’s Daily: Preds Retake Playoff Spot; Eastern Wildcard Update; Avs Playoff Preview?. The Avalanche defeated the Dallas Stars to take a slight edge in the season series. Will they meet again in […] The post Deen’s Daily: Preds Retake Playoff Spot; Eastern Wildcard Update; Avs Playoff Preview? appeared first on Colorado Hockey Now.,Cotidie Deen: Preds Retake Playoff Macula; Eastern Wildcard Updates; Avs Playoff Preview?. Avalanche vicit Dallas Stellas ut parvam aciem in temporum serie acciperet. Iterum conveniant in […] Cotidie post Deen: Preds Retake Playoff Macula; Eastern Wildcard Updates; Avs Playoff Praevius? apparuit primum in Colorado Hockey Now.,2026-04-16 15:03:40+00:00
f4c372d2363843fe6ebbee0f464fd555,2026-04-05T14:15:37Z,'avalanche search',consent.yahoo.com,en,0.2,Avalanche Aim to Extend Dominance Over Blues in Central Division Clash,"Fresh off their 50th win of the season, the Avalanche return home to face the Blues while looking to build on momentum, tighten up defensively, and maintain their edge in this Central Division matchup.",https://consent.yahoo.com/v2/collectConsent?sessionId=1_cc-session_1092b9b3-c7eb-4566-9cd6-83060c9b5f2d,,,"If you click 'Accept all', we and our partners, including 251 who are part of the IAB Transparency &amp; Consent Framework, will also store and / or access information on a device (in other words, us… [+1046 chars]",,"Avalanche zielt darauf ab, die Dominanz über die Blues im Aufeinandertreffen der Central Division auszubauen. Frisch nach ihrem 50. Saisonsieg kehren die Avalanche nach Hause zurück, um gegen die Blues anzutreten, und versuchen dabei, die Dynamik auszubauen, die Defensive zu verstärken und ihren Vorsprung in diesem Spiel in der Central Division zu behaupten.","Avalanche Aim to Extend Dominance Over Blues in Central Division Clash. Fresh off their 50th win of the season, the Avalanche return home to face the Blues while looking to build on momentum, tighten up defensively, and maintain their edge in this Central Division matchup.","NIVIS que intendere dominandi Per Chorus in Central Division Clash. Recentes 50 temporis sui vicissitudinem, Avalanche domum redeunt obviam Venetae dum momentum aedificare spectantes, defensione obstringunt, suumque marginem in hac Media Division matchup tenent.",2026-04-16 15:03:40+00:00
53d4ac3dc69203b8092f8c3588af9988,2026-04-07T23:11:41Z,'avalanche search',consent.yahoo.com,en,0.2,"Avalanche Clinch Central Division With 3–1 Win Over Blues, Lock Up No. 1 Seed in West","The Colorado Avalanche clinched the Central Division and the Western Conference’s top seed with a 3–1 win over the St. Louis Blues, powered by Valeri Nichushkin’s two-goal performance and setting up a first-round matchup against the Los Angeles Kings if the s…",https://consent.yahoo.com/v2/collectConsent?sessionId=1_cc-session_b92cfadd-a37c-417e-bada-4f0534c751e3,,,"If you click 'Accept all', we and our partners, including 251 who are part of the IAB Transparency &amp; Consent Framework, will also store and / or access information on a device (in other words, us… [+1046 chars]",,"Avalanche gewinnt die Central Division mit einem 3:1-Sieg über die Blues und sichert sich die Nummer 1 im Westen. Die Colorado Avalanche sicherten sich mit einem 3:1-Sieg über die St. Louis Blues, angetrieben von Valeri Nichushkins Zwei-Tore-Leistung, die Central Division und den Spitzenplatz der Western Conference und bereiteten ein Erstrunden-Duell gegen die Los Angeles Kings vor, wenn die …","Avalanche Clinch Central Division With 3–1 Win Over Blues, Lock Up No. 1 Seed in West. The Colorado Avalanche clinched the Central Division and the Western Conference’s top seed with a 3–1 win over the St. Louis Blues, powered by Valeri Nichushkin’s two-goal performance and setting up a first-round matchup against the Los Angeles Kings if the s…","Avalanche Clinch Central Division Cum 3-1 Over Blues, Obfirmo N. 1 Semen in Occidente. Colorado Avalanche conpressit in Division Centralis et Conferentiae occidentalis semen summo cum 3-1 S. Louis Blues, vis Valeri Nichushkin in duos finis effectus et primum rotundum contra Los Angeles Kings si s…",2026-04-16 15:03:40+00:00
2a377a4af4a408940889fa4ddaf0c338,2026-04-10T03:52:22Z,'avalanche search',consent.yahoo.com,en,0.2,"MacKinnon scores career-high 52nd goal of season, Avs clinch NHL's top seed with 3-1 win over Flames",Nathan MacKinnon scored his career-high 52nd goal of the season into an empty net and had two assists to help the Colorado Avalanche clinch the NHL's top seed for the postseason with a 3-1 win over the Calgary Flames on Thursday night. It’s the fourth time Co…,https://consent.yahoo.com/v2/collectConsent?sessionId=1_cc-session_de28ea40-2565-4e49-add6-2c613b7c3eeb,,,"If you click 'Accept all', we and our partners, including 251 who are part of the IAB Transparency &amp; Consent Framework, will also store and / or access information on a device (in other words, us… [+1046 chars]",,"MacKinnon erzielt sein karrierebestes 52. Saisontor, die Avs holen sich mit einem 3:1-Sieg über die Flames den ersten Platz in der NHL. Nathan MacKinnon erzielte sein karrierebestes 52. Saisontor ins leere Tor und verhalf den Colorado Avalanche mit zwei Assists dazu, sich mit einem 3:1-Sieg über die Calgary Flames am Donnerstagabend den ersten Platz der NHL für die Nachsaison zu sichern. Es ist das vierte Mal, dass Co…","MacKinnon scores career-high 52nd goal of season, Avs clinch NHL's top seed with 3-1 win over Flames. Nathan MacKinnon scored his career-high 52nd goal of the season into an empty net and had two assists to help the Colorado Avalanche clinch the NHL's top seed for the postseason with a 3-1 win over the Calgary Flames on Thursday night. It’s the fourth time Co…","MacKinnon pereuntis curriculi altae 52 finis temporis, Avs clinch NHL summum semen cum 3-1 Servio conciliandum est. Nathan MacKinnon notatos curriculo altos 52 finis temporum in rete inanem et duo adiuvat ad adiuvandum Colorado Avalanche in capite NHL semen summo pro cursorio cum 3-1 vinculo Calgary Flammae die Iovis nocte. Quarto tempore est Co…",2026-04-16 15:03:40+00:00
d1c75626cd66295670e8f177c9b73ba7,2026-04-12T03:05:15Z,'avalanche search',consent.yahoo.com,en,0.2,Golden Knights Clinch Playoff Berth With 3-2 Overtime Win Against Avalanche,The Vegas Golden Knights have punched their ticket to the 2026 Stanley Cup Playoffs. Vegas secured its postseason berth with […],https://consent.yahoo.com/v2/collectConsent?sessionId=1_cc-session_29efda32-5110-49d2-b76d-7ba7cb3b2618,,,"If you click 'Accept all', we and our partners, including 251 who are part of the IAB Transparency &amp; Consent Framework, will also store and / or access information on a device (in other words, us… [+1046 chars]",,Golden Knights sichern sich mit 3:2-Sieg in der Verlängerung gegen Avalanche den Platz in den Playoffs. Die Vegas Golden Knights haben ihr Ticket für die Stanley Cup Playoffs 2026 gelöst. Vegas sicherte sich seinen Postseason-Platz mit […],Golden Knights Clinch Playoff Berth With 3-2 Overtime Win Against Avalanche. The Vegas Golden Knights have punched their ticket to the 2026 Stanley Cup Playoffs. Vegas secured its postseason berth with […],Aurea equitum Clinch Playoff Berth Cum 3-2 Overtime Vincere contra NIVIS. Vegas Aurei Equites tesseram suam impugnarunt ad 2026 Stanley Calicem Playoffs. Vegas suum conquisitum MUNUS cum […],2026-04-16 15:03:40+00:00
8eea54fd8124567864b606b1faa84ded,2026-04-12T03:18:13Z,'avalanche search',consent.yahoo.com,en,0.2,"Eichel scores in OT, Knights clinch playoff berth with 3-2 win over Avs","Jack Eichel scored 1:19 into overtime, and the Vegas Golden Knights beat the Colorado Avalanche 3-2 on Saturday night to secure a playoff berth. Vegas (91 points) took over the Pacific Division lead from Edmonton with its fifth win in six games since coach Jo…",https://consent.yahoo.com/v2/collectConsent?sessionId=1_cc-session_b7749253-11df-4322-a0c6-b5c0c93c4e13,,,"If you click 'Accept all', we and our partners, including 251 who are part of the IAB Transparency &amp; Consent Framework, will also store and / or access information on a device (in other words, us… [+1046 chars]",,"Eichel punktet im OT, Knights sichern sich mit 3:2-Sieg über Avs den Playoff-Platz. Jack Eichel erzielte in der Verlängerung ein Tor von 1:19 und die Vegas Golden Knights besiegten die Colorado Avalanche am Samstagabend mit 3:2 und sicherten sich einen Platz in den Playoffs. Vegas (91 Punkte) übernahm die Führung der Pacific Division von Edmonton mit seinem fünften Sieg in sechs Spielen seit Trainer Jo…","Eichel scores in OT, Knights clinch playoff berth with 3-2 win over Avs. Jack Eichel scored 1:19 into overtime, and the Vegas Golden Knights beat the Colorado Avalanche 3-2 on Saturday night to secure a playoff berth. Vegas (91 points) took over the Pacific Division lead from Edmonton with its fifth win in six games since coach Jo…","Eichel ustulo in OT, Equites astringunt playoffs MUNUS cum 3-2 conciliandis Avs. Jack Eichel notatos 1:19 in tempus subsicivum, et Vegas Aurei Equites Colorado Avalanche die 3-2 nocte Sabbati ad ludum berth conciliandum verberaverunt. Vegas (91 puncta) per plumbum ab Edmonton cum quinta sua in sex ludis cum raeda Jo.",2026-04-16 15:03:40+00:00
