index,published,keyword,domain,language,valid,title,description,url,image,archive,content,quote,de,en,la,added
bd3917482b383f6bcab39a1c10bf1436,2026-07-04T19:22:51Z,'avalanche search',consent.yahoo.com,en,0.2,Why Nick Blankenburg Could Be Headed Back to Nashville After Brief Avalanche Stint,Nick Blankenburg’s brief stint with the Colorado Avalanche could already be leading back to familiar ground in Nashville as free agency approaches.,https://consent.yahoo.com/v2/collectConsent?sessionId=1_cc-session_bd1d39ac-be77-47f0-86c7-e99e65ddceb4,,,"If you click 'Accept all', we and our partners, including 249 who are part of the IAB Transparency &amp; Consent Framework, will also store and / or access information on a device (in other words, us… [+1046 chars]",,"Warum Nick Blankenburg nach einem kurzen Lawinenaufenthalt nach Nashville zurückkehren könnte. Nick Blankenburgs kurze Zeit bei der Colorado Avalanche könnte in Nashville bereits zu vertrautem Terrain führen, während die Free Agency näher rückt.",Why Nick Blankenburg Could Be Headed Back to Nashville After Brief Avalanche Stint. Nick Blankenburg’s brief stint with the Colorado Avalanche could already be leading back to familiar ground in Nashville as free agency approaches.,Quare Nick Blankenburg potuit reverti ad Nashville post brevem NIVIS Stint. Nick Blankenburgius brevem notam cum Colorado Avalanche iam reducere potuit ad familiarem terram Nashville ut liberum accessum procurationis.,2026-07-10 23:06:37+00:00
cfaf25bea5a7ff16f9d7bab2783dc0c2,2026-07-05T00:47:28Z,'avalanche snow',consent.yahoo.com,en,0.2,"Avalanche Sign Veteran Defenseman Christian Wolanin To One-Year, Two-Way Deal","The Colorado Avalanche added veteran defenseman Christian Wolanin on a one-year, two-way contract as he continues to push for another NHL opportunity.",https://consent.yahoo.com/v2/collectConsent?sessionId=1_cc-session_a36a99e2-51ca-4ea2-be94-3b81b9db0bc6,,,"If you click 'Accept all', we and our partners, including 249 who are part of the IAB Transparency &amp; Consent Framework, will also store and / or access information on a device (in other words, us… [+1046 chars]",,"Avalanche verpflichtet den erfahrenen Verteidiger Christian Wolanin zu einem Einjahresvertrag in beide Richtungen. Die Colorado Avalanche haben den erfahrenen Verteidiger Christian Wolanin mit einem Zweijahresvertrag für ein Jahr verpflichtet, während er weiterhin auf eine weitere NHL-Chance drängt.","Avalanche Sign Veteran Defenseman Christian Wolanin To One-Year, Two-Way Deal. The Colorado Avalanche added veteran defenseman Christian Wolanin on a one-year, two-way contract as he continues to push for another NHL opportunity.","Avalanche Sign Veterani Defenseman Christian Wolanin Ad unum annum, Duo-via Fac. The Colorado Avalanche addidit veteranum defensoris Christiani Wolanin in unum annum, duos modos contractus, dum pergit occasionem NHL impellere ad aliam.",2026-07-10 23:06:37+00:00
a275c8e9b70f23b2b1b90f6ef8770fac,2026-07-06T12:00:00Z,'avalanche snow',consent.yahoo.com,en,0.2,Weekly Cupcakes: Wolanin joins the Avalanche organization,"Colorado Avalanche News Christian Wolanin has followed in his father’s footsteps to Denver, seeking a roster spot with the Avalanche after a long journey through the AHL. [The Hockey News] The Colorado Avalanche Hockey Club announced today the team has signed…",https://consent.yahoo.com/v2/collectConsent?sessionId=1_cc-session_a0124de9-4905-43d0-ab3c-938da9163cd9,,,"If you click 'Accept all', we and our partners, including 249 who are part of the IAB Transparency &amp; Consent Framework, will also store and / or access information on a device (in other words, us… [+1046 chars]",,"Wöchentliche Cupcakes: Wolanin tritt der Avalanche-Organisation bei. Colorado Avalanche News Christian Wolanin ist in die Fußstapfen seines Vaters getreten und nach Denver gegangen, um nach einer langen Reise durch die AHL einen Kaderplatz bei den Avalanche zu suchen. [The Hockey News] Der Colorado Avalanche Hockey Club gab heute bekannt, dass das Team…","Weekly Cupcakes: Wolanin joins the Avalanche organization. Colorado Avalanche News Christian Wolanin has followed in his father’s footsteps to Denver, seeking a roster spot with the Avalanche after a long journey through the AHL. [The Hockey News] The Colorado Avalanche Hockey Club announced today the team has signed…","Weekly Cupcakes: Wolanin iungit NIVIS ordinationem. Colorado Avalanche News Christianus Wolanin vestigia patris in Denver secutus est, rostri loco cum Avalanche post longum iter AHL quaerens. [Hockey Nuntii] The Colorado Avalanche Hockey Club nuntiavit hodie turmas signavit…",2026-07-10 23:06:37+00:00
b94ae8debf25d14f2b594dc113dd736e,2026-07-06T16:36:01Z,'avalanche snow',cryptobriefing.com,en,0.2,AVAX One launches CEO search after resignation of interim leader Jolie Kahn,"The CEO search could impact AVAX One's strategic direction and investor confidence amid existing financial challenges and market volatility.
The post AVAX One launches CEO search after resignation of interim leader Jolie Kahn appeared first on Crypto Briefing.",https://cryptobriefing.com/avax-one-ceo-search-kahn-resignation/,https://static.cryptobriefing.com/wp-content/uploads/2026/07/06123553/jolie-kahn-800x420.jpeg,,"The Avalanche-focused treasury company taps executive search firm ZRG Partners to find a permanent replacement while COO Pete Wylie holds down the fort AVAX One Technology, the NASDAQ-listed company … [+2184 chars]",,"AVAX One startet CEO-Suche nach Rücktritt der Interimsleiterin Jolie Kahn. Die Suche nach einem CEO könnte sich angesichts bestehender finanzieller Herausforderungen und Marktvolatilität auf die strategische Ausrichtung und das Vertrauen der Anleger von AVAX One auswirken.
Der Beitrag AVAX One startet CEO-Suche nach dem Rücktritt der Interimsleiterin Jolie Kahn erschien zuerst auf Crypto Briefing.","AVAX One launches CEO search after resignation of interim leader Jolie Kahn. The CEO search could impact AVAX One's strategic direction and investor confidence amid existing financial challenges and market volatility.
The post AVAX One launches CEO search after resignation of interim leader Jolie Kahn appeared first on Crypto Briefing.","AVAX One movet CEO inquisitionem post renuntiationem ducis Jolie Kahn interim. Inquisitionis CEO potuit infringere AVAX One opportuna directio et investor fiduciae inter provocationes nummarias et mercatus LEVITAS.
Post AVAX unus investigationem movet CEO post renuntiationem ducis interim Jolie Kahn in Crypto Briefing primus apparuit.",2026-07-10 23:06:37+00:00
166f6c9a32031d139db732aa078dd087,2026-07-02T03:01:28Z,'avalanche snow',www.dailymail.com,en,0.3,Bitter polar blast to freeze millions of Aussies with snow dumps finally expected on our barren ski fields,A strong cold front lurking over the Great Australian Bight is surging towards Tasmania and the south-east mainland,https://www.dailymail.com/news/article-15946411/winter-blast-australia-cold-tasmania-snow-temperatures-sydney-melbourne.html,https://i.dailymail.com/1s/2026/07/02/02/109736145-0-image-a-13_1782956394054.jpg,http://web.archive.org/web/20260702035241/https://www.dailymail.com/news/article-15946411/winter-blast-australia-cold-tasmania-snow-temperatures-sydney-melbourne.html,"Millions of Aussies are urged to rug up as a chilly winter blast sweeps across the nation this weekend, bringing freezing temperatures and snow.
Australia's south-east will feel the brunt of the con… [+5258 chars]",,"Eine heftige Polarexplosion lässt Millionen von Australiern erfrieren, und auf unseren kargen Skigebieten sind endlich Schneehaufen zu erwarten. Eine starke Kaltfront, die über der Großen Australischen Bucht lauert, drängt auf Tasmanien und das südöstliche Festland zu",Bitter polar blast to freeze millions of Aussies with snow dumps finally expected on our barren ski fields. A strong cold front lurking over the Great Australian Bight is surging towards Tasmania and the south-east mainland,Aussiae decies centena millia nivibus eri ad durandum amarum polarium exspectatur tandem in campis nostris sterilibus ski. Frons frigoris fortis latens in Magno Australiae Bight surgit ad Tasmaniam et continentem meridiem-orientalem.,2026-07-10 23:06:37+00:00
809f53860e37e522a8780c4d2f8b503b,2026-07-05T16:05:34Z,'avalanche search',post.rlsbb.cc,en,0.3,Horn and Ivory 2023 1080p WEB H264-AFO,"Awards 6 wins & 3 nominations total See more awards » Plot: Ambitions, dreams and hope shape one's future in accordance with resources, efforts and perspectives. But when the alignment fails between them, an avalanche of unpredictable and fatal scenarios sets…",https://post.rlsbb.cc/horn-and-ivory-2023-1080p-web-h264-afo/,,,"Awards 6 wins &amp; 3 nominations total See more awards »
Plot: Ambitions, dreams and hope shape one’s future in accordance with resources, efforts and perspectives. But when the alignment fails bet… [+1587 chars]",,"Horn und Elfenbein 2023 1080p WEB H264-AFO. Auszeichnungen Insgesamt 6 Siege und 3 Nominierungen. Weitere Auszeichnungen anzeigen » Handlung: Ambitionen, Träume und Hoffnung prägen die Zukunft eines Menschen im Einklang mit Ressourcen, Bemühungen und Perspektiven. Doch als die Übereinstimmung zwischen ihnen scheitert, bricht eine Lawine unvorhersehbarer und fataler Szenarien los ...","Horn and Ivory 2023 1080p WEB H264-AFO. Awards 6 wins & 3 nominations total See more awards » Plot: Ambitions, dreams and hope shape one's future in accordance with resources, efforts and perspectives. But when the alignment fails between them, an avalanche of unpredictable and fatal scenarios sets…","Horn and Ebur 2023 1080p VUL H264-AFO. Praemia 6 conciliat & 3 nominationes totales Vide plura praemia » Plot: Ambitiones, somnia et spes unum futurum secundum facultates, conatus et prospectus. Sed cum noctis inter eos deficit, NIVIS CASUS in inaestimabile ac funestum missiones ponit….",2026-07-10 23:06:37+00:00
53ceb2b02d27510f5f1c42b03fca0ffd,2026-07-05T16:32:06Z,'avalanche snow',post.rlsbb.to,en,0.3,Horn and Ivory 2023 1080p WEB H264-AFO,"Awards 6 wins & 3 nominations total See more awards »Plot: Ambitions, dreams and hope shape one’s future in accordance with resources, efforts and perspectives. But when the alignment fails between them, an avalanche of unpredictable and fatal scenarios sets …",https://post.rlsbb.to/horn-and-ivory-2023-1080p-web-h264-afo/,,,"Awards 6 wins &amp; 3 nominations total See more awards »
Plot: Ambitions, dreams and hope shape one’s future in accordance with resources, efforts and perspectives. But when the alignment fails bet… [+2033 chars]",,"Horn und Elfenbein 2023 1080p WEB H264-AFO. Auszeichnungen: 6 Siege und 3 Nominierungen insgesamt Weitere Auszeichnungen » Handlung: Ambitionen, Träume und Hoffnung prägen die Zukunft eines Menschen im Einklang mit Ressourcen, Bemühungen und Perspektiven. Doch als die Übereinstimmung zwischen ihnen scheitert, bricht eine Lawine unvorhersehbarer und fataler Szenarien los …","Horn and Ivory 2023 1080p WEB H264-AFO. Awards 6 wins & 3 nominations total See more awards »Plot: Ambitions, dreams and hope shape one’s future in accordance with resources, efforts and perspectives. But when the alignment fails between them, an avalanche of unpredictable and fatal scenarios sets …","Horn and Ebur 2023 1080p VUL H264-AFO. Praemia 6 conciliat & 3 nominationes totales Vide plura praemia » Plot: Ambitiones, somnia et spes unum futurum secundum facultates, conatus et prospectus. Sed cum noctis inter eos deficit, NIVIS CASUS in inaestimabile ac funestum missiones ponit...",2026-07-10 23:06:37+00:00
da73ff7599f16785eca1974dc46d7223,2026-07-06T03:57:37Z,'avalanche snow',www.artsjournal.com,en,0.3,American Classical Music at 250 – Take Two: The BAM Experiment,I am still processing an avalanche of responses to my New York Times piece on the state of American classical music 250 years in. I’m particularly grateful to readers who wrote to remember the Brooklyn Philharmonic festivals during my 1990s tenure as the orch…,https://www.artsjournal.com/uq/2026/07/american-classical-music-at-250-take-two-the-bam-experiment.html,http://img.youtube.com/vi/PocpiBx3hfk/0.jpg,http://web.archive.org/web/20260707141136/https://www.artsjournal.com/uq/2026/07/american-classical-music-at-250-take-two-the-bam-experiment.html,"The “New World” Symphony visual presentation created by Peter Bogdanoff for the Brooklyn Philharmonic’s 1994 Dvorak festival. Building on research by Michael Beckerman, it extrapolates the influence … [+37046 chars]",,"Amerikanische klassische Musik bei 250 – Take Two: Das BAM-Experiment. Ich verarbeite immer noch eine Lawine von Antworten auf meinen Artikel in der New York Times über den Zustand der amerikanischen klassischen Musik nach 250 Jahren. Ich bin besonders dankbar für die Leser, die geschrieben haben, um an die Brooklyn Philharmonic-Festivals während meiner Amtszeit als Orchester in den 1990er-Jahren zu erinnern …",American Classical Music at 250 – Take Two: The BAM Experiment. I am still processing an avalanche of responses to my New York Times piece on the state of American classical music 250 years in. I’m particularly grateful to readers who wrote to remember the Brooklyn Philharmonic festivals during my 1990s tenure as the orch…,"American Classical Music at 250 – Take Two: The BAM Experiment. Adhuc cadentem avalanche responsionum meis Novi Eboraci Times nummum in statu musicorum classicorum Americanorum CCL annorum in. Imprimis gratus sum legentibus, qui meminisse festivitates Philharmonicae Brooklyn in mea 1990 tenure sicut orch…",2026-07-10 23:06:37+00:00
f13a38fcb41ee583502973383bed6744,2026-07-06T16:38:37Z,'avalanche search',biztoc.com,en,0.7,AVAX One launches CEO search after leader of its Avalanche treasury pivot steps down,"AVAX One launches CEO search after leader of its Avalanche treasury pivot steps down
Quick Take
- SkyBridge founder Anthony Scaramucci backed AVAX One’s $550 million Avalanche treasury strategy announced last year.
- Avalanche prices are back to levels seen a…",https://biztoc.com/x/0f635c6e27079085,https://biztoc.com/cdn/0f635c6e27079085_s.webp,,AVAX One launches CEO search after leader of its Avalanche treasury pivot steps downQuick Take- SkyBridge founder Anthony Scaramucci backed AVAX Ones $550 million Avalanche treasury strategy announce… [+142 chars],,"AVAX One startet die Suche nach einem CEO, nachdem der Leiter seines Avalanche-Treasury-Pivots zurückgetreten ist. AVAX One startet die Suche nach einem CEO, nachdem der Leiter seines Avalanche-Treasury-Pivots zurückgetreten ist
Schnelle Aufnahme
- SkyBridge-Gründer Anthony Scaramucci unterstützte die im letzten Jahr angekündigte Avalanche-Treasury-Strategie von AVAX One in Höhe von 550 Millionen US-Dollar.
- Lawinenpreise sind wieder auf dem Niveau, das vor…","AVAX One launches CEO search after leader of its Avalanche treasury pivot steps down. AVAX One launches CEO search after leader of its Avalanche treasury pivot steps down
Quick Take
- SkyBridge founder Anthony Scaramucci backed AVAX One’s $550 million Avalanche treasury strategy announced last year.
- Avalanche prices are back to levels seen a…","AVAX One excussionem movet CEO postquam dux aerarii sui Avalanche gradus descendit. AVAX One launches CEO inquisitionem cum duce aerarii sui Avalanche vestigia descendentium
Velox Take
- SkyBridge conditor Antonius Scaramucci subnixus AVAX One$550 miliones Avalanche aerarium consiliorum proximo anno denuntiavit.
- Avalanche prices sunt retro ad gradus visa a…",2026-07-10 23:06:37+00:00
73f8bfe9bbb9573ee34525aa45714c4f,2026-07-09T10:57:00Z,'avalanche warning system',economictimes.indiatimes.com,en,0.3,"Wayanad Landslides: The hills are alive, but have a warning","Wayanad faces escalating ecological crises and deadly landslides. Recent disasters highlight unscientific development and policy conflicts. Heavy rains saturate porous soil, causing catastrophic hillside liquefaction. Infrastructure projects destabilize the m…",https://economictimes.indiatimes.com/news/india/why-keralas-wayanad-keeps-getting-hit-by-landslides-explained/articleshow/132283868.cms,"https://img.etimg.com/thumb/msid-132284399,width-1200,height-630,imgsize-238202,overlay-economictimes/articleshow.jpg",http://web.archive.org/web/20260710035204/https://economictimes.indiatimes.com/news/india/why-keralas-wayanad-keeps-getting-hit-by-landslides-explained/articleshow/132283868.cms,"Wayanad is a landscape structurally holding its breath. For anyone tracking the changing terrain of the Western Ghats, this picturesque high-range district in Kerala has rapidly transitioned from a m… [+6507 chars]",,"Erdrutsche in Wayanad: Die Hügel leben, aber es gibt eine Warnung. Wayanad ist mit eskalierenden Umweltkrisen und tödlichen Erdrutschen konfrontiert. Die jüngsten Katastrophen machen unwissenschaftliche Entwicklungen und politische Konflikte deutlich. Starke Regenfälle sättigen porösen Boden und führen zu einer katastrophalen Verflüssigung der Hänge. Infrastrukturprojekte destabilisieren die Welt","Wayanad Landslides: The hills are alive, but have a warning. Wayanad faces escalating ecological crises and deadly landslides. Recent disasters highlight unscientific development and policy conflicts. Heavy rains saturate porous soil, causing catastrophic hillside liquefaction. Infrastructure projects destabilize the m…","Wayanad Landslides: Montes vivunt, sed moniti sunt. Facies Wayanad escalating discrimina oecologica et mortifera proruit. Recentes calamitates progressionem et consilium indisciplinatum pugnas urgent. Imbres graves saturate solo raro, collis liquatio calamitosas efficiens. Infrastructuram incepta destabilitare m…",2026-07-11 06:22:43+00:00
